{"name":"db","desc":"","tables":[{"name":"batch","type":"BASE TABLE","comment":"Stores details about batches (processes that run in…","columns":[{"name":"bid","type":"int(10) unsigned","nullable":false,"default":null,"comment":"Primary Key: Unique batch ID."},{"name":"token","type":"varchar(64)","nullable":false,"default":null,"comment":"A string token generated against the current user's session id and the batch id, used to ensure that only the user who submitted the batch can effectively access it."},{"name":"timestamp","type":"int(11)","nullable":false,"default":null,"comment":"A Unix timestamp indicating when this batch was submitted for processing. Stale batches are purged at cron time."},{"name":"batch","type":"longblob","nullable":true,"default":"NULL","comment":"A serialized array containing the processing data for the batch."}],"indexes":[{"name":"token","def":"KEY token (token) USING BTREE","table":"batch","columns":["token"],"comment":""},{"name":"PRIMARY","def":"PRIMARY KEY (bid) USING BTREE","table":"batch","columns":["bid"],"comment":""}],"constraints":[{"name":"PRIMARY","type":"PRIMARY KEY","def":"PRIMARY KEY (bid)","table":"batch","referenced_table":null,"columns":["bid"],"referenced_columns":null,"comment":""}],"triggers":[],"def":"CREATE TABLE `batch` (\n  `bid` int(10) unsigned NOT NULL COMMENT 'Primary Key: Unique batch ID.',\n  `token` varchar(64) CHARACTER SET ascii COLLATE ascii_general_ci NOT NULL COMMENT 'A string token generated against the current user''s session id and the batch id, used to ensure that only the user who submitted the batch can effectively access it.',\n  `timestamp` int(11) NOT NULL COMMENT 'A Unix timestamp indicating when this batch was submitted for processing. Stale batches are purged at cron time.',\n  `batch` longblob DEFAULT NULL COMMENT 'A serialized array containing the processing data for the batch.',\n  PRIMARY KEY (`bid`),\n  KEY `token` (`token`)\n) ENGINE=InnoDB DEFAULT CHARSET=utf8mb4 COLLATE=utf8mb4_general_ci COMMENT='Stores details about batches (processes that run in…'"},{"name":"block_content","type":"BASE TABLE","comment":"The base table for block_content entities.","columns":[{"name":"id","type":"int(10) unsigned","nullable":false,"default":null,"comment":"","extra_def":"auto_increment"},{"name":"revision_id","type":"int(10) unsigned","nullable":true,"default":"NULL","comment":""},{"name":"type","type":"varchar(32)","nullable":false,"default":null,"comment":"The ID of the target entity."},{"name":"uuid","type":"varchar(128)","nullable":false,"default":null,"comment":""},{"name":"langcode","type":"varchar(12)","nullable":false,"default":null,"comment":""}],"indexes":[{"name":"block_content_field__type__target_id","def":"KEY block_content_field__type__target_id (type) USING BTREE","table":"block_content","columns":["type"],"comment":""},{"name":"PRIMARY","def":"PRIMARY KEY (id) USING BTREE","table":"block_content","columns":["id"],"comment":""},{"name":"block_content_field__uuid__value","def":"UNIQUE KEY block_content_field__uuid__value (uuid) USING BTREE","table":"block_content","columns":["uuid"],"comment":""},{"name":"block_content__revision_id","def":"UNIQUE KEY block_content__revision_id (revision_id) USING BTREE","table":"block_content","columns":["revision_id"],"comment":""}],"constraints":[{"name":"block_content_field__uuid__value","type":"UNIQUE","def":"UNIQUE KEY block_content_field__uuid__value (uuid)","table":"block_content","referenced_table":null,"columns":["uuid"],"referenced_columns":null,"comment":""},{"name":"block_content__revision_id","type":"UNIQUE","def":"UNIQUE KEY block_content__revision_id (revision_id)","table":"block_content","referenced_table":null,"columns":["revision_id"],"referenced_columns":null,"comment":""},{"name":"PRIMARY","type":"PRIMARY KEY","def":"PRIMARY KEY (id)","table":"block_content","referenced_table":null,"columns":["id"],"referenced_columns":null,"comment":""}],"triggers":[],"def":"CREATE TABLE `block_content` (\n  `id` int(10) unsigned NOT NULL AUTO_INCREMENT,\n  `revision_id` int(10) unsigned DEFAULT NULL,\n  `type` varchar(32) CHARACTER SET ascii COLLATE ascii_general_ci NOT NULL COMMENT 'The ID of the target entity.',\n  `uuid` varchar(128) CHARACTER SET ascii COLLATE ascii_general_ci NOT NULL,\n  `langcode` varchar(12) CHARACTER SET ascii COLLATE ascii_general_ci NOT NULL,\n  PRIMARY KEY (`id`),\n  UNIQUE KEY `block_content_field__uuid__value` (`uuid`),\n  UNIQUE KEY `block_content__revision_id` (`revision_id`),\n  KEY `block_content_field__type__target_id` (`type`)\n) ENGINE=InnoDB AUTO_INCREMENT=[Redacted by tbls] DEFAULT CHARSET=utf8mb4 COLLATE=utf8mb4_general_ci COMMENT='The base table for block_content entities.'"},{"name":"block_content_field_data","type":"BASE TABLE","comment":"The data table for block_content entities.","columns":[{"name":"id","type":"int(10) unsigned","nullable":false,"default":null,"comment":""},{"name":"revision_id","type":"int(10) unsigned","nullable":false,"default":null,"comment":""},{"name":"type","type":"varchar(32)","nullable":false,"default":null,"comment":"The ID of the target entity."},{"name":"langcode","type":"varchar(12)","nullable":false,"default":null,"comment":""},{"name":"status","type":"tinyint(4)","nullable":false,"default":null,"comment":""},{"name":"info","type":"varchar(255)","nullable":true,"default":"NULL","comment":""},{"name":"changed","type":"int(11)","nullable":true,"default":"NULL","comment":""},{"name":"reusable","type":"tinyint(4)","nullable":true,"default":"NULL","comment":""},{"name":"default_langcode","type":"tinyint(4)","nullable":false,"default":null,"comment":""},{"name":"revision_translation_affected","type":"tinyint(4)","nullable":true,"default":"NULL","comment":""}],"indexes":[{"name":"block_content_field__type__target_id","def":"KEY block_content_field__type__target_id (type) USING BTREE","table":"block_content_field_data","columns":["type"],"comment":""},{"name":"block_content__id__default_langcode__langcode","def":"KEY block_content__id__default_langcode__langcode (id, default_langcode, langcode) USING BTREE","table":"block_content_field_data","columns":["id","default_langcode","langcode"],"comment":""},{"name":"block_content__revision_id","def":"KEY block_content__revision_id (revision_id) USING BTREE","table":"block_content_field_data","columns":["revision_id"],"comment":""},{"name":"block_content__status_type","def":"KEY block_content__status_type (status, type, id) USING BTREE","table":"block_content_field_data","columns":["status","type","id"],"comment":""},{"name":"PRIMARY","def":"PRIMARY KEY (id, langcode) USING BTREE","table":"block_content_field_data","columns":["id","langcode"],"comment":""}],"constraints":[{"name":"PRIMARY","type":"PRIMARY KEY","def":"PRIMARY KEY (id, langcode)","table":"block_content_field_data","referenced_table":null,"columns":["id","langcode"],"referenced_columns":null,"comment":""}],"triggers":[],"def":"CREATE TABLE `block_content_field_data` (\n  `id` int(10) unsigned NOT NULL,\n  `revision_id` int(10) unsigned NOT NULL,\n  `type` varchar(32) CHARACTER SET ascii COLLATE ascii_general_ci NOT NULL COMMENT 'The ID of the target entity.',\n  `langcode` varchar(12) CHARACTER SET ascii COLLATE ascii_general_ci NOT NULL,\n  `status` tinyint(4) NOT NULL,\n  `info` varchar(255) DEFAULT NULL,\n  `changed` int(11) DEFAULT NULL,\n  `reusable` tinyint(4) DEFAULT NULL,\n  `default_langcode` tinyint(4) NOT NULL,\n  `revision_translation_affected` tinyint(4) DEFAULT NULL,\n  PRIMARY KEY (`id`,`langcode`),\n  KEY `block_content__id__default_langcode__langcode` (`id`,`default_langcode`,`langcode`),\n  KEY `block_content__revision_id` (`revision_id`),\n  KEY `block_content_field__type__target_id` (`type`),\n  KEY `block_content__status_type` (`status`,`type`,`id`)\n) ENGINE=InnoDB DEFAULT CHARSET=utf8mb4 COLLATE=utf8mb4_general_ci COMMENT='The data table for block_content entities.'"},{"name":"block_content_field_revision","type":"BASE TABLE","comment":"The revision data table for block_content entities.","columns":[{"name":"id","type":"int(10) unsigned","nullable":false,"default":null,"comment":""},{"name":"revision_id","type":"int(10) unsigned","nullable":false,"default":null,"comment":""},{"name":"langcode","type":"varchar(12)","nullable":false,"default":null,"comment":""},{"name":"status","type":"tinyint(4)","nullable":false,"default":null,"comment":""},{"name":"info","type":"varchar(255)","nullable":true,"default":"NULL","comment":""},{"name":"changed","type":"int(11)","nullable":true,"default":"NULL","comment":""},{"name":"default_langcode","type":"tinyint(4)","nullable":false,"default":null,"comment":""},{"name":"revision_translation_affected","type":"tinyint(4)","nullable":true,"default":"NULL","comment":""}],"indexes":[{"name":"block_content__id__default_langcode__langcode","def":"KEY block_content__id__default_langcode__langcode (id, default_langcode, langcode) USING BTREE","table":"block_content_field_revision","columns":["id","default_langcode","langcode"],"comment":""},{"name":"PRIMARY","def":"PRIMARY KEY (revision_id, langcode) USING BTREE","table":"block_content_field_revision","columns":["revision_id","langcode"],"comment":""}],"constraints":[{"name":"PRIMARY","type":"PRIMARY KEY","def":"PRIMARY KEY (revision_id, langcode)","table":"block_content_field_revision","referenced_table":null,"columns":["revision_id","langcode"],"referenced_columns":null,"comment":""}],"triggers":[],"def":"CREATE TABLE `block_content_field_revision` (\n  `id` int(10) unsigned NOT NULL,\n  `revision_id` int(10) unsigned NOT NULL,\n  `langcode` varchar(12) CHARACTER SET ascii COLLATE ascii_general_ci NOT NULL,\n  `status` tinyint(4) NOT NULL,\n  `info` varchar(255) DEFAULT NULL,\n  `changed` int(11) DEFAULT NULL,\n  `default_langcode` tinyint(4) NOT NULL,\n  `revision_translation_affected` tinyint(4) DEFAULT NULL,\n  PRIMARY KEY (`revision_id`,`langcode`),\n  KEY `block_content__id__default_langcode__langcode` (`id`,`default_langcode`,`langcode`)\n) ENGINE=InnoDB DEFAULT CHARSET=utf8mb4 COLLATE=utf8mb4_general_ci COMMENT='The revision data table for block_content entities.'"},{"name":"block_content_revision","type":"BASE TABLE","comment":"The revision table for block_content entities.","columns":[{"name":"id","type":"int(10) unsigned","nullable":false,"default":null,"comment":""},{"name":"revision_id","type":"int(10) unsigned","nullable":false,"default":null,"comment":"","extra_def":"auto_increment"},{"name":"langcode","type":"varchar(12)","nullable":false,"default":null,"comment":""},{"name":"revision_user","type":"int(10) unsigned","nullable":true,"default":"NULL","comment":"The ID of the target entity."},{"name":"revision_created","type":"int(11)","nullable":true,"default":"NULL","comment":""},{"name":"revision_log","type":"longtext","nullable":true,"default":"NULL","comment":""},{"name":"revision_default","type":"tinyint(4)","nullable":true,"default":"NULL","comment":""}],"indexes":[{"name":"block_content_field__revision_user__target_id","def":"KEY block_content_field__revision_user__target_id (revision_user) USING BTREE","table":"block_content_revision","columns":["revision_user"],"comment":""},{"name":"block_content__id","def":"KEY block_content__id (id) USING BTREE","table":"block_content_revision","columns":["id"],"comment":""},{"name":"PRIMARY","def":"PRIMARY KEY (revision_id) USING BTREE","table":"block_content_revision","columns":["revision_id"],"comment":""}],"constraints":[{"name":"PRIMARY","type":"PRIMARY KEY","def":"PRIMARY KEY (revision_id)","table":"block_content_revision","referenced_table":null,"columns":["revision_id"],"referenced_columns":null,"comment":""}],"triggers":[],"def":"CREATE TABLE `block_content_revision` (\n  `id` int(10) unsigned NOT NULL,\n  `revision_id` int(10) unsigned NOT NULL AUTO_INCREMENT,\n  `langcode` varchar(12) CHARACTER SET ascii COLLATE ascii_general_ci NOT NULL,\n  `revision_user` int(10) unsigned DEFAULT NULL COMMENT 'The ID of the target entity.',\n  `revision_created` int(11) DEFAULT NULL,\n  `revision_log` longtext DEFAULT NULL,\n  `revision_default` tinyint(4) DEFAULT NULL,\n  PRIMARY KEY (`revision_id`),\n  KEY `block_content__id` (`id`),\n  KEY `block_content_field__revision_user__target_id` (`revision_user`)\n) ENGINE=InnoDB AUTO_INCREMENT=[Redacted by tbls] DEFAULT CHARSET=utf8mb4 COLLATE=utf8mb4_general_ci COMMENT='The revision table for block_content entities.'"},{"name":"block_content_revision__body","type":"BASE TABLE","comment":"Revision archive storage for block_content field body.","columns":[{"name":"bundle","type":"varchar(128)","nullable":false,"default":"''","comment":"The field instance bundle to which this row belongs, used when deleting a field instance"},{"name":"deleted","type":"tinyint(4)","nullable":false,"default":"0","comment":"A boolean indicating whether this data item has been deleted"},{"name":"entity_id","type":"int(10) unsigned","nullable":false,"default":null,"comment":"The entity id this data is attached to"},{"name":"revision_id","type":"int(10) unsigned","nullable":false,"default":null,"comment":"The entity revision id this data is attached to"},{"name":"langcode","type":"varchar(32)","nullable":false,"default":"''","comment":"The language code for this data item."},{"name":"delta","type":"int(10) unsigned","nullable":false,"default":null,"comment":"The sequence number for this data item, used for multi-value fields"},{"name":"body_value","type":"longtext","nullable":false,"default":null,"comment":""},{"name":"body_summary","type":"longtext","nullable":true,"default":"NULL","comment":""},{"name":"body_format","type":"varchar(255)","nullable":true,"default":"NULL","comment":""}],"indexes":[{"name":"body_format","def":"KEY body_format (body_format) USING BTREE","table":"block_content_revision__body","columns":["body_format"],"comment":""},{"name":"bundle","def":"KEY bundle (bundle) USING BTREE","table":"block_content_revision__body","columns":["bundle"],"comment":""},{"name":"revision_id","def":"KEY revision_id (revision_id) USING BTREE","table":"block_content_revision__body","columns":["revision_id"],"comment":""},{"name":"PRIMARY","def":"PRIMARY KEY (entity_id, revision_id, deleted, delta, langcode) USING BTREE","table":"block_content_revision__body","columns":["entity_id","revision_id","deleted","delta","langcode"],"comment":""}],"constraints":[{"name":"PRIMARY","type":"PRIMARY KEY","def":"PRIMARY KEY (entity_id, revision_id, deleted, delta, langcode)","table":"block_content_revision__body","referenced_table":null,"columns":["entity_id","revision_id","deleted","delta","langcode"],"referenced_columns":null,"comment":""}],"triggers":[],"def":"CREATE TABLE `block_content_revision__body` (\n  `bundle` varchar(128) CHARACTER SET ascii COLLATE ascii_general_ci NOT NULL DEFAULT '' COMMENT 'The field instance bundle to which this row belongs, used when deleting a field instance',\n  `deleted` tinyint(4) NOT NULL DEFAULT 0 COMMENT 'A boolean indicating whether this data item has been deleted',\n  `entity_id` int(10) unsigned NOT NULL COMMENT 'The entity id this data is attached to',\n  `revision_id` int(10) unsigned NOT NULL COMMENT 'The entity revision id this data is attached to',\n  `langcode` varchar(32) CHARACTER SET ascii COLLATE ascii_general_ci NOT NULL DEFAULT '' COMMENT 'The language code for this data item.',\n  `delta` int(10) unsigned NOT NULL COMMENT 'The sequence number for this data item, used for multi-value fields',\n  `body_value` longtext NOT NULL,\n  `body_summary` longtext DEFAULT NULL,\n  `body_format` varchar(255) CHARACTER SET ascii COLLATE ascii_general_ci DEFAULT NULL,\n  PRIMARY KEY (`entity_id`,`revision_id`,`deleted`,`delta`,`langcode`),\n  KEY `bundle` (`bundle`),\n  KEY `revision_id` (`revision_id`),\n  KEY `body_format` (`body_format`)\n) ENGINE=InnoDB DEFAULT CHARSET=utf8mb4 COLLATE=utf8mb4_general_ci COMMENT='Revision archive storage for block_content field body.'"},{"name":"block_content__body","type":"BASE TABLE","comment":"Data storage for block_content field body.","columns":[{"name":"bundle","type":"varchar(128)","nullable":false,"default":"''","comment":"The field instance bundle to which this row belongs, used when deleting a field instance"},{"name":"deleted","type":"tinyint(4)","nullable":false,"default":"0","comment":"A boolean indicating whether this data item has been deleted"},{"name":"entity_id","type":"int(10) unsigned","nullable":false,"default":null,"comment":"The entity id this data is attached to"},{"name":"revision_id","type":"int(10) unsigned","nullable":false,"default":null,"comment":"The entity revision id this data is attached to"},{"name":"langcode","type":"varchar(32)","nullable":false,"default":"''","comment":"The language code for this data item."},{"name":"delta","type":"int(10) unsigned","nullable":false,"default":null,"comment":"The sequence number for this data item, used for multi-value fields"},{"name":"body_value","type":"longtext","nullable":false,"default":null,"comment":""},{"name":"body_summary","type":"longtext","nullable":true,"default":"NULL","comment":""},{"name":"body_format","type":"varchar(255)","nullable":true,"default":"NULL","comment":""}],"indexes":[{"name":"body_format","def":"KEY body_format (body_format) USING BTREE","table":"block_content__body","columns":["body_format"],"comment":""},{"name":"bundle","def":"KEY bundle (bundle) USING BTREE","table":"block_content__body","columns":["bundle"],"comment":""},{"name":"revision_id","def":"KEY revision_id (revision_id) USING BTREE","table":"block_content__body","columns":["revision_id"],"comment":""},{"name":"PRIMARY","def":"PRIMARY KEY (entity_id, deleted, delta, langcode) USING BTREE","table":"block_content__body","columns":["entity_id","deleted","delta","langcode"],"comment":""}],"constraints":[{"name":"PRIMARY","type":"PRIMARY KEY","def":"PRIMARY KEY (entity_id, deleted, delta, langcode)","table":"block_content__body","referenced_table":null,"columns":["entity_id","deleted","delta","langcode"],"referenced_columns":null,"comment":""}],"triggers":[],"def":"CREATE TABLE `block_content__body` (\n  `bundle` varchar(128) CHARACTER SET ascii COLLATE ascii_general_ci NOT NULL DEFAULT '' COMMENT 'The field instance bundle to which this row belongs, used when deleting a field instance',\n  `deleted` tinyint(4) NOT NULL DEFAULT 0 COMMENT 'A boolean indicating whether this data item has been deleted',\n  `entity_id` int(10) unsigned NOT NULL COMMENT 'The entity id this data is attached to',\n  `revision_id` int(10) unsigned NOT NULL COMMENT 'The entity revision id this data is attached to',\n  `langcode` varchar(32) CHARACTER SET ascii COLLATE ascii_general_ci NOT NULL DEFAULT '' COMMENT 'The language code for this data item.',\n  `delta` int(10) unsigned NOT NULL COMMENT 'The sequence number for this data item, used for multi-value fields',\n  `body_value` longtext NOT NULL,\n  `body_summary` longtext DEFAULT NULL,\n  `body_format` varchar(255) CHARACTER SET ascii COLLATE ascii_general_ci DEFAULT NULL,\n  PRIMARY KEY (`entity_id`,`deleted`,`delta`,`langcode`),\n  KEY `bundle` (`bundle`),\n  KEY `revision_id` (`revision_id`),\n  KEY `body_format` (`body_format`)\n) ENGINE=InnoDB DEFAULT CHARSET=utf8mb4 COLLATE=utf8mb4_general_ci COMMENT='Data storage for block_content field body.'"},{"name":"cachetags","type":"BASE TABLE","comment":"Cache table for tracking cache tag invalidations.","columns":[{"name":"tag","type":"varchar(255)","nullable":false,"default":"''","comment":"Namespace-prefixed tag string."},{"name":"invalidations","type":"int(11)","nullable":false,"default":"0","comment":"Number incremented when the tag is invalidated."}],"indexes":[{"name":"PRIMARY","def":"PRIMARY KEY (tag) USING BTREE","table":"cachetags","columns":["tag"],"comment":""}],"constraints":[{"name":"PRIMARY","type":"PRIMARY KEY","def":"PRIMARY KEY (tag)","table":"cachetags","referenced_table":null,"columns":["tag"],"referenced_columns":null,"comment":""}],"triggers":[],"def":"CREATE TABLE `cachetags` (\n  `tag` varchar(255) CHARACTER SET ascii COLLATE ascii_general_ci NOT NULL DEFAULT '' COMMENT 'Namespace-prefixed tag string.',\n  `invalidations` int(11) NOT NULL DEFAULT 0 COMMENT 'Number incremented when the tag is invalidated.',\n  PRIMARY KEY (`tag`)\n) ENGINE=InnoDB DEFAULT CHARSET=utf8mb4 COLLATE=utf8mb4_general_ci COMMENT='Cache table for tracking cache tag invalidations.'"},{"name":"cache_bootstrap","type":"BASE TABLE","comment":"Storage for the cache API.","columns":[{"name":"cid","type":"varchar(255)","nullable":false,"default":"''","comment":"Primary Key: Unique cache ID."},{"name":"data","type":"longblob","nullable":true,"default":"NULL","comment":"A collection of data to cache."},{"name":"expire","type":"int(11)","nullable":false,"default":"0","comment":"A Unix timestamp indicating when the cache entry should expire, or -1 for never."},{"name":"created","type":"decimal(14,3)","nullable":false,"default":"0.000","comment":"A timestamp with millisecond precision indicating when the cache entry was created."},{"name":"serialized","type":"smallint(6)","nullable":false,"default":"0","comment":"A flag to indicate whether content is serialized (1) or not (0)."},{"name":"tags","type":"longtext","nullable":true,"default":"NULL","comment":"Space-separated list of cache tags for this entry."},{"name":"checksum","type":"varchar(255)","nullable":false,"default":null,"comment":"The tag invalidation checksum when this entry was saved."}],"indexes":[{"name":"created","def":"KEY created (created) USING BTREE","table":"cache_bootstrap","columns":["created"],"comment":""},{"name":"expire","def":"KEY expire (expire) USING BTREE","table":"cache_bootstrap","columns":["expire"],"comment":""},{"name":"PRIMARY","def":"PRIMARY KEY (cid) USING BTREE","table":"cache_bootstrap","columns":["cid"],"comment":""}],"constraints":[{"name":"PRIMARY","type":"PRIMARY KEY","def":"PRIMARY KEY (cid)","table":"cache_bootstrap","referenced_table":null,"columns":["cid"],"referenced_columns":null,"comment":""}],"triggers":[],"def":"CREATE TABLE `cache_bootstrap` (\n  `cid` varchar(255) CHARACTER SET ascii COLLATE ascii_bin NOT NULL DEFAULT '' COMMENT 'Primary Key: Unique cache ID.',\n  `data` longblob DEFAULT NULL COMMENT 'A collection of data to cache.',\n  `expire` int(11) NOT NULL DEFAULT 0 COMMENT 'A Unix timestamp indicating when the cache entry should expire, or -1 for never.',\n  `created` decimal(14,3) NOT NULL DEFAULT 0.000 COMMENT 'A timestamp with millisecond precision indicating when the cache entry was created.',\n  `serialized` smallint(6) NOT NULL DEFAULT 0 COMMENT 'A flag to indicate whether content is serialized (1) or not (0).',\n  `tags` longtext DEFAULT NULL COMMENT 'Space-separated list of cache tags for this entry.',\n  `checksum` varchar(255) CHARACTER SET ascii COLLATE ascii_general_ci NOT NULL COMMENT 'The tag invalidation checksum when this entry was saved.',\n  PRIMARY KEY (`cid`),\n  KEY `expire` (`expire`),\n  KEY `created` (`created`)\n) ENGINE=InnoDB DEFAULT CHARSET=utf8mb4 COLLATE=utf8mb4_general_ci COMMENT='Storage for the cache API.'"},{"name":"cache_config","type":"BASE TABLE","comment":"Storage for the cache API.","columns":[{"name":"cid","type":"varchar(255)","nullable":false,"default":"''","comment":"Primary Key: Unique cache ID."},{"name":"data","type":"longblob","nullable":true,"default":"NULL","comment":"A collection of data to cache."},{"name":"expire","type":"int(11)","nullable":false,"default":"0","comment":"A Unix timestamp indicating when the cache entry should expire, or -1 for never."},{"name":"created","type":"decimal(14,3)","nullable":false,"default":"0.000","comment":"A timestamp with millisecond precision indicating when the cache entry was created."},{"name":"serialized","type":"smallint(6)","nullable":false,"default":"0","comment":"A flag to indicate whether content is serialized (1) or not (0)."},{"name":"tags","type":"longtext","nullable":true,"default":"NULL","comment":"Space-separated list of cache tags for this entry."},{"name":"checksum","type":"varchar(255)","nullable":false,"default":null,"comment":"The tag invalidation checksum when this entry was saved."}],"indexes":[{"name":"created","def":"KEY created (created) USING BTREE","table":"cache_config","columns":["created"],"comment":""},{"name":"expire","def":"KEY expire (expire) USING BTREE","table":"cache_config","columns":["expire"],"comment":""},{"name":"PRIMARY","def":"PRIMARY KEY (cid) USING BTREE","table":"cache_config","columns":["cid"],"comment":""}],"constraints":[{"name":"PRIMARY","type":"PRIMARY KEY","def":"PRIMARY KEY (cid)","table":"cache_config","referenced_table":null,"columns":["cid"],"referenced_columns":null,"comment":""}],"triggers":[],"def":"CREATE TABLE `cache_config` (\n  `cid` varchar(255) CHARACTER SET ascii COLLATE ascii_bin NOT NULL DEFAULT '' COMMENT 'Primary Key: Unique cache ID.',\n  `data` longblob DEFAULT NULL COMMENT 'A collection of data to cache.',\n  `expire` int(11) NOT NULL DEFAULT 0 COMMENT 'A Unix timestamp indicating when the cache entry should expire, or -1 for never.',\n  `created` decimal(14,3) NOT NULL DEFAULT 0.000 COMMENT 'A timestamp with millisecond precision indicating when the cache entry was created.',\n  `serialized` smallint(6) NOT NULL DEFAULT 0 COMMENT 'A flag to indicate whether content is serialized (1) or not (0).',\n  `tags` longtext DEFAULT NULL COMMENT 'Space-separated list of cache tags for this entry.',\n  `checksum` varchar(255) CHARACTER SET ascii COLLATE ascii_general_ci NOT NULL COMMENT 'The tag invalidation checksum when this entry was saved.',\n  PRIMARY KEY (`cid`),\n  KEY `expire` (`expire`),\n  KEY `created` (`created`)\n) ENGINE=InnoDB DEFAULT CHARSET=utf8mb4 COLLATE=utf8mb4_general_ci COMMENT='Storage for the cache API.'"},{"name":"cache_container","type":"BASE TABLE","comment":"Storage for the cache API.","columns":[{"name":"cid","type":"varchar(255)","nullable":false,"default":"''","comment":"Primary Key: Unique cache ID."},{"name":"data","type":"longblob","nullable":true,"default":"NULL","comment":"A collection of data to cache."},{"name":"expire","type":"int(11)","nullable":false,"default":"0","comment":"A Unix timestamp indicating when the cache entry should expire, or -1 for never."},{"name":"created","type":"decimal(14,3)","nullable":false,"default":"0.000","comment":"A timestamp with millisecond precision indicating when the cache entry was created."},{"name":"serialized","type":"smallint(6)","nullable":false,"default":"0","comment":"A flag to indicate whether content is serialized (1) or not (0)."},{"name":"tags","type":"longtext","nullable":true,"default":"NULL","comment":"Space-separated list of cache tags for this entry."},{"name":"checksum","type":"varchar(255)","nullable":false,"default":null,"comment":"The tag invalidation checksum when this entry was saved."}],"indexes":[{"name":"created","def":"KEY created (created) USING BTREE","table":"cache_container","columns":["created"],"comment":""},{"name":"expire","def":"KEY expire (expire) USING BTREE","table":"cache_container","columns":["expire"],"comment":""},{"name":"PRIMARY","def":"PRIMARY KEY (cid) USING BTREE","table":"cache_container","columns":["cid"],"comment":""}],"constraints":[{"name":"PRIMARY","type":"PRIMARY KEY","def":"PRIMARY KEY (cid)","table":"cache_container","referenced_table":null,"columns":["cid"],"referenced_columns":null,"comment":""}],"triggers":[],"def":"CREATE TABLE `cache_container` (\n  `cid` varchar(255) CHARACTER SET ascii COLLATE ascii_bin NOT NULL DEFAULT '' COMMENT 'Primary Key: Unique cache ID.',\n  `data` longblob DEFAULT NULL COMMENT 'A collection of data to cache.',\n  `expire` int(11) NOT NULL DEFAULT 0 COMMENT 'A Unix timestamp indicating when the cache entry should expire, or -1 for never.',\n  `created` decimal(14,3) NOT NULL DEFAULT 0.000 COMMENT 'A timestamp with millisecond precision indicating when the cache entry was created.',\n  `serialized` smallint(6) NOT NULL DEFAULT 0 COMMENT 'A flag to indicate whether content is serialized (1) or not (0).',\n  `tags` longtext DEFAULT NULL COMMENT 'Space-separated list of cache tags for this entry.',\n  `checksum` varchar(255) CHARACTER SET ascii COLLATE ascii_general_ci NOT NULL COMMENT 'The tag invalidation checksum when this entry was saved.',\n  PRIMARY KEY (`cid`),\n  KEY `expire` (`expire`),\n  KEY `created` (`created`)\n) ENGINE=InnoDB DEFAULT CHARSET=utf8mb4 COLLATE=utf8mb4_general_ci COMMENT='Storage for the cache API.'"},{"name":"cache_data","type":"BASE TABLE","comment":"Storage for the cache API.","columns":[{"name":"cid","type":"varchar(255)","nullable":false,"default":"''","comment":"Primary Key: Unique cache ID."},{"name":"data","type":"longblob","nullable":true,"default":"NULL","comment":"A collection of data to cache."},{"name":"expire","type":"int(11)","nullable":false,"default":"0","comment":"A Unix timestamp indicating when the cache entry should expire, or -1 for never."},{"name":"created","type":"decimal(14,3)","nullable":false,"default":"0.000","comment":"A timestamp with millisecond precision indicating when the cache entry was created."},{"name":"serialized","type":"smallint(6)","nullable":false,"default":"0","comment":"A flag to indicate whether content is serialized (1) or not (0)."},{"name":"tags","type":"longtext","nullable":true,"default":"NULL","comment":"Space-separated list of cache tags for this entry."},{"name":"checksum","type":"varchar(255)","nullable":false,"default":null,"comment":"The tag invalidation checksum when this entry was saved."}],"indexes":[{"name":"created","def":"KEY created (created) USING BTREE","table":"cache_data","columns":["created"],"comment":""},{"name":"expire","def":"KEY expire (expire) USING BTREE","table":"cache_data","columns":["expire"],"comment":""},{"name":"PRIMARY","def":"PRIMARY KEY (cid) USING BTREE","table":"cache_data","columns":["cid"],"comment":""}],"constraints":[{"name":"PRIMARY","type":"PRIMARY KEY","def":"PRIMARY KEY (cid)","table":"cache_data","referenced_table":null,"columns":["cid"],"referenced_columns":null,"comment":""}],"triggers":[],"def":"CREATE TABLE `cache_data` (\n  `cid` varchar(255) CHARACTER SET ascii COLLATE ascii_bin NOT NULL DEFAULT '' COMMENT 'Primary Key: Unique cache ID.',\n  `data` longblob DEFAULT NULL COMMENT 'A collection of data to cache.',\n  `expire` int(11) NOT NULL DEFAULT 0 COMMENT 'A Unix timestamp indicating when the cache entry should expire, or -1 for never.',\n  `created` decimal(14,3) NOT NULL DEFAULT 0.000 COMMENT 'A timestamp with millisecond precision indicating when the cache entry was created.',\n  `serialized` smallint(6) NOT NULL DEFAULT 0 COMMENT 'A flag to indicate whether content is serialized (1) or not (0).',\n  `tags` longtext DEFAULT NULL COMMENT 'Space-separated list of cache tags for this entry.',\n  `checksum` varchar(255) CHARACTER SET ascii COLLATE ascii_general_ci NOT NULL COMMENT 'The tag invalidation checksum when this entry was saved.',\n  PRIMARY KEY (`cid`),\n  KEY `expire` (`expire`),\n  KEY `created` (`created`)\n) ENGINE=InnoDB DEFAULT CHARSET=utf8mb4 COLLATE=utf8mb4_general_ci COMMENT='Storage for the cache API.'"},{"name":"cache_default","type":"BASE TABLE","comment":"Storage for the cache API.","columns":[{"name":"cid","type":"varchar(255)","nullable":false,"default":"''","comment":"Primary Key: Unique cache ID."},{"name":"data","type":"longblob","nullable":true,"default":"NULL","comment":"A collection of data to cache."},{"name":"expire","type":"int(11)","nullable":false,"default":"0","comment":"A Unix timestamp indicating when the cache entry should expire, or -1 for never."},{"name":"created","type":"decimal(14,3)","nullable":false,"default":"0.000","comment":"A timestamp with millisecond precision indicating when the cache entry was created."},{"name":"serialized","type":"smallint(6)","nullable":false,"default":"0","comment":"A flag to indicate whether content is serialized (1) or not (0)."},{"name":"tags","type":"longtext","nullable":true,"default":"NULL","comment":"Space-separated list of cache tags for this entry."},{"name":"checksum","type":"varchar(255)","nullable":false,"default":null,"comment":"The tag invalidation checksum when this entry was saved."}],"indexes":[{"name":"created","def":"KEY created (created) USING BTREE","table":"cache_default","columns":["created"],"comment":""},{"name":"expire","def":"KEY expire (expire) USING BTREE","table":"cache_default","columns":["expire"],"comment":""},{"name":"PRIMARY","def":"PRIMARY KEY (cid) USING BTREE","table":"cache_default","columns":["cid"],"comment":""}],"constraints":[{"name":"PRIMARY","type":"PRIMARY KEY","def":"PRIMARY KEY (cid)","table":"cache_default","referenced_table":null,"columns":["cid"],"referenced_columns":null,"comment":""}],"triggers":[],"def":"CREATE TABLE `cache_default` (\n  `cid` varchar(255) CHARACTER SET ascii COLLATE ascii_bin NOT NULL DEFAULT '' COMMENT 'Primary Key: Unique cache ID.',\n  `data` longblob DEFAULT NULL COMMENT 'A collection of data to cache.',\n  `expire` int(11) NOT NULL DEFAULT 0 COMMENT 'A Unix timestamp indicating when the cache entry should expire, or -1 for never.',\n  `created` decimal(14,3) NOT NULL DEFAULT 0.000 COMMENT 'A timestamp with millisecond precision indicating when the cache entry was created.',\n  `serialized` smallint(6) NOT NULL DEFAULT 0 COMMENT 'A flag to indicate whether content is serialized (1) or not (0).',\n  `tags` longtext DEFAULT NULL COMMENT 'Space-separated list of cache tags for this entry.',\n  `checksum` varchar(255) CHARACTER SET ascii COLLATE ascii_general_ci NOT NULL COMMENT 'The tag invalidation checksum when this entry was saved.',\n  PRIMARY KEY (`cid`),\n  KEY `expire` (`expire`),\n  KEY `created` (`created`)\n) ENGINE=InnoDB DEFAULT CHARSET=utf8mb4 COLLATE=utf8mb4_general_ci COMMENT='Storage for the cache API.'"},{"name":"cache_discovery","type":"BASE TABLE","comment":"Storage for the cache API.","columns":[{"name":"cid","type":"varchar(255)","nullable":false,"default":"''","comment":"Primary Key: Unique cache ID."},{"name":"data","type":"longblob","nullable":true,"default":"NULL","comment":"A collection of data to cache."},{"name":"expire","type":"int(11)","nullable":false,"default":"0","comment":"A Unix timestamp indicating when the cache entry should expire, or -1 for never."},{"name":"created","type":"decimal(14,3)","nullable":false,"default":"0.000","comment":"A timestamp with millisecond precision indicating when the cache entry was created."},{"name":"serialized","type":"smallint(6)","nullable":false,"default":"0","comment":"A flag to indicate whether content is serialized (1) or not (0)."},{"name":"tags","type":"longtext","nullable":true,"default":"NULL","comment":"Space-separated list of cache tags for this entry."},{"name":"checksum","type":"varchar(255)","nullable":false,"default":null,"comment":"The tag invalidation checksum when this entry was saved."}],"indexes":[{"name":"created","def":"KEY created (created) USING BTREE","table":"cache_discovery","columns":["created"],"comment":""},{"name":"expire","def":"KEY expire (expire) USING BTREE","table":"cache_discovery","columns":["expire"],"comment":""},{"name":"PRIMARY","def":"PRIMARY KEY (cid) USING BTREE","table":"cache_discovery","columns":["cid"],"comment":""}],"constraints":[{"name":"PRIMARY","type":"PRIMARY KEY","def":"PRIMARY KEY (cid)","table":"cache_discovery","referenced_table":null,"columns":["cid"],"referenced_columns":null,"comment":""}],"triggers":[],"def":"CREATE TABLE `cache_discovery` (\n  `cid` varchar(255) CHARACTER SET ascii COLLATE ascii_bin NOT NULL DEFAULT '' COMMENT 'Primary Key: Unique cache ID.',\n  `data` longblob DEFAULT NULL COMMENT 'A collection of data to cache.',\n  `expire` int(11) NOT NULL DEFAULT 0 COMMENT 'A Unix timestamp indicating when the cache entry should expire, or -1 for never.',\n  `created` decimal(14,3) NOT NULL DEFAULT 0.000 COMMENT 'A timestamp with millisecond precision indicating when the cache entry was created.',\n  `serialized` smallint(6) NOT NULL DEFAULT 0 COMMENT 'A flag to indicate whether content is serialized (1) or not (0).',\n  `tags` longtext DEFAULT NULL COMMENT 'Space-separated list of cache tags for this entry.',\n  `checksum` varchar(255) CHARACTER SET ascii COLLATE ascii_general_ci NOT NULL COMMENT 'The tag invalidation checksum when this entry was saved.',\n  PRIMARY KEY (`cid`),\n  KEY `expire` (`expire`),\n  KEY `created` (`created`)\n) ENGINE=InnoDB DEFAULT CHARSET=utf8mb4 COLLATE=utf8mb4_general_ci COMMENT='Storage for the cache API.'"},{"name":"cache_dynamic_page_cache","type":"BASE TABLE","comment":"Storage for the cache API.","columns":[{"name":"cid","type":"varchar(255)","nullable":false,"default":"''","comment":"Primary Key: Unique cache ID."},{"name":"data","type":"longblob","nullable":true,"default":"NULL","comment":"A collection of data to cache."},{"name":"expire","type":"int(11)","nullable":false,"default":"0","comment":"A Unix timestamp indicating when the cache entry should expire, or -1 for never."},{"name":"created","type":"decimal(14,3)","nullable":false,"default":"0.000","comment":"A timestamp with millisecond precision indicating when the cache entry was created."},{"name":"serialized","type":"smallint(6)","nullable":false,"default":"0","comment":"A flag to indicate whether content is serialized (1) or not (0)."},{"name":"tags","type":"longtext","nullable":true,"default":"NULL","comment":"Space-separated list of cache tags for this entry."},{"name":"checksum","type":"varchar(255)","nullable":false,"default":null,"comment":"The tag invalidation checksum when this entry was saved."}],"indexes":[{"name":"created","def":"KEY created (created) USING BTREE","table":"cache_dynamic_page_cache","columns":["created"],"comment":""},{"name":"expire","def":"KEY expire (expire) USING BTREE","table":"cache_dynamic_page_cache","columns":["expire"],"comment":""},{"name":"PRIMARY","def":"PRIMARY KEY (cid) USING BTREE","table":"cache_dynamic_page_cache","columns":["cid"],"comment":""}],"constraints":[{"name":"PRIMARY","type":"PRIMARY KEY","def":"PRIMARY KEY (cid)","table":"cache_dynamic_page_cache","referenced_table":null,"columns":["cid"],"referenced_columns":null,"comment":""}],"triggers":[],"def":"CREATE TABLE `cache_dynamic_page_cache` (\n  `cid` varchar(255) CHARACTER SET ascii COLLATE ascii_bin NOT NULL DEFAULT '' COMMENT 'Primary Key: Unique cache ID.',\n  `data` longblob DEFAULT NULL COMMENT 'A collection of data to cache.',\n  `expire` int(11) NOT NULL DEFAULT 0 COMMENT 'A Unix timestamp indicating when the cache entry should expire, or -1 for never.',\n  `created` decimal(14,3) NOT NULL DEFAULT 0.000 COMMENT 'A timestamp with millisecond precision indicating when the cache entry was created.',\n  `serialized` smallint(6) NOT NULL DEFAULT 0 COMMENT 'A flag to indicate whether content is serialized (1) or not (0).',\n  `tags` longtext DEFAULT NULL COMMENT 'Space-separated list of cache tags for this entry.',\n  `checksum` varchar(255) CHARACTER SET ascii COLLATE ascii_general_ci NOT NULL COMMENT 'The tag invalidation checksum when this entry was saved.',\n  PRIMARY KEY (`cid`),\n  KEY `expire` (`expire`),\n  KEY `created` (`created`)\n) ENGINE=InnoDB DEFAULT CHARSET=utf8mb4 COLLATE=utf8mb4_general_ci COMMENT='Storage for the cache API.'"},{"name":"cache_entity","type":"BASE TABLE","comment":"Storage for the cache API.","columns":[{"name":"cid","type":"varchar(255)","nullable":false,"default":"''","comment":"Primary Key: Unique cache ID."},{"name":"data","type":"longblob","nullable":true,"default":"NULL","comment":"A collection of data to cache."},{"name":"expire","type":"int(11)","nullable":false,"default":"0","comment":"A Unix timestamp indicating when the cache entry should expire, or -1 for never."},{"name":"created","type":"decimal(14,3)","nullable":false,"default":"0.000","comment":"A timestamp with millisecond precision indicating when the cache entry was created."},{"name":"serialized","type":"smallint(6)","nullable":false,"default":"0","comment":"A flag to indicate whether content is serialized (1) or not (0)."},{"name":"tags","type":"longtext","nullable":true,"default":"NULL","comment":"Space-separated list of cache tags for this entry."},{"name":"checksum","type":"varchar(255)","nullable":false,"default":null,"comment":"The tag invalidation checksum when this entry was saved."}],"indexes":[{"name":"created","def":"KEY created (created) USING BTREE","table":"cache_entity","columns":["created"],"comment":""},{"name":"expire","def":"KEY expire (expire) USING BTREE","table":"cache_entity","columns":["expire"],"comment":""},{"name":"PRIMARY","def":"PRIMARY KEY (cid) USING BTREE","table":"cache_entity","columns":["cid"],"comment":""}],"constraints":[{"name":"PRIMARY","type":"PRIMARY KEY","def":"PRIMARY KEY (cid)","table":"cache_entity","referenced_table":null,"columns":["cid"],"referenced_columns":null,"comment":""}],"triggers":[],"def":"CREATE TABLE `cache_entity` (\n  `cid` varchar(255) CHARACTER SET ascii COLLATE ascii_bin NOT NULL DEFAULT '' COMMENT 'Primary Key: Unique cache ID.',\n  `data` longblob DEFAULT NULL COMMENT 'A collection of data to cache.',\n  `expire` int(11) NOT NULL DEFAULT 0 COMMENT 'A Unix timestamp indicating when the cache entry should expire, or -1 for never.',\n  `created` decimal(14,3) NOT NULL DEFAULT 0.000 COMMENT 'A timestamp with millisecond precision indicating when the cache entry was created.',\n  `serialized` smallint(6) NOT NULL DEFAULT 0 COMMENT 'A flag to indicate whether content is serialized (1) or not (0).',\n  `tags` longtext DEFAULT NULL COMMENT 'Space-separated list of cache tags for this entry.',\n  `checksum` varchar(255) CHARACTER SET ascii COLLATE ascii_general_ci NOT NULL COMMENT 'The tag invalidation checksum when this entry was saved.',\n  PRIMARY KEY (`cid`),\n  KEY `expire` (`expire`),\n  KEY `created` (`created`)\n) ENGINE=InnoDB DEFAULT CHARSET=utf8mb4 COLLATE=utf8mb4_general_ci COMMENT='Storage for the cache API.'"},{"name":"cache_menu","type":"BASE TABLE","comment":"Storage for the cache API.","columns":[{"name":"cid","type":"varchar(255)","nullable":false,"default":"''","comment":"Primary Key: Unique cache ID."},{"name":"data","type":"longblob","nullable":true,"default":"NULL","comment":"A collection of data to cache."},{"name":"expire","type":"int(11)","nullable":false,"default":"0","comment":"A Unix timestamp indicating when the cache entry should expire, or -1 for never."},{"name":"created","type":"decimal(14,3)","nullable":false,"default":"0.000","comment":"A timestamp with millisecond precision indicating when the cache entry was created."},{"name":"serialized","type":"smallint(6)","nullable":false,"default":"0","comment":"A flag to indicate whether content is serialized (1) or not (0)."},{"name":"tags","type":"longtext","nullable":true,"default":"NULL","comment":"Space-separated list of cache tags for this entry."},{"name":"checksum","type":"varchar(255)","nullable":false,"default":null,"comment":"The tag invalidation checksum when this entry was saved."}],"indexes":[{"name":"created","def":"KEY created (created) USING BTREE","table":"cache_menu","columns":["created"],"comment":""},{"name":"expire","def":"KEY expire (expire) USING BTREE","table":"cache_menu","columns":["expire"],"comment":""},{"name":"PRIMARY","def":"PRIMARY KEY (cid) USING BTREE","table":"cache_menu","columns":["cid"],"comment":""}],"constraints":[{"name":"PRIMARY","type":"PRIMARY KEY","def":"PRIMARY KEY (cid)","table":"cache_menu","referenced_table":null,"columns":["cid"],"referenced_columns":null,"comment":""}],"triggers":[],"def":"CREATE TABLE `cache_menu` (\n  `cid` varchar(255) CHARACTER SET ascii COLLATE ascii_bin NOT NULL DEFAULT '' COMMENT 'Primary Key: Unique cache ID.',\n  `data` longblob DEFAULT NULL COMMENT 'A collection of data to cache.',\n  `expire` int(11) NOT NULL DEFAULT 0 COMMENT 'A Unix timestamp indicating when the cache entry should expire, or -1 for never.',\n  `created` decimal(14,3) NOT NULL DEFAULT 0.000 COMMENT 'A timestamp with millisecond precision indicating when the cache entry was created.',\n  `serialized` smallint(6) NOT NULL DEFAULT 0 COMMENT 'A flag to indicate whether content is serialized (1) or not (0).',\n  `tags` longtext DEFAULT NULL COMMENT 'Space-separated list of cache tags for this entry.',\n  `checksum` varchar(255) CHARACTER SET ascii COLLATE ascii_general_ci NOT NULL COMMENT 'The tag invalidation checksum when this entry was saved.',\n  PRIMARY KEY (`cid`),\n  KEY `expire` (`expire`),\n  KEY `created` (`created`)\n) ENGINE=InnoDB DEFAULT CHARSET=utf8mb4 COLLATE=utf8mb4_general_ci COMMENT='Storage for the cache API.'"},{"name":"cache_page","type":"BASE TABLE","comment":"Storage for the cache API.","columns":[{"name":"cid","type":"varchar(255)","nullable":false,"default":"''","comment":"Primary Key: Unique cache ID."},{"name":"data","type":"longblob","nullable":true,"default":"NULL","comment":"A collection of data to cache."},{"name":"expire","type":"int(11)","nullable":false,"default":"0","comment":"A Unix timestamp indicating when the cache entry should expire, or -1 for never."},{"name":"created","type":"decimal(14,3)","nullable":false,"default":"0.000","comment":"A timestamp with millisecond precision indicating when the cache entry was created."},{"name":"serialized","type":"smallint(6)","nullable":false,"default":"0","comment":"A flag to indicate whether content is serialized (1) or not (0)."},{"name":"tags","type":"longtext","nullable":true,"default":"NULL","comment":"Space-separated list of cache tags for this entry."},{"name":"checksum","type":"varchar(255)","nullable":false,"default":null,"comment":"The tag invalidation checksum when this entry was saved."}],"indexes":[{"name":"created","def":"KEY created (created) USING BTREE","table":"cache_page","columns":["created"],"comment":""},{"name":"expire","def":"KEY expire (expire) USING BTREE","table":"cache_page","columns":["expire"],"comment":""},{"name":"PRIMARY","def":"PRIMARY KEY (cid) USING BTREE","table":"cache_page","columns":["cid"],"comment":""}],"constraints":[{"name":"PRIMARY","type":"PRIMARY KEY","def":"PRIMARY KEY (cid)","table":"cache_page","referenced_table":null,"columns":["cid"],"referenced_columns":null,"comment":""}],"triggers":[],"def":"CREATE TABLE `cache_page` (\n  `cid` varchar(255) CHARACTER SET ascii COLLATE ascii_bin NOT NULL DEFAULT '' COMMENT 'Primary Key: Unique cache ID.',\n  `data` longblob DEFAULT NULL COMMENT 'A collection of data to cache.',\n  `expire` int(11) NOT NULL DEFAULT 0 COMMENT 'A Unix timestamp indicating when the cache entry should expire, or -1 for never.',\n  `created` decimal(14,3) NOT NULL DEFAULT 0.000 COMMENT 'A timestamp with millisecond precision indicating when the cache entry was created.',\n  `serialized` smallint(6) NOT NULL DEFAULT 0 COMMENT 'A flag to indicate whether content is serialized (1) or not (0).',\n  `tags` longtext DEFAULT NULL COMMENT 'Space-separated list of cache tags for this entry.',\n  `checksum` varchar(255) CHARACTER SET ascii COLLATE ascii_general_ci NOT NULL COMMENT 'The tag invalidation checksum when this entry was saved.',\n  PRIMARY KEY (`cid`),\n  KEY `expire` (`expire`),\n  KEY `created` (`created`)\n) ENGINE=InnoDB DEFAULT CHARSET=utf8mb4 COLLATE=utf8mb4_general_ci COMMENT='Storage for the cache API.'"},{"name":"cache_render","type":"BASE TABLE","comment":"Storage for the cache API.","columns":[{"name":"cid","type":"varchar(255)","nullable":false,"default":"''","comment":"Primary Key: Unique cache ID."},{"name":"data","type":"longblob","nullable":true,"default":"NULL","comment":"A collection of data to cache."},{"name":"expire","type":"int(11)","nullable":false,"default":"0","comment":"A Unix timestamp indicating when the cache entry should expire, or -1 for never."},{"name":"created","type":"decimal(14,3)","nullable":false,"default":"0.000","comment":"A timestamp with millisecond precision indicating when the cache entry was created."},{"name":"serialized","type":"smallint(6)","nullable":false,"default":"0","comment":"A flag to indicate whether content is serialized (1) or not (0)."},{"name":"tags","type":"longtext","nullable":true,"default":"NULL","comment":"Space-separated list of cache tags for this entry."},{"name":"checksum","type":"varchar(255)","nullable":false,"default":null,"comment":"The tag invalidation checksum when this entry was saved."}],"indexes":[{"name":"created","def":"KEY created (created) USING BTREE","table":"cache_render","columns":["created"],"comment":""},{"name":"expire","def":"KEY expire (expire) USING BTREE","table":"cache_render","columns":["expire"],"comment":""},{"name":"PRIMARY","def":"PRIMARY KEY (cid) USING BTREE","table":"cache_render","columns":["cid"],"comment":""}],"constraints":[{"name":"PRIMARY","type":"PRIMARY KEY","def":"PRIMARY KEY (cid)","table":"cache_render","referenced_table":null,"columns":["cid"],"referenced_columns":null,"comment":""}],"triggers":[],"def":"CREATE TABLE `cache_render` (\n  `cid` varchar(255) CHARACTER SET ascii COLLATE ascii_bin NOT NULL DEFAULT '' COMMENT 'Primary Key: Unique cache ID.',\n  `data` longblob DEFAULT NULL COMMENT 'A collection of data to cache.',\n  `expire` int(11) NOT NULL DEFAULT 0 COMMENT 'A Unix timestamp indicating when the cache entry should expire, or -1 for never.',\n  `created` decimal(14,3) NOT NULL DEFAULT 0.000 COMMENT 'A timestamp with millisecond precision indicating when the cache entry was created.',\n  `serialized` smallint(6) NOT NULL DEFAULT 0 COMMENT 'A flag to indicate whether content is serialized (1) or not (0).',\n  `tags` longtext DEFAULT NULL COMMENT 'Space-separated list of cache tags for this entry.',\n  `checksum` varchar(255) CHARACTER SET ascii COLLATE ascii_general_ci NOT NULL COMMENT 'The tag invalidation checksum when this entry was saved.',\n  PRIMARY KEY (`cid`),\n  KEY `expire` (`expire`),\n  KEY `created` (`created`)\n) ENGINE=InnoDB DEFAULT CHARSET=utf8mb4 COLLATE=utf8mb4_general_ci COMMENT='Storage for the cache API.'"},{"name":"cache_toolbar","type":"BASE TABLE","comment":"Storage for the cache API.","columns":[{"name":"cid","type":"varchar(255)","nullable":false,"default":"''","comment":"Primary Key: Unique cache ID."},{"name":"data","type":"longblob","nullable":true,"default":"NULL","comment":"A collection of data to cache."},{"name":"expire","type":"int(11)","nullable":false,"default":"0","comment":"A Unix timestamp indicating when the cache entry should expire, or -1 for never."},{"name":"created","type":"decimal(14,3)","nullable":false,"default":"0.000","comment":"A timestamp with millisecond precision indicating when the cache entry was created."},{"name":"serialized","type":"smallint(6)","nullable":false,"default":"0","comment":"A flag to indicate whether content is serialized (1) or not (0)."},{"name":"tags","type":"longtext","nullable":true,"default":"NULL","comment":"Space-separated list of cache tags for this entry."},{"name":"checksum","type":"varchar(255)","nullable":false,"default":null,"comment":"The tag invalidation checksum when this entry was saved."}],"indexes":[{"name":"created","def":"KEY created (created) USING BTREE","table":"cache_toolbar","columns":["created"],"comment":""},{"name":"expire","def":"KEY expire (expire) USING BTREE","table":"cache_toolbar","columns":["expire"],"comment":""},{"name":"PRIMARY","def":"PRIMARY KEY (cid) USING BTREE","table":"cache_toolbar","columns":["cid"],"comment":""}],"constraints":[{"name":"PRIMARY","type":"PRIMARY KEY","def":"PRIMARY KEY (cid)","table":"cache_toolbar","referenced_table":null,"columns":["cid"],"referenced_columns":null,"comment":""}],"triggers":[],"def":"CREATE TABLE `cache_toolbar` (\n  `cid` varchar(255) CHARACTER SET ascii COLLATE ascii_bin NOT NULL DEFAULT '' COMMENT 'Primary Key: Unique cache ID.',\n  `data` longblob DEFAULT NULL COMMENT 'A collection of data to cache.',\n  `expire` int(11) NOT NULL DEFAULT 0 COMMENT 'A Unix timestamp indicating when the cache entry should expire, or -1 for never.',\n  `created` decimal(14,3) NOT NULL DEFAULT 0.000 COMMENT 'A timestamp with millisecond precision indicating when the cache entry was created.',\n  `serialized` smallint(6) NOT NULL DEFAULT 0 COMMENT 'A flag to indicate whether content is serialized (1) or not (0).',\n  `tags` longtext DEFAULT NULL COMMENT 'Space-separated list of cache tags for this entry.',\n  `checksum` varchar(255) CHARACTER SET ascii COLLATE ascii_general_ci NOT NULL COMMENT 'The tag invalidation checksum when this entry was saved.',\n  PRIMARY KEY (`cid`),\n  KEY `expire` (`expire`),\n  KEY `created` (`created`)\n) ENGINE=InnoDB DEFAULT CHARSET=utf8mb4 COLLATE=utf8mb4_general_ci COMMENT='Storage for the cache API.'"},{"name":"comment","type":"BASE TABLE","comment":"The base table for comment entities.","columns":[{"name":"cid","type":"int(10) unsigned","nullable":false,"default":null,"comment":"","extra_def":"auto_increment"},{"name":"comment_type","type":"varchar(32)","nullable":false,"default":null,"comment":"The ID of the target entity."},{"name":"uuid","type":"varchar(128)","nullable":false,"default":null,"comment":""},{"name":"langcode","type":"varchar(12)","nullable":false,"default":null,"comment":""}],"indexes":[{"name":"comment_field__comment_type__target_id","def":"KEY comment_field__comment_type__target_id (comment_type) USING BTREE","table":"comment","columns":["comment_type"],"comment":""},{"name":"PRIMARY","def":"PRIMARY KEY (cid) USING BTREE","table":"comment","columns":["cid"],"comment":""},{"name":"comment_field__uuid__value","def":"UNIQUE KEY comment_field__uuid__value (uuid) USING BTREE","table":"comment","columns":["uuid"],"comment":""}],"constraints":[{"name":"comment_field__uuid__value","type":"UNIQUE","def":"UNIQUE KEY comment_field__uuid__value (uuid)","table":"comment","referenced_table":null,"columns":["uuid"],"referenced_columns":null,"comment":""},{"name":"PRIMARY","type":"PRIMARY KEY","def":"PRIMARY KEY (cid)","table":"comment","referenced_table":null,"columns":["cid"],"referenced_columns":null,"comment":""}],"triggers":[],"def":"CREATE TABLE `comment` (\n  `cid` int(10) unsigned NOT NULL AUTO_INCREMENT,\n  `comment_type` varchar(32) CHARACTER SET ascii COLLATE ascii_general_ci NOT NULL COMMENT 'The ID of the target entity.',\n  `uuid` varchar(128) CHARACTER SET ascii COLLATE ascii_general_ci NOT NULL,\n  `langcode` varchar(12) CHARACTER SET ascii COLLATE ascii_general_ci NOT NULL,\n  PRIMARY KEY (`cid`),\n  UNIQUE KEY `comment_field__uuid__value` (`uuid`),\n  KEY `comment_field__comment_type__target_id` (`comment_type`)\n) ENGINE=InnoDB DEFAULT CHARSET=utf8mb4 COLLATE=utf8mb4_general_ci COMMENT='The base table for comment entities.'"},{"name":"comment_entity_statistics","type":"BASE TABLE","comment":"Maintains statistics of entity and comments posts to show …","columns":[{"name":"entity_id","type":"int(10) unsigned","nullable":false,"default":"0","comment":"The entity_id of the entity for which the statistics are compiled."},{"name":"entity_type","type":"varchar(32)","nullable":false,"default":"'node'","comment":"The entity_type of the entity to which this comment is a reply."},{"name":"field_name","type":"varchar(32)","nullable":false,"default":"''","comment":"The field_name of the field that was used to add this comment."},{"name":"cid","type":"int(11)","nullable":false,"default":"0","comment":"The \"comment\".cid of the last comment."},{"name":"last_comment_timestamp","type":"int(11)","nullable":false,"default":"0","comment":"The Unix timestamp of the last comment that was posted within this node, from \"comment\".changed."},{"name":"last_comment_name","type":"varchar(60)","nullable":true,"default":"NULL","comment":"The name of the latest author to post a comment on this node, from \"comment\".name."},{"name":"last_comment_uid","type":"int(10) unsigned","nullable":false,"default":"0","comment":"The user ID of the latest author to post a comment on this node, from \"comment\".uid."},{"name":"comment_count","type":"int(10) unsigned","nullable":false,"default":"0","comment":"The total number of comments on this entity."}],"indexes":[{"name":"comment_count","def":"KEY comment_count (comment_count) USING BTREE","table":"comment_entity_statistics","columns":["comment_count"],"comment":""},{"name":"last_comment_timestamp","def":"KEY last_comment_timestamp (last_comment_timestamp) USING BTREE","table":"comment_entity_statistics","columns":["last_comment_timestamp"],"comment":""},{"name":"last_comment_uid","def":"KEY last_comment_uid (last_comment_uid) USING BTREE","table":"comment_entity_statistics","columns":["last_comment_uid"],"comment":""},{"name":"PRIMARY","def":"PRIMARY KEY (entity_id, entity_type, field_name) USING BTREE","table":"comment_entity_statistics","columns":["entity_id","entity_type","field_name"],"comment":""}],"constraints":[{"name":"PRIMARY","type":"PRIMARY KEY","def":"PRIMARY KEY (entity_id, entity_type, field_name)","table":"comment_entity_statistics","referenced_table":null,"columns":["entity_id","entity_type","field_name"],"referenced_columns":null,"comment":""}],"triggers":[],"def":"CREATE TABLE `comment_entity_statistics` (\n  `entity_id` int(10) unsigned NOT NULL DEFAULT 0 COMMENT 'The entity_id of the entity for which the statistics are compiled.',\n  `entity_type` varchar(32) CHARACTER SET ascii COLLATE ascii_general_ci NOT NULL DEFAULT 'node' COMMENT 'The entity_type of the entity to which this comment is a reply.',\n  `field_name` varchar(32) CHARACTER SET ascii COLLATE ascii_general_ci NOT NULL DEFAULT '' COMMENT 'The field_name of the field that was used to add this comment.',\n  `cid` int(11) NOT NULL DEFAULT 0 COMMENT 'The \"comment\".cid of the last comment.',\n  `last_comment_timestamp` int(11) NOT NULL DEFAULT 0 COMMENT 'The Unix timestamp of the last comment that was posted within this node, from \"comment\".changed.',\n  `last_comment_name` varchar(60) DEFAULT NULL COMMENT 'The name of the latest author to post a comment on this node, from \"comment\".name.',\n  `last_comment_uid` int(10) unsigned NOT NULL DEFAULT 0 COMMENT 'The user ID of the latest author to post a comment on this node, from \"comment\".uid.',\n  `comment_count` int(10) unsigned NOT NULL DEFAULT 0 COMMENT 'The total number of comments on this entity.',\n  PRIMARY KEY (`entity_id`,`entity_type`,`field_name`),\n  KEY `last_comment_timestamp` (`last_comment_timestamp`),\n  KEY `comment_count` (`comment_count`),\n  KEY `last_comment_uid` (`last_comment_uid`)\n) ENGINE=InnoDB DEFAULT CHARSET=utf8mb4 COLLATE=utf8mb4_general_ci COMMENT='Maintains statistics of entity and comments posts to show …'"},{"name":"comment_field_data","type":"BASE TABLE","comment":"The data table for comment entities.","columns":[{"name":"cid","type":"int(10) unsigned","nullable":false,"default":null,"comment":""},{"name":"comment_type","type":"varchar(32)","nullable":false,"default":null,"comment":"The ID of the target entity."},{"name":"langcode","type":"varchar(12)","nullable":false,"default":null,"comment":""},{"name":"status","type":"tinyint(4)","nullable":false,"default":null,"comment":""},{"name":"uid","type":"int(10) unsigned","nullable":false,"default":null,"comment":"The ID of the target entity."},{"name":"pid","type":"int(10) unsigned","nullable":true,"default":"NULL","comment":"The ID of the target entity."},{"name":"entity_id","type":"int(10) unsigned","nullable":true,"default":"NULL","comment":"The ID of the target entity."},{"name":"subject","type":"varchar(64)","nullable":true,"default":"NULL","comment":""},{"name":"name","type":"varchar(60)","nullable":true,"default":"NULL","comment":""},{"name":"mail","type":"varchar(254)","nullable":true,"default":"NULL","comment":""},{"name":"homepage","type":"varchar(255)","nullable":true,"default":"NULL","comment":""},{"name":"hostname","type":"varchar(128)","nullable":true,"default":"NULL","comment":""},{"name":"created","type":"int(11)","nullable":false,"default":null,"comment":""},{"name":"changed","type":"int(11)","nullable":true,"default":"NULL","comment":""},{"name":"thread","type":"varchar(255)","nullable":false,"default":null,"comment":""},{"name":"entity_type","type":"varchar(32)","nullable":false,"default":null,"comment":""},{"name":"field_name","type":"varchar(32)","nullable":false,"default":null,"comment":""},{"name":"default_langcode","type":"tinyint(4)","nullable":false,"default":null,"comment":""}],"indexes":[{"name":"comment_field__comment_type__target_id","def":"KEY comment_field__comment_type__target_id (comment_type) USING BTREE","table":"comment_field_data","columns":["comment_type"],"comment":""},{"name":"comment_field__created","def":"KEY comment_field__created (created) USING BTREE","table":"comment_field_data","columns":["created"],"comment":""},{"name":"comment_field__uid__target_id","def":"KEY comment_field__uid__target_id (uid) USING BTREE","table":"comment_field_data","columns":["uid"],"comment":""},{"name":"comment__entity_langcode","def":"KEY comment__entity_langcode (entity_id, entity_type, comment_type, default_langcode) USING BTREE","table":"comment_field_data","columns":["entity_id","entity_type","comment_type","default_langcode"],"comment":""},{"name":"comment__id__default_langcode__langcode","def":"KEY comment__id__default_langcode__langcode (cid, default_langcode, langcode) USING BTREE","table":"comment_field_data","columns":["cid","default_langcode","langcode"],"comment":""},{"name":"comment__num_new","def":"KEY comment__num_new (entity_id, entity_type, comment_type, status, created, cid, thread) USING BTREE","table":"comment_field_data","columns":["entity_id","entity_type","comment_type","status","created","cid","thread"],"comment":""},{"name":"comment__status_comment_type","def":"KEY comment__status_comment_type (status, comment_type, cid) USING BTREE","table":"comment_field_data","columns":["status","comment_type","cid"],"comment":""},{"name":"comment__status_pid","def":"KEY comment__status_pid (pid, status) USING BTREE","table":"comment_field_data","columns":["pid","status"],"comment":""},{"name":"PRIMARY","def":"PRIMARY KEY (cid, langcode) USING BTREE","table":"comment_field_data","columns":["cid","langcode"],"comment":""}],"constraints":[{"name":"PRIMARY","type":"PRIMARY KEY","def":"PRIMARY KEY (cid, langcode)","table":"comment_field_data","referenced_table":null,"columns":["cid","langcode"],"referenced_columns":null,"comment":""}],"triggers":[],"def":"CREATE TABLE `comment_field_data` (\n  `cid` int(10) unsigned NOT NULL,\n  `comment_type` varchar(32) CHARACTER SET ascii COLLATE ascii_general_ci NOT NULL COMMENT 'The ID of the target entity.',\n  `langcode` varchar(12) CHARACTER SET ascii COLLATE ascii_general_ci NOT NULL,\n  `status` tinyint(4) NOT NULL,\n  `uid` int(10) unsigned NOT NULL COMMENT 'The ID of the target entity.',\n  `pid` int(10) unsigned DEFAULT NULL COMMENT 'The ID of the target entity.',\n  `entity_id` int(10) unsigned DEFAULT NULL COMMENT 'The ID of the target entity.',\n  `subject` varchar(64) DEFAULT NULL,\n  `name` varchar(60) DEFAULT NULL,\n  `mail` varchar(254) DEFAULT NULL,\n  `homepage` varchar(255) DEFAULT NULL,\n  `hostname` varchar(128) DEFAULT NULL,\n  `created` int(11) NOT NULL,\n  `changed` int(11) DEFAULT NULL,\n  `thread` varchar(255) NOT NULL,\n  `entity_type` varchar(32) CHARACTER SET ascii COLLATE ascii_general_ci NOT NULL,\n  `field_name` varchar(32) CHARACTER SET ascii COLLATE ascii_general_ci NOT NULL,\n  `default_langcode` tinyint(4) NOT NULL,\n  PRIMARY KEY (`cid`,`langcode`),\n  KEY `comment__id__default_langcode__langcode` (`cid`,`default_langcode`,`langcode`),\n  KEY `comment_field__comment_type__target_id` (`comment_type`),\n  KEY `comment_field__uid__target_id` (`uid`),\n  KEY `comment_field__created` (`created`),\n  KEY `comment__status_comment_type` (`status`,`comment_type`,`cid`),\n  KEY `comment__status_pid` (`pid`,`status`),\n  KEY `comment__num_new` (`entity_id`,`entity_type`,`comment_type`,`status`,`created`,`cid`,`thread`(191)),\n  KEY `comment__entity_langcode` (`entity_id`,`entity_type`,`comment_type`,`default_langcode`)\n) ENGINE=InnoDB DEFAULT CHARSET=utf8mb4 COLLATE=utf8mb4_general_ci COMMENT='The data table for comment entities.'"},{"name":"comment__comment_body","type":"BASE TABLE","comment":"Data storage for comment field comment_body.","columns":[{"name":"bundle","type":"varchar(128)","nullable":false,"default":"''","comment":"The field instance bundle to which this row belongs, used when deleting a field instance"},{"name":"deleted","type":"tinyint(4)","nullable":false,"default":"0","comment":"A boolean indicating whether this data item has been deleted"},{"name":"entity_id","type":"int(10) unsigned","nullable":false,"default":null,"comment":"The entity id this data is attached to"},{"name":"revision_id","type":"int(10) unsigned","nullable":false,"default":null,"comment":"The entity revision id this data is attached to, which for an unversioned entity type is the same as the entity id"},{"name":"langcode","type":"varchar(32)","nullable":false,"default":"''","comment":"The language code for this data item."},{"name":"delta","type":"int(10) unsigned","nullable":false,"default":null,"comment":"The sequence number for this data item, used for multi-value fields"},{"name":"comment_body_value","type":"longtext","nullable":false,"default":null,"comment":""},{"name":"comment_body_format","type":"varchar(255)","nullable":true,"default":"NULL","comment":""}],"indexes":[{"name":"bundle","def":"KEY bundle (bundle) USING BTREE","table":"comment__comment_body","columns":["bundle"],"comment":""},{"name":"comment_body_format","def":"KEY comment_body_format (comment_body_format) USING BTREE","table":"comment__comment_body","columns":["comment_body_format"],"comment":""},{"name":"revision_id","def":"KEY revision_id (revision_id) USING BTREE","table":"comment__comment_body","columns":["revision_id"],"comment":""},{"name":"PRIMARY","def":"PRIMARY KEY (entity_id, deleted, delta, langcode) USING BTREE","table":"comment__comment_body","columns":["entity_id","deleted","delta","langcode"],"comment":""}],"constraints":[{"name":"PRIMARY","type":"PRIMARY KEY","def":"PRIMARY KEY (entity_id, deleted, delta, langcode)","table":"comment__comment_body","referenced_table":null,"columns":["entity_id","deleted","delta","langcode"],"referenced_columns":null,"comment":""}],"triggers":[],"def":"CREATE TABLE `comment__comment_body` (\n  `bundle` varchar(128) CHARACTER SET ascii COLLATE ascii_general_ci NOT NULL DEFAULT '' COMMENT 'The field instance bundle to which this row belongs, used when deleting a field instance',\n  `deleted` tinyint(4) NOT NULL DEFAULT 0 COMMENT 'A boolean indicating whether this data item has been deleted',\n  `entity_id` int(10) unsigned NOT NULL COMMENT 'The entity id this data is attached to',\n  `revision_id` int(10) unsigned NOT NULL COMMENT 'The entity revision id this data is attached to, which for an unversioned entity type is the same as the entity id',\n  `langcode` varchar(32) CHARACTER SET ascii COLLATE ascii_general_ci NOT NULL DEFAULT '' COMMENT 'The language code for this data item.',\n  `delta` int(10) unsigned NOT NULL COMMENT 'The sequence number for this data item, used for multi-value fields',\n  `comment_body_value` longtext NOT NULL,\n  `comment_body_format` varchar(255) CHARACTER SET ascii COLLATE ascii_general_ci DEFAULT NULL,\n  PRIMARY KEY (`entity_id`,`deleted`,`delta`,`langcode`),\n  KEY `bundle` (`bundle`),\n  KEY `revision_id` (`revision_id`),\n  KEY `comment_body_format` (`comment_body_format`)\n) ENGINE=InnoDB DEFAULT CHARSET=utf8mb4 COLLATE=utf8mb4_general_ci COMMENT='Data storage for comment field comment_body.'"},{"name":"config","type":"BASE TABLE","comment":"The base table for configuration data.","columns":[{"name":"collection","type":"varchar(255)","nullable":false,"default":"''","comment":"Primary Key: Config object collection."},{"name":"name","type":"varchar(255)","nullable":false,"default":"''","comment":"Primary Key: Config object name."},{"name":"data","type":"longblob","nullable":true,"default":"NULL","comment":"A serialized configuration object data."}],"indexes":[{"name":"PRIMARY","def":"PRIMARY KEY (collection, name) USING BTREE","table":"config","columns":["collection","name"],"comment":""}],"constraints":[{"name":"PRIMARY","type":"PRIMARY KEY","def":"PRIMARY KEY (collection, name)","table":"config","referenced_table":null,"columns":["collection","name"],"referenced_columns":null,"comment":""}],"triggers":[],"def":"CREATE TABLE `config` (\n  `collection` varchar(255) CHARACTER SET ascii COLLATE ascii_general_ci NOT NULL DEFAULT '' COMMENT 'Primary Key: Config object collection.',\n  `name` varchar(255) CHARACTER SET ascii COLLATE ascii_general_ci NOT NULL DEFAULT '' COMMENT 'Primary Key: Config object name.',\n  `data` longblob DEFAULT NULL COMMENT 'A serialized configuration object data.',\n  PRIMARY KEY (`collection`,`name`)\n) ENGINE=InnoDB DEFAULT CHARSET=utf8mb4 COLLATE=utf8mb4_general_ci COMMENT='The base table for configuration data.'"},{"name":"config_export","type":"BASE TABLE","comment":"The base table for configuration data.","columns":[{"name":"collection","type":"varchar(255)","nullable":false,"default":"''","comment":"Primary Key: Config object collection."},{"name":"name","type":"varchar(255)","nullable":false,"default":"''","comment":"Primary Key: Config object name."},{"name":"data","type":"longblob","nullable":true,"default":"NULL","comment":"A serialized configuration object data."}],"indexes":[{"name":"PRIMARY","def":"PRIMARY KEY (collection, name) USING BTREE","table":"config_export","columns":["collection","name"],"comment":""}],"constraints":[{"name":"PRIMARY","type":"PRIMARY KEY","def":"PRIMARY KEY (collection, name)","table":"config_export","referenced_table":null,"columns":["collection","name"],"referenced_columns":null,"comment":""}],"triggers":[],"def":"CREATE TABLE `config_export` (\n  `collection` varchar(255) CHARACTER SET ascii COLLATE ascii_general_ci NOT NULL DEFAULT '' COMMENT 'Primary Key: Config object collection.',\n  `name` varchar(255) CHARACTER SET ascii COLLATE ascii_general_ci NOT NULL DEFAULT '' COMMENT 'Primary Key: Config object name.',\n  `data` longblob DEFAULT NULL COMMENT 'A serialized configuration object data.',\n  PRIMARY KEY (`collection`,`name`)\n) ENGINE=InnoDB DEFAULT CHARSET=utf8mb4 COLLATE=utf8mb4_general_ci COMMENT='The base table for configuration data.'"},{"name":"file_managed","type":"BASE TABLE","comment":"The base table for file entities.","columns":[{"name":"fid","type":"int(10) unsigned","nullable":false,"default":null,"comment":"","extra_def":"auto_increment"},{"name":"uuid","type":"varchar(128)","nullable":false,"default":null,"comment":""},{"name":"langcode","type":"varchar(12)","nullable":false,"default":null,"comment":""},{"name":"uid","type":"int(10) unsigned","nullable":true,"default":"NULL","comment":"The ID of the target entity."},{"name":"filename","type":"varchar(255)","nullable":true,"default":"NULL","comment":""},{"name":"uri","type":"varchar(255)","nullable":false,"default":null,"comment":""},{"name":"filemime","type":"varchar(255)","nullable":true,"default":"NULL","comment":""},{"name":"filesize","type":"bigint(20) unsigned","nullable":true,"default":"NULL","comment":""},{"name":"status","type":"tinyint(4)","nullable":false,"default":null,"comment":""},{"name":"created","type":"int(11)","nullable":true,"default":"NULL","comment":""},{"name":"changed","type":"int(11)","nullable":false,"default":null,"comment":""}],"indexes":[{"name":"file_field__changed","def":"KEY file_field__changed (changed) USING BTREE","table":"file_managed","columns":["changed"],"comment":""},{"name":"file_field__status","def":"KEY file_field__status (status) USING BTREE","table":"file_managed","columns":["status"],"comment":""},{"name":"file_field__uid__target_id","def":"KEY file_field__uid__target_id (uid) USING BTREE","table":"file_managed","columns":["uid"],"comment":""},{"name":"file_field__uri","def":"KEY file_field__uri (uri) USING BTREE","table":"file_managed","columns":["uri"],"comment":""},{"name":"PRIMARY","def":"PRIMARY KEY (fid) USING BTREE","table":"file_managed","columns":["fid"],"comment":""},{"name":"file_field__uuid__value","def":"UNIQUE KEY file_field__uuid__value (uuid) USING BTREE","table":"file_managed","columns":["uuid"],"comment":""}],"constraints":[{"name":"file_field__uuid__value","type":"UNIQUE","def":"UNIQUE KEY file_field__uuid__value (uuid)","table":"file_managed","referenced_table":null,"columns":["uuid"],"referenced_columns":null,"comment":""},{"name":"PRIMARY","type":"PRIMARY KEY","def":"PRIMARY KEY (fid)","table":"file_managed","referenced_table":null,"columns":["fid"],"referenced_columns":null,"comment":""}],"triggers":[],"def":"CREATE TABLE `file_managed` (\n  `fid` int(10) unsigned NOT NULL AUTO_INCREMENT,\n  `uuid` varchar(128) CHARACTER SET ascii COLLATE ascii_general_ci NOT NULL,\n  `langcode` varchar(12) CHARACTER SET ascii COLLATE ascii_general_ci NOT NULL,\n  `uid` int(10) unsigned DEFAULT NULL COMMENT 'The ID of the target entity.',\n  `filename` varchar(255) DEFAULT NULL,\n  `uri` varchar(255) CHARACTER SET utf8mb4 COLLATE utf8mb4_bin NOT NULL,\n  `filemime` varchar(255) CHARACTER SET ascii COLLATE ascii_general_ci DEFAULT NULL,\n  `filesize` bigint(20) unsigned DEFAULT NULL,\n  `status` tinyint(4) NOT NULL,\n  `created` int(11) DEFAULT NULL,\n  `changed` int(11) NOT NULL,\n  PRIMARY KEY (`fid`),\n  UNIQUE KEY `file_field__uuid__value` (`uuid`),\n  KEY `file_field__uid__target_id` (`uid`),\n  KEY `file_field__uri` (`uri`(191)),\n  KEY `file_field__status` (`status`),\n  KEY `file_field__changed` (`changed`)\n) ENGINE=InnoDB DEFAULT CHARSET=utf8mb4 COLLATE=utf8mb4_general_ci COMMENT='The base table for file entities.'"},{"name":"file_usage","type":"BASE TABLE","comment":"Track where a file is used.","columns":[{"name":"fid","type":"int(10) unsigned","nullable":false,"default":null,"comment":"File ID."},{"name":"module","type":"varchar(50)","nullable":false,"default":"''","comment":"The name of the module that is using the file."},{"name":"type","type":"varchar(64)","nullable":false,"default":"''","comment":"The name of the object type in which the file is used."},{"name":"id","type":"varchar(64)","nullable":false,"default":"'0'","comment":"The primary key of the object using the file."},{"name":"count","type":"int(10) unsigned","nullable":false,"default":"0","comment":"The number of times this file is used by this object."}],"indexes":[{"name":"fid_count","def":"KEY fid_count (fid, count) USING BTREE","table":"file_usage","columns":["fid","count"],"comment":""},{"name":"fid_module","def":"KEY fid_module (fid, module) USING BTREE","table":"file_usage","columns":["fid","module"],"comment":""},{"name":"type_id","def":"KEY type_id (type, id) USING BTREE","table":"file_usage","columns":["type","id"],"comment":""},{"name":"PRIMARY","def":"PRIMARY KEY (fid, type, id, module) USING BTREE","table":"file_usage","columns":["fid","type","id","module"],"comment":""}],"constraints":[{"name":"PRIMARY","type":"PRIMARY KEY","def":"PRIMARY KEY (fid, type, id, module)","table":"file_usage","referenced_table":null,"columns":["fid","type","id","module"],"referenced_columns":null,"comment":""}],"triggers":[],"def":"CREATE TABLE `file_usage` (\n  `fid` int(10) unsigned NOT NULL COMMENT 'File ID.',\n  `module` varchar(50) CHARACTER SET ascii COLLATE ascii_general_ci NOT NULL DEFAULT '' COMMENT 'The name of the module that is using the file.',\n  `type` varchar(64) CHARACTER SET ascii COLLATE ascii_general_ci NOT NULL DEFAULT '' COMMENT 'The name of the object type in which the file is used.',\n  `id` varchar(64) CHARACTER SET ascii COLLATE ascii_general_ci NOT NULL DEFAULT '0' COMMENT 'The primary key of the object using the file.',\n  `count` int(10) unsigned NOT NULL DEFAULT 0 COMMENT 'The number of times this file is used by this object.',\n  PRIMARY KEY (`fid`,`type`,`id`,`module`),\n  KEY `type_id` (`type`,`id`),\n  KEY `fid_count` (`fid`,`count`),\n  KEY `fid_module` (`fid`,`module`)\n) ENGINE=InnoDB DEFAULT CHARSET=utf8mb4 COLLATE=utf8mb4_general_ci COMMENT='Track where a file is used.'"},{"name":"history","type":"BASE TABLE","comment":"A record of which \"users\" have read which \"node\"s.","columns":[{"name":"uid","type":"int(11)","nullable":false,"default":"0","comment":"The \"users\".uid that read the \"node\" nid."},{"name":"nid","type":"int(10) unsigned","nullable":false,"default":"0","comment":"The \"node\".nid that was read."},{"name":"timestamp","type":"int(11)","nullable":false,"default":"0","comment":"The Unix timestamp at which the read occurred."}],"indexes":[{"name":"nid","def":"KEY nid (nid) USING BTREE","table":"history","columns":["nid"],"comment":""},{"name":"PRIMARY","def":"PRIMARY KEY (uid, nid) USING BTREE","table":"history","columns":["uid","nid"],"comment":""}],"constraints":[{"name":"PRIMARY","type":"PRIMARY KEY","def":"PRIMARY KEY (uid, nid)","table":"history","referenced_table":null,"columns":["uid","nid"],"referenced_columns":null,"comment":""}],"triggers":[],"def":"CREATE TABLE `history` (\n  `uid` int(11) NOT NULL DEFAULT 0 COMMENT 'The \"users\".uid that read the \"node\" nid.',\n  `nid` int(10) unsigned NOT NULL DEFAULT 0 COMMENT 'The \"node\".nid that was read.',\n  `timestamp` int(11) NOT NULL DEFAULT 0 COMMENT 'The Unix timestamp at which the read occurred.',\n  PRIMARY KEY (`uid`,`nid`),\n  KEY `nid` (`nid`)\n) ENGINE=InnoDB DEFAULT CHARSET=utf8mb4 COLLATE=utf8mb4_general_ci COMMENT='A record of which \"users\" have read which \"node\"s.'"},{"name":"key_value","type":"BASE TABLE","comment":"Generic key-value storage table. See the state system for…","columns":[{"name":"collection","type":"varchar(128)","nullable":false,"default":"''","comment":"A named collection of key and value pairs."},{"name":"name","type":"varchar(128)","nullable":false,"default":"''","comment":"The key of the key-value pair. As KEY is a SQL reserved keyword, name was chosen instead."},{"name":"value","type":"longblob","nullable":false,"default":null,"comment":"The value."}],"indexes":[{"name":"PRIMARY","def":"PRIMARY KEY (collection, name) USING BTREE","table":"key_value","columns":["collection","name"],"comment":""}],"constraints":[{"name":"PRIMARY","type":"PRIMARY KEY","def":"PRIMARY KEY (collection, name)","table":"key_value","referenced_table":null,"columns":["collection","name"],"referenced_columns":null,"comment":""}],"triggers":[],"def":"CREATE TABLE `key_value` (\n  `collection` varchar(128) CHARACTER SET ascii COLLATE ascii_general_ci NOT NULL DEFAULT '' COMMENT 'A named collection of key and value pairs.',\n  `name` varchar(128) CHARACTER SET ascii COLLATE ascii_general_ci NOT NULL DEFAULT '' COMMENT 'The key of the key-value pair. As KEY is a SQL reserved keyword, name was chosen instead.',\n  `value` longblob NOT NULL COMMENT 'The value.',\n  PRIMARY KEY (`collection`,`name`)\n) ENGINE=InnoDB DEFAULT CHARSET=utf8mb4 COLLATE=utf8mb4_general_ci COMMENT='Generic key-value storage table. See the state system for…'"},{"name":"key_value_expire","type":"BASE TABLE","comment":"Generic key/value storage table with an expiration.","columns":[{"name":"collection","type":"varchar(128)","nullable":false,"default":"''","comment":"A named collection of key and value pairs."},{"name":"name","type":"varchar(128)","nullable":false,"default":"''","comment":"The key of the key/value pair."},{"name":"value","type":"longblob","nullable":false,"default":null,"comment":"The value of the key/value pair."},{"name":"expire","type":"int(11)","nullable":false,"default":"2147483647","comment":"The time since Unix epoch in seconds when this item expires. Defaults to the maximum possible time."}],"indexes":[{"name":"expire","def":"KEY expire (expire) USING BTREE","table":"key_value_expire","columns":["expire"],"comment":""},{"name":"PRIMARY","def":"PRIMARY KEY (collection, name) USING BTREE","table":"key_value_expire","columns":["collection","name"],"comment":""}],"constraints":[{"name":"PRIMARY","type":"PRIMARY KEY","def":"PRIMARY KEY (collection, name)","table":"key_value_expire","referenced_table":null,"columns":["collection","name"],"referenced_columns":null,"comment":""}],"triggers":[],"def":"CREATE TABLE `key_value_expire` (\n  `collection` varchar(128) CHARACTER SET ascii COLLATE ascii_general_ci NOT NULL DEFAULT '' COMMENT 'A named collection of key and value pairs.',\n  `name` varchar(128) CHARACTER SET ascii COLLATE ascii_general_ci NOT NULL DEFAULT '' COMMENT 'The key of the key/value pair.',\n  `value` longblob NOT NULL COMMENT 'The value of the key/value pair.',\n  `expire` int(11) NOT NULL DEFAULT 2147483647 COMMENT 'The time since Unix epoch in seconds when this item expires. Defaults to the maximum possible time.',\n  PRIMARY KEY (`collection`,`name`),\n  KEY `expire` (`expire`)\n) ENGINE=InnoDB DEFAULT CHARSET=utf8mb4 COLLATE=utf8mb4_general_ci COMMENT='Generic key/value storage table with an expiration.'"},{"name":"locales_location","type":"BASE TABLE","comment":"Location information for source strings.","columns":[{"name":"lid","type":"int(11)","nullable":false,"default":null,"comment":"Unique identifier of this location.","extra_def":"auto_increment"},{"name":"sid","type":"int(11)","nullable":false,"default":null,"comment":"Unique identifier of this string."},{"name":"type","type":"varchar(50)","nullable":false,"default":"''","comment":"The location type (file, config, path, etc)."},{"name":"name","type":"varchar(255)","nullable":false,"default":"''","comment":"Type dependent location information (file name, path, etc)."},{"name":"version","type":"varchar(20)","nullable":false,"default":"'none'","comment":"Version of Drupal where the location was found."}],"indexes":[{"name":"string_type","def":"KEY string_type (sid, type) USING BTREE","table":"locales_location","columns":["sid","type"],"comment":""},{"name":"PRIMARY","def":"PRIMARY KEY (lid) USING BTREE","table":"locales_location","columns":["lid"],"comment":""}],"constraints":[{"name":"PRIMARY","type":"PRIMARY KEY","def":"PRIMARY KEY (lid)","table":"locales_location","referenced_table":null,"columns":["lid"],"referenced_columns":null,"comment":""}],"triggers":[],"def":"CREATE TABLE `locales_location` (\n  `lid` int(11) NOT NULL AUTO_INCREMENT COMMENT 'Unique identifier of this location.',\n  `sid` int(11) NOT NULL COMMENT 'Unique identifier of this string.',\n  `type` varchar(50) CHARACTER SET ascii COLLATE ascii_general_ci NOT NULL DEFAULT '' COMMENT 'The location type (file, config, path, etc).',\n  `name` varchar(255) NOT NULL DEFAULT '' COMMENT 'Type dependent location information (file name, path, etc).',\n  `version` varchar(20) CHARACTER SET ascii COLLATE ascii_general_ci NOT NULL DEFAULT 'none' COMMENT 'Version of Drupal where the location was found.',\n  PRIMARY KEY (`lid`),\n  KEY `string_type` (`sid`,`type`)\n) ENGINE=InnoDB AUTO_INCREMENT=[Redacted by tbls] DEFAULT CHARSET=utf8mb4 COLLATE=utf8mb4_general_ci COMMENT='Location information for source strings.'"},{"name":"locales_source","type":"BASE TABLE","comment":"List of English source strings.","columns":[{"name":"lid","type":"int(11)","nullable":false,"default":null,"comment":"Unique identifier of this string.","extra_def":"auto_increment"},{"name":"source","type":"blob","nullable":false,"default":null,"comment":"The original string in English."},{"name":"context","type":"varchar(255)","nullable":false,"default":"''","comment":"The context this string applies to."},{"name":"version","type":"varchar(20)","nullable":false,"default":"'none'","comment":"Version of Drupal where the string was last used (for locales optimization)."}],"indexes":[{"name":"source_context","def":"KEY source_context (source, context) USING BTREE","table":"locales_source","columns":["source","context"],"comment":""},{"name":"PRIMARY","def":"PRIMARY KEY (lid) USING BTREE","table":"locales_source","columns":["lid"],"comment":""}],"constraints":[{"name":"PRIMARY","type":"PRIMARY KEY","def":"PRIMARY KEY (lid)","table":"locales_source","referenced_table":null,"columns":["lid"],"referenced_columns":null,"comment":""}],"triggers":[],"def":"CREATE TABLE `locales_source` (\n  `lid` int(11) NOT NULL AUTO_INCREMENT COMMENT 'Unique identifier of this string.',\n  `source` blob NOT NULL COMMENT 'The original string in English.',\n  `context` varchar(255) CHARACTER SET ascii COLLATE ascii_general_ci NOT NULL DEFAULT '' COMMENT 'The context this string applies to.',\n  `version` varchar(20) CHARACTER SET ascii COLLATE ascii_general_ci NOT NULL DEFAULT 'none' COMMENT 'Version of Drupal where the string was last used (for locales optimization).',\n  PRIMARY KEY (`lid`),\n  KEY `source_context` (`source`(30),`context`)\n) ENGINE=InnoDB AUTO_INCREMENT=[Redacted by tbls] DEFAULT CHARSET=utf8mb4 COLLATE=utf8mb4_general_ci COMMENT='List of English source strings.'"},{"name":"locales_target","type":"BASE TABLE","comment":"Stores translated versions of strings.","columns":[{"name":"lid","type":"int(11)","nullable":false,"default":"0","comment":"Source string ID. References \"locales_source\".lid."},{"name":"translation","type":"blob","nullable":false,"default":null,"comment":"Translation string value in this language."},{"name":"language","type":"varchar(12)","nullable":false,"default":"''","comment":"Language code. References \"language\".langcode."},{"name":"customized","type":"int(11)","nullable":false,"default":"0","comment":"Boolean indicating whether the translation is custom to this site."}],"indexes":[{"name":"lid","def":"KEY lid (lid) USING BTREE","table":"locales_target","columns":["lid"],"comment":""},{"name":"PRIMARY","def":"PRIMARY KEY (language, lid) USING BTREE","table":"locales_target","columns":["language","lid"],"comment":""}],"constraints":[{"name":"PRIMARY","type":"PRIMARY KEY","def":"PRIMARY KEY (language, lid)","table":"locales_target","referenced_table":null,"columns":["language","lid"],"referenced_columns":null,"comment":""}],"triggers":[],"def":"CREATE TABLE `locales_target` (\n  `lid` int(11) NOT NULL DEFAULT 0 COMMENT 'Source string ID. References \"locales_source\".lid.',\n  `translation` blob NOT NULL COMMENT 'Translation string value in this language.',\n  `language` varchar(12) CHARACTER SET ascii COLLATE ascii_general_ci NOT NULL DEFAULT '' COMMENT 'Language code. References \"language\".langcode.',\n  `customized` int(11) NOT NULL DEFAULT 0 COMMENT 'Boolean indicating whether the translation is custom to this site.',\n  PRIMARY KEY (`language`,`lid`),\n  KEY `lid` (`lid`)\n) ENGINE=InnoDB DEFAULT CHARSET=utf8mb4 COLLATE=utf8mb4_general_ci COMMENT='Stores translated versions of strings.'"},{"name":"locale_file","type":"BASE TABLE","comment":"File import status information for interface translation…","columns":[{"name":"project","type":"varchar(255)","nullable":false,"default":"''","comment":"A unique short name to identify the project the file belongs to."},{"name":"langcode","type":"varchar(12)","nullable":false,"default":"''","comment":"Language code of this translation. References \"language\".langcode."},{"name":"filename","type":"varchar(255)","nullable":false,"default":"''","comment":"Filename of the imported file."},{"name":"version","type":"varchar(128)","nullable":false,"default":"''","comment":"Version tag of the imported file."},{"name":"uri","type":"varchar(255)","nullable":false,"default":"''","comment":"URI of the remote file, the resulting local file or the locally imported file."},{"name":"timestamp","type":"int(11)","nullable":true,"default":"0","comment":"Unix timestamp of the imported file."},{"name":"last_checked","type":"int(11)","nullable":true,"default":"0","comment":"Unix timestamp of the last time this translation was confirmed to be the most recent release available."}],"indexes":[{"name":"PRIMARY","def":"PRIMARY KEY (project, langcode) USING BTREE","table":"locale_file","columns":["project","langcode"],"comment":""}],"constraints":[{"name":"PRIMARY","type":"PRIMARY KEY","def":"PRIMARY KEY (project, langcode)","table":"locale_file","referenced_table":null,"columns":["project","langcode"],"referenced_columns":null,"comment":""}],"triggers":[],"def":"CREATE TABLE `locale_file` (\n  `project` varchar(255) CHARACTER SET ascii COLLATE ascii_general_ci NOT NULL DEFAULT '' COMMENT 'A unique short name to identify the project the file belongs to.',\n  `langcode` varchar(12) CHARACTER SET ascii COLLATE ascii_general_ci NOT NULL DEFAULT '' COMMENT 'Language code of this translation. References \"language\".langcode.',\n  `filename` varchar(255) NOT NULL DEFAULT '' COMMENT 'Filename of the imported file.',\n  `version` varchar(128) NOT NULL DEFAULT '' COMMENT 'Version tag of the imported file.',\n  `uri` varchar(255) NOT NULL DEFAULT '' COMMENT 'URI of the remote file, the resulting local file or the locally imported file.',\n  `timestamp` int(11) DEFAULT 0 COMMENT 'Unix timestamp of the imported file.',\n  `last_checked` int(11) DEFAULT 0 COMMENT 'Unix timestamp of the last time this translation was confirmed to be the most recent release available.',\n  PRIMARY KEY (`project`,`langcode`)\n) ENGINE=InnoDB DEFAULT CHARSET=utf8mb4 COLLATE=utf8mb4_general_ci COMMENT='File import status information for interface translation…'"},{"name":"menu_link_content","type":"BASE TABLE","comment":"The base table for menu_link_content entities.","columns":[{"name":"id","type":"int(10) unsigned","nullable":false,"default":null,"comment":"","extra_def":"auto_increment"},{"name":"revision_id","type":"int(10) unsigned","nullable":true,"default":"NULL","comment":""},{"name":"bundle","type":"varchar(32)","nullable":false,"default":null,"comment":""},{"name":"uuid","type":"varchar(128)","nullable":false,"default":null,"comment":""},{"name":"langcode","type":"varchar(12)","nullable":false,"default":null,"comment":""}],"indexes":[{"name":"PRIMARY","def":"PRIMARY KEY (id) USING BTREE","table":"menu_link_content","columns":["id"],"comment":""},{"name":"menu_link_content_field__uuid__value","def":"UNIQUE KEY menu_link_content_field__uuid__value (uuid) USING BTREE","table":"menu_link_content","columns":["uuid"],"comment":""},{"name":"menu_link_content__revision_id","def":"UNIQUE KEY menu_link_content__revision_id (revision_id) USING BTREE","table":"menu_link_content","columns":["revision_id"],"comment":""}],"constraints":[{"name":"menu_link_content_field__uuid__value","type":"UNIQUE","def":"UNIQUE KEY menu_link_content_field__uuid__value (uuid)","table":"menu_link_content","referenced_table":null,"columns":["uuid"],"referenced_columns":null,"comment":""},{"name":"menu_link_content__revision_id","type":"UNIQUE","def":"UNIQUE KEY menu_link_content__revision_id (revision_id)","table":"menu_link_content","referenced_table":null,"columns":["revision_id"],"referenced_columns":null,"comment":""},{"name":"PRIMARY","type":"PRIMARY KEY","def":"PRIMARY KEY (id)","table":"menu_link_content","referenced_table":null,"columns":["id"],"referenced_columns":null,"comment":""}],"triggers":[],"def":"CREATE TABLE `menu_link_content` (\n  `id` int(10) unsigned NOT NULL AUTO_INCREMENT,\n  `revision_id` int(10) unsigned DEFAULT NULL,\n  `bundle` varchar(32) CHARACTER SET ascii COLLATE ascii_general_ci NOT NULL,\n  `uuid` varchar(128) CHARACTER SET ascii COLLATE ascii_general_ci NOT NULL,\n  `langcode` varchar(12) CHARACTER SET ascii COLLATE ascii_general_ci NOT NULL,\n  PRIMARY KEY (`id`),\n  UNIQUE KEY `menu_link_content_field__uuid__value` (`uuid`),\n  UNIQUE KEY `menu_link_content__revision_id` (`revision_id`)\n) ENGINE=InnoDB DEFAULT CHARSET=utf8mb4 COLLATE=utf8mb4_general_ci COMMENT='The base table for menu_link_content entities.'"},{"name":"menu_link_content_data","type":"BASE TABLE","comment":"The data table for menu_link_content entities.","columns":[{"name":"id","type":"int(10) unsigned","nullable":false,"default":null,"comment":""},{"name":"revision_id","type":"int(10) unsigned","nullable":false,"default":null,"comment":""},{"name":"bundle","type":"varchar(32)","nullable":false,"default":null,"comment":""},{"name":"langcode","type":"varchar(12)","nullable":false,"default":null,"comment":""},{"name":"enabled","type":"tinyint(4)","nullable":false,"default":null,"comment":""},{"name":"title","type":"varchar(255)","nullable":true,"default":"NULL","comment":""},{"name":"description","type":"varchar(255)","nullable":true,"default":"NULL","comment":""},{"name":"menu_name","type":"varchar(255)","nullable":true,"default":"NULL","comment":""},{"name":"link__uri","type":"varchar(2048)","nullable":true,"default":"NULL","comment":"The URI of the link."},{"name":"link__title","type":"varchar(255)","nullable":true,"default":"NULL","comment":"The link text."},{"name":"link__options","type":"longblob","nullable":true,"default":"NULL","comment":"Serialized array of options for the link."},{"name":"external","type":"tinyint(4)","nullable":true,"default":"NULL","comment":""},{"name":"rediscover","type":"tinyint(4)","nullable":true,"default":"NULL","comment":""},{"name":"weight","type":"int(11)","nullable":true,"default":"NULL","comment":""},{"name":"expanded","type":"tinyint(4)","nullable":true,"default":"NULL","comment":""},{"name":"parent","type":"varchar(255)","nullable":true,"default":"NULL","comment":""},{"name":"changed","type":"int(11)","nullable":true,"default":"NULL","comment":""},{"name":"default_langcode","type":"tinyint(4)","nullable":false,"default":null,"comment":""},{"name":"revision_translation_affected","type":"tinyint(4)","nullable":true,"default":"NULL","comment":""}],"indexes":[{"name":"menu_link_content_field__link__uri","def":"KEY menu_link_content_field__link__uri (link__uri) USING BTREE","table":"menu_link_content_data","columns":["link__uri"],"comment":""},{"name":"menu_link_content__enabled_bundle","def":"KEY menu_link_content__enabled_bundle (enabled, bundle, id) USING BTREE","table":"menu_link_content_data","columns":["enabled","bundle","id"],"comment":""},{"name":"menu_link_content__id__default_langcode__langcode","def":"KEY menu_link_content__id__default_langcode__langcode (id, default_langcode, langcode) USING BTREE","table":"menu_link_content_data","columns":["id","default_langcode","langcode"],"comment":""},{"name":"menu_link_content__revision_id","def":"KEY menu_link_content__revision_id (revision_id) USING BTREE","table":"menu_link_content_data","columns":["revision_id"],"comment":""},{"name":"PRIMARY","def":"PRIMARY KEY (id, langcode) USING BTREE","table":"menu_link_content_data","columns":["id","langcode"],"comment":""}],"constraints":[{"name":"PRIMARY","type":"PRIMARY KEY","def":"PRIMARY KEY (id, langcode)","table":"menu_link_content_data","referenced_table":null,"columns":["id","langcode"],"referenced_columns":null,"comment":""}],"triggers":[],"def":"CREATE TABLE `menu_link_content_data` (\n  `id` int(10) unsigned NOT NULL,\n  `revision_id` int(10) unsigned NOT NULL,\n  `bundle` varchar(32) CHARACTER SET ascii COLLATE ascii_general_ci NOT NULL,\n  `langcode` varchar(12) CHARACTER SET ascii COLLATE ascii_general_ci NOT NULL,\n  `enabled` tinyint(4) NOT NULL,\n  `title` varchar(255) DEFAULT NULL,\n  `description` varchar(255) DEFAULT NULL,\n  `menu_name` varchar(255) CHARACTER SET ascii COLLATE ascii_general_ci DEFAULT NULL,\n  `link__uri` varchar(2048) DEFAULT NULL COMMENT 'The URI of the link.',\n  `link__title` varchar(255) DEFAULT NULL COMMENT 'The link text.',\n  `link__options` longblob DEFAULT NULL COMMENT 'Serialized array of options for the link.',\n  `external` tinyint(4) DEFAULT NULL,\n  `rediscover` tinyint(4) DEFAULT NULL,\n  `weight` int(11) DEFAULT NULL,\n  `expanded` tinyint(4) DEFAULT NULL,\n  `parent` varchar(255) DEFAULT NULL,\n  `changed` int(11) DEFAULT NULL,\n  `default_langcode` tinyint(4) NOT NULL,\n  `revision_translation_affected` tinyint(4) DEFAULT NULL,\n  PRIMARY KEY (`id`,`langcode`),\n  KEY `menu_link_content__id__default_langcode__langcode` (`id`,`default_langcode`,`langcode`),\n  KEY `menu_link_content__revision_id` (`revision_id`),\n  KEY `menu_link_content_field__link__uri` (`link__uri`(30)),\n  KEY `menu_link_content__enabled_bundle` (`enabled`,`bundle`,`id`)\n) ENGINE=InnoDB DEFAULT CHARSET=utf8mb4 COLLATE=utf8mb4_general_ci COMMENT='The data table for menu_link_content entities.'"},{"name":"menu_link_content_field_revision","type":"BASE TABLE","comment":"The revision data table for menu_link_content entities.","columns":[{"name":"id","type":"int(10) unsigned","nullable":false,"default":null,"comment":""},{"name":"revision_id","type":"int(10) unsigned","nullable":false,"default":null,"comment":""},{"name":"langcode","type":"varchar(12)","nullable":false,"default":null,"comment":""},{"name":"enabled","type":"tinyint(4)","nullable":false,"default":null,"comment":""},{"name":"title","type":"varchar(255)","nullable":true,"default":"NULL","comment":""},{"name":"description","type":"varchar(255)","nullable":true,"default":"NULL","comment":""},{"name":"link__uri","type":"varchar(2048)","nullable":true,"default":"NULL","comment":"The URI of the link."},{"name":"link__title","type":"varchar(255)","nullable":true,"default":"NULL","comment":"The link text."},{"name":"link__options","type":"longblob","nullable":true,"default":"NULL","comment":"Serialized array of options for the link."},{"name":"external","type":"tinyint(4)","nullable":true,"default":"NULL","comment":""},{"name":"changed","type":"int(11)","nullable":true,"default":"NULL","comment":""},{"name":"default_langcode","type":"tinyint(4)","nullable":false,"default":null,"comment":""},{"name":"revision_translation_affected","type":"tinyint(4)","nullable":true,"default":"NULL","comment":""}],"indexes":[{"name":"menu_link_content_field__link__uri","def":"KEY menu_link_content_field__link__uri (link__uri) USING BTREE","table":"menu_link_content_field_revision","columns":["link__uri"],"comment":""},{"name":"menu_link_content__id__default_langcode__langcode","def":"KEY menu_link_content__id__default_langcode__langcode (id, default_langcode, langcode) USING BTREE","table":"menu_link_content_field_revision","columns":["id","default_langcode","langcode"],"comment":""},{"name":"PRIMARY","def":"PRIMARY KEY (revision_id, langcode) USING BTREE","table":"menu_link_content_field_revision","columns":["revision_id","langcode"],"comment":""}],"constraints":[{"name":"PRIMARY","type":"PRIMARY KEY","def":"PRIMARY KEY (revision_id, langcode)","table":"menu_link_content_field_revision","referenced_table":null,"columns":["revision_id","langcode"],"referenced_columns":null,"comment":""}],"triggers":[],"def":"CREATE TABLE `menu_link_content_field_revision` (\n  `id` int(10) unsigned NOT NULL,\n  `revision_id` int(10) unsigned NOT NULL,\n  `langcode` varchar(12) CHARACTER SET ascii COLLATE ascii_general_ci NOT NULL,\n  `enabled` tinyint(4) NOT NULL,\n  `title` varchar(255) DEFAULT NULL,\n  `description` varchar(255) DEFAULT NULL,\n  `link__uri` varchar(2048) DEFAULT NULL COMMENT 'The URI of the link.',\n  `link__title` varchar(255) DEFAULT NULL COMMENT 'The link text.',\n  `link__options` longblob DEFAULT NULL COMMENT 'Serialized array of options for the link.',\n  `external` tinyint(4) DEFAULT NULL,\n  `changed` int(11) DEFAULT NULL,\n  `default_langcode` tinyint(4) NOT NULL,\n  `revision_translation_affected` tinyint(4) DEFAULT NULL,\n  PRIMARY KEY (`revision_id`,`langcode`),\n  KEY `menu_link_content__id__default_langcode__langcode` (`id`,`default_langcode`,`langcode`),\n  KEY `menu_link_content_field__link__uri` (`link__uri`(30))\n) ENGINE=InnoDB DEFAULT CHARSET=utf8mb4 COLLATE=utf8mb4_general_ci COMMENT='The revision data table for menu_link_content entities.'"},{"name":"menu_link_content_revision","type":"BASE TABLE","comment":"The revision table for menu_link_content entities.","columns":[{"name":"id","type":"int(10) unsigned","nullable":false,"default":null,"comment":""},{"name":"revision_id","type":"int(10) unsigned","nullable":false,"default":null,"comment":"","extra_def":"auto_increment"},{"name":"langcode","type":"varchar(12)","nullable":false,"default":null,"comment":""},{"name":"revision_user","type":"int(10) unsigned","nullable":true,"default":"NULL","comment":"The ID of the target entity."},{"name":"revision_created","type":"int(11)","nullable":true,"default":"NULL","comment":""},{"name":"revision_log_message","type":"longtext","nullable":true,"default":"NULL","comment":""},{"name":"revision_default","type":"tinyint(4)","nullable":true,"default":"NULL","comment":""}],"indexes":[{"name":"menu_link_content__ef029a1897","def":"KEY menu_link_content__ef029a1897 (revision_user) USING BTREE","table":"menu_link_content_revision","columns":["revision_user"],"comment":""},{"name":"menu_link_content__id","def":"KEY menu_link_content__id (id) USING BTREE","table":"menu_link_content_revision","columns":["id"],"comment":""},{"name":"PRIMARY","def":"PRIMARY KEY (revision_id) USING BTREE","table":"menu_link_content_revision","columns":["revision_id"],"comment":""}],"constraints":[{"name":"PRIMARY","type":"PRIMARY KEY","def":"PRIMARY KEY (revision_id)","table":"menu_link_content_revision","referenced_table":null,"columns":["revision_id"],"referenced_columns":null,"comment":""}],"triggers":[],"def":"CREATE TABLE `menu_link_content_revision` (\n  `id` int(10) unsigned NOT NULL,\n  `revision_id` int(10) unsigned NOT NULL AUTO_INCREMENT,\n  `langcode` varchar(12) CHARACTER SET ascii COLLATE ascii_general_ci NOT NULL,\n  `revision_user` int(10) unsigned DEFAULT NULL COMMENT 'The ID of the target entity.',\n  `revision_created` int(11) DEFAULT NULL,\n  `revision_log_message` longtext DEFAULT NULL,\n  `revision_default` tinyint(4) DEFAULT NULL,\n  PRIMARY KEY (`revision_id`),\n  KEY `menu_link_content__id` (`id`),\n  KEY `menu_link_content__ef029a1897` (`revision_user`)\n) ENGINE=InnoDB DEFAULT CHARSET=utf8mb4 COLLATE=utf8mb4_general_ci COMMENT='The revision table for menu_link_content entities.'"},{"name":"menu_tree","type":"BASE TABLE","comment":"Contains the menu tree hierarchy.","columns":[{"name":"menu_name","type":"varchar(32)","nullable":false,"default":"''","comment":"The menu name. All links with the same menu name (such as 'tools') are part of the same menu."},{"name":"mlid","type":"int(10) unsigned","nullable":false,"default":null,"comment":"The menu link ID (mlid) is the integer primary key.","extra_def":"auto_increment"},{"name":"id","type":"varchar(255)","nullable":false,"default":null,"comment":"Unique machine name: the plugin ID."},{"name":"parent","type":"varchar(255)","nullable":false,"default":"''","comment":"The plugin ID for the parent of this link."},{"name":"route_name","type":"varchar(255)","nullable":true,"default":"NULL","comment":"The machine name of a defined Symfony Route this menu link represents."},{"name":"route_param_key","type":"varchar(255)","nullable":true,"default":"NULL","comment":"An encoded string of route parameters for loading by route."},{"name":"route_parameters","type":"longblob","nullable":true,"default":"NULL","comment":"Serialized array of route parameters of this menu link."},{"name":"url","type":"varchar(255)","nullable":false,"default":"''","comment":"The external path this link points to (when not using a route)."},{"name":"title","type":"longblob","nullable":true,"default":"NULL","comment":"The serialized title for the link. May be a TranslatableMarkup."},{"name":"description","type":"longblob","nullable":true,"default":"NULL","comment":"The serialized description of this link - used for admin pages and title attribute. May be a TranslatableMarkup."},{"name":"class","type":"text","nullable":true,"default":"NULL","comment":"The class for this link plugin."},{"name":"options","type":"longblob","nullable":true,"default":"NULL","comment":"A serialized array of URL options, such as a query string or HTML attributes."},{"name":"provider","type":"varchar(50)","nullable":false,"default":"'system'","comment":"The name of the module that generated this link."},{"name":"enabled","type":"smallint(6)","nullable":false,"default":"1","comment":"A flag for whether the link should be rendered in menus. (0 = a disabled menu link that may be shown on admin screens, 1 = a normal, visible link)"},{"name":"discovered","type":"smallint(6)","nullable":false,"default":"0","comment":"A flag for whether the link was discovered, so can be purged on rebuild"},{"name":"expanded","type":"smallint(6)","nullable":false,"default":"0","comment":"Flag for whether this link should be rendered as expanded in menus - expanded links always have their child links displayed, instead of only when the link is in the active trail (1 = expanded, 0 = not expanded)"},{"name":"weight","type":"int(11)","nullable":false,"default":"0","comment":"Link weight among links in the same menu at the same depth."},{"name":"metadata","type":"longblob","nullable":true,"default":"NULL","comment":"A serialized array of data that may be used by the plugin instance."},{"name":"has_children","type":"smallint(6)","nullable":false,"default":"0","comment":"Flag indicating whether any enabled links have this link as a parent (1 = enabled children exist, 0 = no enabled children)."},{"name":"depth","type":"smallint(6)","nullable":false,"default":"0","comment":"The depth relative to the top level. A link with empty parent will have depth == 1."},{"name":"p1","type":"int(10) unsigned","nullable":false,"default":"0","comment":"The first mlid in the materialized path. If N = depth, then pN must equal the mlid. If depth \u003e 1 then p(N-1) must equal the parent link mlid. All pX where X \u003e depth must equal zero. The columns p1 .. p9 are also called the parents."},{"name":"p2","type":"int(10) unsigned","nullable":false,"default":"0","comment":"The second mlid in the materialized path. See p1."},{"name":"p3","type":"int(10) unsigned","nullable":false,"default":"0","comment":"The third mlid in the materialized path. See p1."},{"name":"p4","type":"int(10) unsigned","nullable":false,"default":"0","comment":"The fourth mlid in the materialized path. See p1."},{"name":"p5","type":"int(10) unsigned","nullable":false,"default":"0","comment":"The fifth mlid in the materialized path. See p1."},{"name":"p6","type":"int(10) unsigned","nullable":false,"default":"0","comment":"The sixth mlid in the materialized path. See p1."},{"name":"p7","type":"int(10) unsigned","nullable":false,"default":"0","comment":"The seventh mlid in the materialized path. See p1."},{"name":"p8","type":"int(10) unsigned","nullable":false,"default":"0","comment":"The eighth mlid in the materialized path. See p1."},{"name":"p9","type":"int(10) unsigned","nullable":false,"default":"0","comment":"The ninth mlid in the materialized path. See p1."},{"name":"form_class","type":"varchar(255)","nullable":true,"default":"NULL","comment":"meh"}],"indexes":[{"name":"menu_parents","def":"KEY menu_parents (menu_name, p1, p2, p3, p4, p5, p6, p7, p8, p9) USING BTREE","table":"menu_tree","columns":["menu_name","p1","p2","p3","p4","p5","p6","p7","p8","p9"],"comment":""},{"name":"menu_parent_expand_child","def":"KEY menu_parent_expand_child (menu_name, expanded, has_children, parent) USING BTREE","table":"menu_tree","columns":["menu_name","expanded","has_children","parent"],"comment":""},{"name":"route_values","def":"KEY route_values (route_name, route_param_key) USING BTREE","table":"menu_tree","columns":["route_name","route_param_key"],"comment":""},{"name":"PRIMARY","def":"PRIMARY KEY (mlid) USING BTREE","table":"menu_tree","columns":["mlid"],"comment":""},{"name":"id","def":"UNIQUE KEY id (id) USING BTREE","table":"menu_tree","columns":["id"],"comment":""}],"constraints":[{"name":"id","type":"UNIQUE","def":"UNIQUE KEY id (id)","table":"menu_tree","referenced_table":null,"columns":["id"],"referenced_columns":null,"comment":""},{"name":"PRIMARY","type":"PRIMARY KEY","def":"PRIMARY KEY (mlid)","table":"menu_tree","referenced_table":null,"columns":["mlid"],"referenced_columns":null,"comment":""}],"triggers":[],"def":"CREATE TABLE `menu_tree` (\n  `menu_name` varchar(32) CHARACTER SET ascii COLLATE ascii_general_ci NOT NULL DEFAULT '' COMMENT 'The menu name. All links with the same menu name (such as ''tools'') are part of the same menu.',\n  `mlid` int(10) unsigned NOT NULL AUTO_INCREMENT COMMENT 'The menu link ID (mlid) is the integer primary key.',\n  `id` varchar(255) CHARACTER SET ascii COLLATE ascii_general_ci NOT NULL COMMENT 'Unique machine name: the plugin ID.',\n  `parent` varchar(255) CHARACTER SET ascii COLLATE ascii_general_ci NOT NULL DEFAULT '' COMMENT 'The plugin ID for the parent of this link.',\n  `route_name` varchar(255) CHARACTER SET ascii COLLATE ascii_general_ci DEFAULT NULL COMMENT 'The machine name of a defined Symfony Route this menu link represents.',\n  `route_param_key` varchar(255) DEFAULT NULL COMMENT 'An encoded string of route parameters for loading by route.',\n  `route_parameters` longblob DEFAULT NULL COMMENT 'Serialized array of route parameters of this menu link.',\n  `url` varchar(255) NOT NULL DEFAULT '' COMMENT 'The external path this link points to (when not using a route).',\n  `title` longblob DEFAULT NULL COMMENT 'The serialized title for the link. May be a TranslatableMarkup.',\n  `description` longblob DEFAULT NULL COMMENT 'The serialized description of this link - used for admin pages and title attribute. May be a TranslatableMarkup.',\n  `class` text DEFAULT NULL COMMENT 'The class for this link plugin.',\n  `options` longblob DEFAULT NULL COMMENT 'A serialized array of URL options, such as a query string or HTML attributes.',\n  `provider` varchar(50) CHARACTER SET ascii COLLATE ascii_general_ci NOT NULL DEFAULT 'system' COMMENT 'The name of the module that generated this link.',\n  `enabled` smallint(6) NOT NULL DEFAULT 1 COMMENT 'A flag for whether the link should be rendered in menus. (0 = a disabled menu link that may be shown on admin screens, 1 = a normal, visible link)',\n  `discovered` smallint(6) NOT NULL DEFAULT 0 COMMENT 'A flag for whether the link was discovered, so can be purged on rebuild',\n  `expanded` smallint(6) NOT NULL DEFAULT 0 COMMENT 'Flag for whether this link should be rendered as expanded in menus - expanded links always have their child links displayed, instead of only when the link is in the active trail (1 = expanded, 0 = not expanded)',\n  `weight` int(11) NOT NULL DEFAULT 0 COMMENT 'Link weight among links in the same menu at the same depth.',\n  `metadata` longblob DEFAULT NULL COMMENT 'A serialized array of data that may be used by the plugin instance.',\n  `has_children` smallint(6) NOT NULL DEFAULT 0 COMMENT 'Flag indicating whether any enabled links have this link as a parent (1 = enabled children exist, 0 = no enabled children).',\n  `depth` smallint(6) NOT NULL DEFAULT 0 COMMENT 'The depth relative to the top level. A link with empty parent will have depth == 1.',\n  `p1` int(10) unsigned NOT NULL DEFAULT 0 COMMENT 'The first mlid in the materialized path. If N = depth, then pN must equal the mlid. If depth \u003e 1 then p(N-1) must equal the parent link mlid. All pX where X \u003e depth must equal zero. The columns p1 .. p9 are also called the parents.',\n  `p2` int(10) unsigned NOT NULL DEFAULT 0 COMMENT 'The second mlid in the materialized path. See p1.',\n  `p3` int(10) unsigned NOT NULL DEFAULT 0 COMMENT 'The third mlid in the materialized path. See p1.',\n  `p4` int(10) unsigned NOT NULL DEFAULT 0 COMMENT 'The fourth mlid in the materialized path. See p1.',\n  `p5` int(10) unsigned NOT NULL DEFAULT 0 COMMENT 'The fifth mlid in the materialized path. See p1.',\n  `p6` int(10) unsigned NOT NULL DEFAULT 0 COMMENT 'The sixth mlid in the materialized path. See p1.',\n  `p7` int(10) unsigned NOT NULL DEFAULT 0 COMMENT 'The seventh mlid in the materialized path. See p1.',\n  `p8` int(10) unsigned NOT NULL DEFAULT 0 COMMENT 'The eighth mlid in the materialized path. See p1.',\n  `p9` int(10) unsigned NOT NULL DEFAULT 0 COMMENT 'The ninth mlid in the materialized path. See p1.',\n  `form_class` varchar(255) DEFAULT NULL COMMENT 'meh',\n  PRIMARY KEY (`mlid`),\n  UNIQUE KEY `id` (`id`),\n  KEY `menu_parents` (`menu_name`,`p1`,`p2`,`p3`,`p4`,`p5`,`p6`,`p7`,`p8`,`p9`),\n  KEY `menu_parent_expand_child` (`menu_name`,`expanded`,`has_children`,`parent`(16)),\n  KEY `route_values` (`route_name`(32),`route_param_key`(16))\n) ENGINE=InnoDB AUTO_INCREMENT=[Redacted by tbls] DEFAULT CHARSET=utf8mb4 COLLATE=utf8mb4_general_ci COMMENT='Contains the menu tree hierarchy.'"},{"name":"node","type":"BASE TABLE","comment":"The base table for node entities.","columns":[{"name":"nid","type":"int(10) unsigned","nullable":false,"default":null,"comment":"","extra_def":"auto_increment"},{"name":"vid","type":"int(10) unsigned","nullable":true,"default":"NULL","comment":""},{"name":"type","type":"varchar(32)","nullable":false,"default":null,"comment":"The ID of the target entity."},{"name":"uuid","type":"varchar(128)","nullable":false,"default":null,"comment":""},{"name":"langcode","type":"varchar(12)","nullable":false,"default":null,"comment":""}],"indexes":[{"name":"node_field__type__target_id","def":"KEY node_field__type__target_id (type) USING BTREE","table":"node","columns":["type"],"comment":""},{"name":"PRIMARY","def":"PRIMARY KEY (nid) USING BTREE","table":"node","columns":["nid"],"comment":""},{"name":"node_field__uuid__value","def":"UNIQUE KEY node_field__uuid__value (uuid) USING BTREE","table":"node","columns":["uuid"],"comment":""},{"name":"node__vid","def":"UNIQUE KEY node__vid (vid) USING BTREE","table":"node","columns":["vid"],"comment":""}],"constraints":[{"name":"node_field__uuid__value","type":"UNIQUE","def":"UNIQUE KEY node_field__uuid__value (uuid)","table":"node","referenced_table":null,"columns":["uuid"],"referenced_columns":null,"comment":""},{"name":"node__vid","type":"UNIQUE","def":"UNIQUE KEY node__vid (vid)","table":"node","referenced_table":null,"columns":["vid"],"referenced_columns":null,"comment":""},{"name":"PRIMARY","type":"PRIMARY KEY","def":"PRIMARY KEY (nid)","table":"node","referenced_table":null,"columns":["nid"],"referenced_columns":null,"comment":""}],"triggers":[],"def":"CREATE TABLE `node` (\n  `nid` int(10) unsigned NOT NULL AUTO_INCREMENT,\n  `vid` int(10) unsigned DEFAULT NULL,\n  `type` varchar(32) CHARACTER SET ascii COLLATE ascii_general_ci NOT NULL COMMENT 'The ID of the target entity.',\n  `uuid` varchar(128) CHARACTER SET ascii COLLATE ascii_general_ci NOT NULL,\n  `langcode` varchar(12) CHARACTER SET ascii COLLATE ascii_general_ci NOT NULL,\n  PRIMARY KEY (`nid`),\n  UNIQUE KEY `node_field__uuid__value` (`uuid`),\n  UNIQUE KEY `node__vid` (`vid`),\n  KEY `node_field__type__target_id` (`type`)\n) ENGINE=InnoDB AUTO_INCREMENT=[Redacted by tbls] DEFAULT CHARSET=utf8mb4 COLLATE=utf8mb4_general_ci COMMENT='The base table for node entities.'"},{"name":"node_access","type":"BASE TABLE","comment":"Identifies which realm/grant pairs a user must possess in…","columns":[{"name":"nid","type":"int(10) unsigned","nullable":false,"default":"0","comment":"The \"node\".nid this record affects."},{"name":"langcode","type":"varchar(12)","nullable":false,"default":"''","comment":"The \"language\".langcode of this node."},{"name":"fallback","type":"tinyint(3) unsigned","nullable":false,"default":"1","comment":"Boolean indicating whether this record should be used as a fallback if a language condition is not provided."},{"name":"gid","type":"int(10) unsigned","nullable":false,"default":"0","comment":"The grant ID a user must possess in the specified realm to gain this row's privileges on the node."},{"name":"realm","type":"varchar(255)","nullable":false,"default":"''","comment":"The realm in which the user must possess the grant ID. Modules can define one or more realms by implementing hook_node_grants()."},{"name":"grant_view","type":"tinyint(3) unsigned","nullable":false,"default":"0","comment":"Boolean indicating whether a user with the realm/grant pair can view this node."},{"name":"grant_update","type":"tinyint(3) unsigned","nullable":false,"default":"0","comment":"Boolean indicating whether a user with the realm/grant pair can edit this node."},{"name":"grant_delete","type":"tinyint(3) unsigned","nullable":false,"default":"0","comment":"Boolean indicating whether a user with the realm/grant pair can delete this node."}],"indexes":[{"name":"PRIMARY","def":"PRIMARY KEY (nid, gid, realm, langcode) USING BTREE","table":"node_access","columns":["nid","gid","realm","langcode"],"comment":""}],"constraints":[{"name":"PRIMARY","type":"PRIMARY KEY","def":"PRIMARY KEY (nid, gid, realm, langcode)","table":"node_access","referenced_table":null,"columns":["nid","gid","realm","langcode"],"referenced_columns":null,"comment":""}],"triggers":[],"def":"CREATE TABLE `node_access` (\n  `nid` int(10) unsigned NOT NULL DEFAULT 0 COMMENT 'The \"node\".nid this record affects.',\n  `langcode` varchar(12) CHARACTER SET ascii COLLATE ascii_general_ci NOT NULL DEFAULT '' COMMENT 'The \"language\".langcode of this node.',\n  `fallback` tinyint(3) unsigned NOT NULL DEFAULT 1 COMMENT 'Boolean indicating whether this record should be used as a fallback if a language condition is not provided.',\n  `gid` int(10) unsigned NOT NULL DEFAULT 0 COMMENT 'The grant ID a user must possess in the specified realm to gain this row''s privileges on the node.',\n  `realm` varchar(255) CHARACTER SET ascii COLLATE ascii_general_ci NOT NULL DEFAULT '' COMMENT 'The realm in which the user must possess the grant ID. Modules can define one or more realms by implementing hook_node_grants().',\n  `grant_view` tinyint(3) unsigned NOT NULL DEFAULT 0 COMMENT 'Boolean indicating whether a user with the realm/grant pair can view this node.',\n  `grant_update` tinyint(3) unsigned NOT NULL DEFAULT 0 COMMENT 'Boolean indicating whether a user with the realm/grant pair can edit this node.',\n  `grant_delete` tinyint(3) unsigned NOT NULL DEFAULT 0 COMMENT 'Boolean indicating whether a user with the realm/grant pair can delete this node.',\n  PRIMARY KEY (`nid`,`gid`,`realm`,`langcode`)\n) ENGINE=InnoDB DEFAULT CHARSET=utf8mb4 COLLATE=utf8mb4_general_ci COMMENT='Identifies which realm/grant pairs a user must possess in…'"},{"name":"node_field_data","type":"BASE TABLE","comment":"The data table for node entities.","columns":[{"name":"nid","type":"int(10) unsigned","nullable":false,"default":null,"comment":""},{"name":"vid","type":"int(10) unsigned","nullable":false,"default":null,"comment":""},{"name":"type","type":"varchar(32)","nullable":false,"default":null,"comment":"The ID of the target entity."},{"name":"langcode","type":"varchar(12)","nullable":false,"default":null,"comment":""},{"name":"status","type":"tinyint(4)","nullable":false,"default":null,"comment":""},{"name":"uid","type":"int(10) unsigned","nullable":false,"default":null,"comment":"The ID of the target entity."},{"name":"title","type":"varchar(255)","nullable":false,"default":null,"comment":""},{"name":"created","type":"int(11)","nullable":false,"default":null,"comment":""},{"name":"changed","type":"int(11)","nullable":false,"default":null,"comment":""},{"name":"promote","type":"tinyint(4)","nullable":false,"default":null,"comment":""},{"name":"sticky","type":"tinyint(4)","nullable":false,"default":null,"comment":""},{"name":"default_langcode","type":"tinyint(4)","nullable":false,"default":null,"comment":""},{"name":"revision_translation_affected","type":"tinyint(4)","nullable":true,"default":"NULL","comment":""}],"indexes":[{"name":"node_field__changed","def":"KEY node_field__changed (changed) USING BTREE","table":"node_field_data","columns":["changed"],"comment":""},{"name":"node_field__created","def":"KEY node_field__created (created) USING BTREE","table":"node_field_data","columns":["created"],"comment":""},{"name":"node_field__type__target_id","def":"KEY node_field__type__target_id (type) USING BTREE","table":"node_field_data","columns":["type"],"comment":""},{"name":"node_field__uid__target_id","def":"KEY node_field__uid__target_id (uid) USING BTREE","table":"node_field_data","columns":["uid"],"comment":""},{"name":"node__frontpage","def":"KEY node__frontpage (promote, status, sticky, created) USING BTREE","table":"node_field_data","columns":["promote","status","sticky","created"],"comment":""},{"name":"node__id__default_langcode__langcode","def":"KEY node__id__default_langcode__langcode (nid, default_langcode, langcode) USING BTREE","table":"node_field_data","columns":["nid","default_langcode","langcode"],"comment":""},{"name":"node__status_type","def":"KEY node__status_type (status, type, nid) USING BTREE","table":"node_field_data","columns":["status","type","nid"],"comment":""},{"name":"node__title_type","def":"KEY node__title_type (title, type) USING BTREE","table":"node_field_data","columns":["title","type"],"comment":""},{"name":"node__vid","def":"KEY node__vid (vid) USING BTREE","table":"node_field_data","columns":["vid"],"comment":""},{"name":"PRIMARY","def":"PRIMARY KEY (nid, langcode) USING BTREE","table":"node_field_data","columns":["nid","langcode"],"comment":""}],"constraints":[{"name":"PRIMARY","type":"PRIMARY KEY","def":"PRIMARY KEY (nid, langcode)","table":"node_field_data","referenced_table":null,"columns":["nid","langcode"],"referenced_columns":null,"comment":""}],"triggers":[],"def":"CREATE TABLE `node_field_data` (\n  `nid` int(10) unsigned NOT NULL,\n  `vid` int(10) unsigned NOT NULL,\n  `type` varchar(32) CHARACTER SET ascii COLLATE ascii_general_ci NOT NULL COMMENT 'The ID of the target entity.',\n  `langcode` varchar(12) CHARACTER SET ascii COLLATE ascii_general_ci NOT NULL,\n  `status` tinyint(4) NOT NULL,\n  `uid` int(10) unsigned NOT NULL COMMENT 'The ID of the target entity.',\n  `title` varchar(255) NOT NULL,\n  `created` int(11) NOT NULL,\n  `changed` int(11) NOT NULL,\n  `promote` tinyint(4) NOT NULL,\n  `sticky` tinyint(4) NOT NULL,\n  `default_langcode` tinyint(4) NOT NULL,\n  `revision_translation_affected` tinyint(4) DEFAULT NULL,\n  PRIMARY KEY (`nid`,`langcode`),\n  KEY `node__id__default_langcode__langcode` (`nid`,`default_langcode`,`langcode`),\n  KEY `node__vid` (`vid`),\n  KEY `node_field__type__target_id` (`type`),\n  KEY `node_field__uid__target_id` (`uid`),\n  KEY `node_field__created` (`created`),\n  KEY `node_field__changed` (`changed`),\n  KEY `node__status_type` (`status`,`type`,`nid`),\n  KEY `node__frontpage` (`promote`,`status`,`sticky`,`created`),\n  KEY `node__title_type` (`title`(191),`type`(4))\n) ENGINE=InnoDB DEFAULT CHARSET=utf8mb4 COLLATE=utf8mb4_general_ci COMMENT='The data table for node entities.'"},{"name":"node_field_revision","type":"BASE TABLE","comment":"The revision data table for node entities.","columns":[{"name":"nid","type":"int(10) unsigned","nullable":false,"default":null,"comment":""},{"name":"vid","type":"int(10) unsigned","nullable":false,"default":null,"comment":""},{"name":"langcode","type":"varchar(12)","nullable":false,"default":null,"comment":""},{"name":"status","type":"tinyint(4)","nullable":false,"default":null,"comment":""},{"name":"uid","type":"int(10) unsigned","nullable":false,"default":null,"comment":"The ID of the target entity."},{"name":"title","type":"varchar(255)","nullable":true,"default":"NULL","comment":""},{"name":"created","type":"int(11)","nullable":true,"default":"NULL","comment":""},{"name":"changed","type":"int(11)","nullable":true,"default":"NULL","comment":""},{"name":"promote","type":"tinyint(4)","nullable":true,"default":"NULL","comment":""},{"name":"sticky","type":"tinyint(4)","nullable":true,"default":"NULL","comment":""},{"name":"default_langcode","type":"tinyint(4)","nullable":false,"default":null,"comment":""},{"name":"revision_translation_affected","type":"tinyint(4)","nullable":true,"default":"NULL","comment":""}],"indexes":[{"name":"node_field__uid__target_id","def":"KEY node_field__uid__target_id (uid) USING BTREE","table":"node_field_revision","columns":["uid"],"comment":""},{"name":"node__id__default_langcode__langcode","def":"KEY node__id__default_langcode__langcode (nid, default_langcode, langcode) USING BTREE","table":"node_field_revision","columns":["nid","default_langcode","langcode"],"comment":""},{"name":"PRIMARY","def":"PRIMARY KEY (vid, langcode) USING BTREE","table":"node_field_revision","columns":["vid","langcode"],"comment":""}],"constraints":[{"name":"PRIMARY","type":"PRIMARY KEY","def":"PRIMARY KEY (vid, langcode)","table":"node_field_revision","referenced_table":null,"columns":["vid","langcode"],"referenced_columns":null,"comment":""}],"triggers":[],"def":"CREATE TABLE `node_field_revision` (\n  `nid` int(10) unsigned NOT NULL,\n  `vid` int(10) unsigned NOT NULL,\n  `langcode` varchar(12) CHARACTER SET ascii COLLATE ascii_general_ci NOT NULL,\n  `status` tinyint(4) NOT NULL,\n  `uid` int(10) unsigned NOT NULL COMMENT 'The ID of the target entity.',\n  `title` varchar(255) DEFAULT NULL,\n  `created` int(11) DEFAULT NULL,\n  `changed` int(11) DEFAULT NULL,\n  `promote` tinyint(4) DEFAULT NULL,\n  `sticky` tinyint(4) DEFAULT NULL,\n  `default_langcode` tinyint(4) NOT NULL,\n  `revision_translation_affected` tinyint(4) DEFAULT NULL,\n  PRIMARY KEY (`vid`,`langcode`),\n  KEY `node__id__default_langcode__langcode` (`nid`,`default_langcode`,`langcode`),\n  KEY `node_field__uid__target_id` (`uid`)\n) ENGINE=InnoDB DEFAULT CHARSET=utf8mb4 COLLATE=utf8mb4_general_ci COMMENT='The revision data table for node entities.'"},{"name":"node_revision","type":"BASE TABLE","comment":"The revision table for node entities.","columns":[{"name":"nid","type":"int(10) unsigned","nullable":false,"default":null,"comment":""},{"name":"vid","type":"int(10) unsigned","nullable":false,"default":null,"comment":"","extra_def":"auto_increment"},{"name":"langcode","type":"varchar(12)","nullable":false,"default":null,"comment":""},{"name":"revision_uid","type":"int(10) unsigned","nullable":true,"default":"NULL","comment":"The ID of the target entity."},{"name":"revision_timestamp","type":"int(11)","nullable":true,"default":"NULL","comment":""},{"name":"revision_log","type":"longtext","nullable":true,"default":"NULL","comment":""},{"name":"revision_default","type":"tinyint(4)","nullable":true,"default":"NULL","comment":""}],"indexes":[{"name":"node_field__langcode","def":"KEY node_field__langcode (langcode) USING BTREE","table":"node_revision","columns":["langcode"],"comment":""},{"name":"node_field__revision_uid__target_id","def":"KEY node_field__revision_uid__target_id (revision_uid) USING BTREE","table":"node_revision","columns":["revision_uid"],"comment":""},{"name":"node__nid","def":"KEY node__nid (nid) USING BTREE","table":"node_revision","columns":["nid"],"comment":""},{"name":"PRIMARY","def":"PRIMARY KEY (vid) USING BTREE","table":"node_revision","columns":["vid"],"comment":""}],"constraints":[{"name":"PRIMARY","type":"PRIMARY KEY","def":"PRIMARY KEY (vid)","table":"node_revision","referenced_table":null,"columns":["vid"],"referenced_columns":null,"comment":""}],"triggers":[],"def":"CREATE TABLE `node_revision` (\n  `nid` int(10) unsigned NOT NULL,\n  `vid` int(10) unsigned NOT NULL AUTO_INCREMENT,\n  `langcode` varchar(12) CHARACTER SET ascii COLLATE ascii_general_ci NOT NULL,\n  `revision_uid` int(10) unsigned DEFAULT NULL COMMENT 'The ID of the target entity.',\n  `revision_timestamp` int(11) DEFAULT NULL,\n  `revision_log` longtext DEFAULT NULL,\n  `revision_default` tinyint(4) DEFAULT NULL,\n  PRIMARY KEY (`vid`),\n  KEY `node__nid` (`nid`),\n  KEY `node_field__langcode` (`langcode`),\n  KEY `node_field__revision_uid__target_id` (`revision_uid`)\n) ENGINE=InnoDB AUTO_INCREMENT=[Redacted by tbls] DEFAULT CHARSET=utf8mb4 COLLATE=utf8mb4_general_ci COMMENT='The revision table for node entities.'"},{"name":"node_revision__body","type":"BASE TABLE","comment":"Revision archive storage for node field body.","columns":[{"name":"bundle","type":"varchar(128)","nullable":false,"default":"''","comment":"The field instance bundle to which this row belongs, used when deleting a field instance"},{"name":"deleted","type":"tinyint(4)","nullable":false,"default":"0","comment":"A boolean indicating whether this data item has been deleted"},{"name":"entity_id","type":"int(10) unsigned","nullable":false,"default":null,"comment":"The entity id this data is attached to"},{"name":"revision_id","type":"int(10) unsigned","nullable":false,"default":null,"comment":"The entity revision id this data is attached to"},{"name":"langcode","type":"varchar(32)","nullable":false,"default":"''","comment":"The language code for this data item."},{"name":"delta","type":"int(10) unsigned","nullable":false,"default":null,"comment":"The sequence number for this data item, used for multi-value fields"},{"name":"body_value","type":"longtext","nullable":false,"default":null,"comment":""},{"name":"body_summary","type":"longtext","nullable":true,"default":"NULL","comment":""},{"name":"body_format","type":"varchar(255)","nullable":true,"default":"NULL","comment":""}],"indexes":[{"name":"body_format","def":"KEY body_format (body_format) USING BTREE","table":"node_revision__body","columns":["body_format"],"comment":""},{"name":"bundle","def":"KEY bundle (bundle) USING BTREE","table":"node_revision__body","columns":["bundle"],"comment":""},{"name":"revision_id","def":"KEY revision_id (revision_id) USING BTREE","table":"node_revision__body","columns":["revision_id"],"comment":""},{"name":"PRIMARY","def":"PRIMARY KEY (entity_id, revision_id, deleted, delta, langcode) USING BTREE","table":"node_revision__body","columns":["entity_id","revision_id","deleted","delta","langcode"],"comment":""}],"constraints":[{"name":"PRIMARY","type":"PRIMARY KEY","def":"PRIMARY KEY (entity_id, revision_id, deleted, delta, langcode)","table":"node_revision__body","referenced_table":null,"columns":["entity_id","revision_id","deleted","delta","langcode"],"referenced_columns":null,"comment":""}],"triggers":[],"def":"CREATE TABLE `node_revision__body` (\n  `bundle` varchar(128) CHARACTER SET ascii COLLATE ascii_general_ci NOT NULL DEFAULT '' COMMENT 'The field instance bundle to which this row belongs, used when deleting a field instance',\n  `deleted` tinyint(4) NOT NULL DEFAULT 0 COMMENT 'A boolean indicating whether this data item has been deleted',\n  `entity_id` int(10) unsigned NOT NULL COMMENT 'The entity id this data is attached to',\n  `revision_id` int(10) unsigned NOT NULL COMMENT 'The entity revision id this data is attached to',\n  `langcode` varchar(32) CHARACTER SET ascii COLLATE ascii_general_ci NOT NULL DEFAULT '' COMMENT 'The language code for this data item.',\n  `delta` int(10) unsigned NOT NULL COMMENT 'The sequence number for this data item, used for multi-value fields',\n  `body_value` longtext NOT NULL,\n  `body_summary` longtext DEFAULT NULL,\n  `body_format` varchar(255) CHARACTER SET ascii COLLATE ascii_general_ci DEFAULT NULL,\n  PRIMARY KEY (`entity_id`,`revision_id`,`deleted`,`delta`,`langcode`),\n  KEY `bundle` (`bundle`),\n  KEY `revision_id` (`revision_id`),\n  KEY `body_format` (`body_format`)\n) ENGINE=InnoDB DEFAULT CHARSET=utf8mb4 COLLATE=utf8mb4_general_ci COMMENT='Revision archive storage for node field body.'"},{"name":"node_revision__comment","type":"BASE TABLE","comment":"Revision archive storage for node field comment.","columns":[{"name":"bundle","type":"varchar(128)","nullable":false,"default":"''","comment":"The field instance bundle to which this row belongs, used when deleting a field instance"},{"name":"deleted","type":"tinyint(4)","nullable":false,"default":"0","comment":"A boolean indicating whether this data item has been deleted"},{"name":"entity_id","type":"int(10) unsigned","nullable":false,"default":null,"comment":"The entity id this data is attached to"},{"name":"revision_id","type":"int(10) unsigned","nullable":false,"default":null,"comment":"The entity revision id this data is attached to"},{"name":"langcode","type":"varchar(32)","nullable":false,"default":"''","comment":"The language code for this data item."},{"name":"delta","type":"int(10) unsigned","nullable":false,"default":null,"comment":"The sequence number for this data item, used for multi-value fields"},{"name":"comment_status","type":"int(11)","nullable":false,"default":"0","comment":"Whether comments are allowed on this entity: 0 = no, 1 = closed (read only), 2 = open (read/write)."}],"indexes":[{"name":"bundle","def":"KEY bundle (bundle) USING BTREE","table":"node_revision__comment","columns":["bundle"],"comment":""},{"name":"revision_id","def":"KEY revision_id (revision_id) USING BTREE","table":"node_revision__comment","columns":["revision_id"],"comment":""},{"name":"PRIMARY","def":"PRIMARY KEY (entity_id, revision_id, deleted, delta, langcode) USING BTREE","table":"node_revision__comment","columns":["entity_id","revision_id","deleted","delta","langcode"],"comment":""}],"constraints":[{"name":"PRIMARY","type":"PRIMARY KEY","def":"PRIMARY KEY (entity_id, revision_id, deleted, delta, langcode)","table":"node_revision__comment","referenced_table":null,"columns":["entity_id","revision_id","deleted","delta","langcode"],"referenced_columns":null,"comment":""}],"triggers":[],"def":"CREATE TABLE `node_revision__comment` (\n  `bundle` varchar(128) CHARACTER SET ascii COLLATE ascii_general_ci NOT NULL DEFAULT '' COMMENT 'The field instance bundle to which this row belongs, used when deleting a field instance',\n  `deleted` tinyint(4) NOT NULL DEFAULT 0 COMMENT 'A boolean indicating whether this data item has been deleted',\n  `entity_id` int(10) unsigned NOT NULL COMMENT 'The entity id this data is attached to',\n  `revision_id` int(10) unsigned NOT NULL COMMENT 'The entity revision id this data is attached to',\n  `langcode` varchar(32) CHARACTER SET ascii COLLATE ascii_general_ci NOT NULL DEFAULT '' COMMENT 'The language code for this data item.',\n  `delta` int(10) unsigned NOT NULL COMMENT 'The sequence number for this data item, used for multi-value fields',\n  `comment_status` int(11) NOT NULL DEFAULT 0 COMMENT 'Whether comments are allowed on this entity: 0 = no, 1 = closed (read only), 2 = open (read/write).',\n  PRIMARY KEY (`entity_id`,`revision_id`,`deleted`,`delta`,`langcode`),\n  KEY `bundle` (`bundle`),\n  KEY `revision_id` (`revision_id`)\n) ENGINE=InnoDB DEFAULT CHARSET=utf8mb4 COLLATE=utf8mb4_general_ci COMMENT='Revision archive storage for node field comment.'"},{"name":"node_revision__field_image","type":"BASE TABLE","comment":"Revision archive storage for node field field_image.","columns":[{"name":"bundle","type":"varchar(128)","nullable":false,"default":"''","comment":"The field instance bundle to which this row belongs, used when deleting a field instance"},{"name":"deleted","type":"tinyint(4)","nullable":false,"default":"0","comment":"A boolean indicating whether this data item has been deleted"},{"name":"entity_id","type":"int(10) unsigned","nullable":false,"default":null,"comment":"The entity id this data is attached to"},{"name":"revision_id","type":"int(10) unsigned","nullable":false,"default":null,"comment":"The entity revision id this data is attached to"},{"name":"langcode","type":"varchar(32)","nullable":false,"default":"''","comment":"The language code for this data item."},{"name":"delta","type":"int(10) unsigned","nullable":false,"default":null,"comment":"The sequence number for this data item, used for multi-value fields"},{"name":"field_image_target_id","type":"int(10) unsigned","nullable":false,"default":null,"comment":"The ID of the file entity."},{"name":"field_image_alt","type":"varchar(512)","nullable":true,"default":"NULL","comment":"Alternative image text, for the image's 'alt' attribute."},{"name":"field_image_title","type":"varchar(1024)","nullable":true,"default":"NULL","comment":"Image title text, for the image's 'title' attribute."},{"name":"field_image_width","type":"int(10) unsigned","nullable":true,"default":"NULL","comment":"The width of the image in pixels."},{"name":"field_image_height","type":"int(10) unsigned","nullable":true,"default":"NULL","comment":"The height of the image in pixels."}],"indexes":[{"name":"bundle","def":"KEY bundle (bundle) USING BTREE","table":"node_revision__field_image","columns":["bundle"],"comment":""},{"name":"field_image_target_id","def":"KEY field_image_target_id (field_image_target_id) USING BTREE","table":"node_revision__field_image","columns":["field_image_target_id"],"comment":""},{"name":"revision_id","def":"KEY revision_id (revision_id) USING BTREE","table":"node_revision__field_image","columns":["revision_id"],"comment":""},{"name":"PRIMARY","def":"PRIMARY KEY (entity_id, revision_id, deleted, delta, langcode) USING BTREE","table":"node_revision__field_image","columns":["entity_id","revision_id","deleted","delta","langcode"],"comment":""}],"constraints":[{"name":"PRIMARY","type":"PRIMARY KEY","def":"PRIMARY KEY (entity_id, revision_id, deleted, delta, langcode)","table":"node_revision__field_image","referenced_table":null,"columns":["entity_id","revision_id","deleted","delta","langcode"],"referenced_columns":null,"comment":""}],"triggers":[],"def":"CREATE TABLE `node_revision__field_image` (\n  `bundle` varchar(128) CHARACTER SET ascii COLLATE ascii_general_ci NOT NULL DEFAULT '' COMMENT 'The field instance bundle to which this row belongs, used when deleting a field instance',\n  `deleted` tinyint(4) NOT NULL DEFAULT 0 COMMENT 'A boolean indicating whether this data item has been deleted',\n  `entity_id` int(10) unsigned NOT NULL COMMENT 'The entity id this data is attached to',\n  `revision_id` int(10) unsigned NOT NULL COMMENT 'The entity revision id this data is attached to',\n  `langcode` varchar(32) CHARACTER SET ascii COLLATE ascii_general_ci NOT NULL DEFAULT '' COMMENT 'The language code for this data item.',\n  `delta` int(10) unsigned NOT NULL COMMENT 'The sequence number for this data item, used for multi-value fields',\n  `field_image_target_id` int(10) unsigned NOT NULL COMMENT 'The ID of the file entity.',\n  `field_image_alt` varchar(512) DEFAULT NULL COMMENT 'Alternative image text, for the image''s ''alt'' attribute.',\n  `field_image_title` varchar(1024) DEFAULT NULL COMMENT 'Image title text, for the image''s ''title'' attribute.',\n  `field_image_width` int(10) unsigned DEFAULT NULL COMMENT 'The width of the image in pixels.',\n  `field_image_height` int(10) unsigned DEFAULT NULL COMMENT 'The height of the image in pixels.',\n  PRIMARY KEY (`entity_id`,`revision_id`,`deleted`,`delta`,`langcode`),\n  KEY `bundle` (`bundle`),\n  KEY `revision_id` (`revision_id`),\n  KEY `field_image_target_id` (`field_image_target_id`)\n) ENGINE=InnoDB DEFAULT CHARSET=utf8mb4 COLLATE=utf8mb4_general_ci COMMENT='Revision archive storage for node field field_image.'"},{"name":"node_revision__field_tags","type":"BASE TABLE","comment":"Revision archive storage for node field field_tags.","columns":[{"name":"bundle","type":"varchar(128)","nullable":false,"default":"''","comment":"The field instance bundle to which this row belongs, used when deleting a field instance"},{"name":"deleted","type":"tinyint(4)","nullable":false,"default":"0","comment":"A boolean indicating whether this data item has been deleted"},{"name":"entity_id","type":"int(10) unsigned","nullable":false,"default":null,"comment":"The entity id this data is attached to"},{"name":"revision_id","type":"int(10) unsigned","nullable":false,"default":null,"comment":"The entity revision id this data is attached to"},{"name":"langcode","type":"varchar(32)","nullable":false,"default":"''","comment":"The language code for this data item."},{"name":"delta","type":"int(10) unsigned","nullable":false,"default":null,"comment":"The sequence number for this data item, used for multi-value fields"},{"name":"field_tags_target_id","type":"int(10) unsigned","nullable":false,"default":null,"comment":"The ID of the target entity."}],"indexes":[{"name":"bundle","def":"KEY bundle (bundle) USING BTREE","table":"node_revision__field_tags","columns":["bundle"],"comment":""},{"name":"field_tags_target_id","def":"KEY field_tags_target_id (field_tags_target_id) USING BTREE","table":"node_revision__field_tags","columns":["field_tags_target_id"],"comment":""},{"name":"revision_id","def":"KEY revision_id (revision_id) USING BTREE","table":"node_revision__field_tags","columns":["revision_id"],"comment":""},{"name":"PRIMARY","def":"PRIMARY KEY (entity_id, revision_id, deleted, delta, langcode) USING BTREE","table":"node_revision__field_tags","columns":["entity_id","revision_id","deleted","delta","langcode"],"comment":""}],"constraints":[{"name":"PRIMARY","type":"PRIMARY KEY","def":"PRIMARY KEY (entity_id, revision_id, deleted, delta, langcode)","table":"node_revision__field_tags","referenced_table":null,"columns":["entity_id","revision_id","deleted","delta","langcode"],"referenced_columns":null,"comment":""}],"triggers":[],"def":"CREATE TABLE `node_revision__field_tags` (\n  `bundle` varchar(128) CHARACTER SET ascii COLLATE ascii_general_ci NOT NULL DEFAULT '' COMMENT 'The field instance bundle to which this row belongs, used when deleting a field instance',\n  `deleted` tinyint(4) NOT NULL DEFAULT 0 COMMENT 'A boolean indicating whether this data item has been deleted',\n  `entity_id` int(10) unsigned NOT NULL COMMENT 'The entity id this data is attached to',\n  `revision_id` int(10) unsigned NOT NULL COMMENT 'The entity revision id this data is attached to',\n  `langcode` varchar(32) CHARACTER SET ascii COLLATE ascii_general_ci NOT NULL DEFAULT '' COMMENT 'The language code for this data item.',\n  `delta` int(10) unsigned NOT NULL COMMENT 'The sequence number for this data item, used for multi-value fields',\n  `field_tags_target_id` int(10) unsigned NOT NULL COMMENT 'The ID of the target entity.',\n  PRIMARY KEY (`entity_id`,`revision_id`,`deleted`,`delta`,`langcode`),\n  KEY `bundle` (`bundle`),\n  KEY `revision_id` (`revision_id`),\n  KEY `field_tags_target_id` (`field_tags_target_id`)\n) ENGINE=InnoDB DEFAULT CHARSET=utf8mb4 COLLATE=utf8mb4_general_ci COMMENT='Revision archive storage for node field field_tags.'"},{"name":"node__body","type":"BASE TABLE","comment":"Data storage for node field body.","columns":[{"name":"bundle","type":"varchar(128)","nullable":false,"default":"''","comment":"The field instance bundle to which this row belongs, used when deleting a field instance"},{"name":"deleted","type":"tinyint(4)","nullable":false,"default":"0","comment":"A boolean indicating whether this data item has been deleted"},{"name":"entity_id","type":"int(10) unsigned","nullable":false,"default":null,"comment":"The entity id this data is attached to"},{"name":"revision_id","type":"int(10) unsigned","nullable":false,"default":null,"comment":"The entity revision id this data is attached to"},{"name":"langcode","type":"varchar(32)","nullable":false,"default":"''","comment":"The language code for this data item."},{"name":"delta","type":"int(10) unsigned","nullable":false,"default":null,"comment":"The sequence number for this data item, used for multi-value fields"},{"name":"body_value","type":"longtext","nullable":false,"default":null,"comment":""},{"name":"body_summary","type":"longtext","nullable":true,"default":"NULL","comment":""},{"name":"body_format","type":"varchar(255)","nullable":true,"default":"NULL","comment":""}],"indexes":[{"name":"body_format","def":"KEY body_format (body_format) USING BTREE","table":"node__body","columns":["body_format"],"comment":""},{"name":"bundle","def":"KEY bundle (bundle) USING BTREE","table":"node__body","columns":["bundle"],"comment":""},{"name":"revision_id","def":"KEY revision_id (revision_id) USING BTREE","table":"node__body","columns":["revision_id"],"comment":""},{"name":"PRIMARY","def":"PRIMARY KEY (entity_id, deleted, delta, langcode) USING BTREE","table":"node__body","columns":["entity_id","deleted","delta","langcode"],"comment":""}],"constraints":[{"name":"PRIMARY","type":"PRIMARY KEY","def":"PRIMARY KEY (entity_id, deleted, delta, langcode)","table":"node__body","referenced_table":null,"columns":["entity_id","deleted","delta","langcode"],"referenced_columns":null,"comment":""}],"triggers":[],"def":"CREATE TABLE `node__body` (\n  `bundle` varchar(128) CHARACTER SET ascii COLLATE ascii_general_ci NOT NULL DEFAULT '' COMMENT 'The field instance bundle to which this row belongs, used when deleting a field instance',\n  `deleted` tinyint(4) NOT NULL DEFAULT 0 COMMENT 'A boolean indicating whether this data item has been deleted',\n  `entity_id` int(10) unsigned NOT NULL COMMENT 'The entity id this data is attached to',\n  `revision_id` int(10) unsigned NOT NULL COMMENT 'The entity revision id this data is attached to',\n  `langcode` varchar(32) CHARACTER SET ascii COLLATE ascii_general_ci NOT NULL DEFAULT '' COMMENT 'The language code for this data item.',\n  `delta` int(10) unsigned NOT NULL COMMENT 'The sequence number for this data item, used for multi-value fields',\n  `body_value` longtext NOT NULL,\n  `body_summary` longtext DEFAULT NULL,\n  `body_format` varchar(255) CHARACTER SET ascii COLLATE ascii_general_ci DEFAULT NULL,\n  PRIMARY KEY (`entity_id`,`deleted`,`delta`,`langcode`),\n  KEY `bundle` (`bundle`),\n  KEY `revision_id` (`revision_id`),\n  KEY `body_format` (`body_format`)\n) ENGINE=InnoDB DEFAULT CHARSET=utf8mb4 COLLATE=utf8mb4_general_ci COMMENT='Data storage for node field body.'"},{"name":"node__comment","type":"BASE TABLE","comment":"Data storage for node field comment.","columns":[{"name":"bundle","type":"varchar(128)","nullable":false,"default":"''","comment":"The field instance bundle to which this row belongs, used when deleting a field instance"},{"name":"deleted","type":"tinyint(4)","nullable":false,"default":"0","comment":"A boolean indicating whether this data item has been deleted"},{"name":"entity_id","type":"int(10) unsigned","nullable":false,"default":null,"comment":"The entity id this data is attached to"},{"name":"revision_id","type":"int(10) unsigned","nullable":false,"default":null,"comment":"The entity revision id this data is attached to"},{"name":"langcode","type":"varchar(32)","nullable":false,"default":"''","comment":"The language code for this data item."},{"name":"delta","type":"int(10) unsigned","nullable":false,"default":null,"comment":"The sequence number for this data item, used for multi-value fields"},{"name":"comment_status","type":"int(11)","nullable":false,"default":"0","comment":"Whether comments are allowed on this entity: 0 = no, 1 = closed (read only), 2 = open (read/write)."}],"indexes":[{"name":"bundle","def":"KEY bundle (bundle) USING BTREE","table":"node__comment","columns":["bundle"],"comment":""},{"name":"revision_id","def":"KEY revision_id (revision_id) USING BTREE","table":"node__comment","columns":["revision_id"],"comment":""},{"name":"PRIMARY","def":"PRIMARY KEY (entity_id, deleted, delta, langcode) USING BTREE","table":"node__comment","columns":["entity_id","deleted","delta","langcode"],"comment":""}],"constraints":[{"name":"PRIMARY","type":"PRIMARY KEY","def":"PRIMARY KEY (entity_id, deleted, delta, langcode)","table":"node__comment","referenced_table":null,"columns":["entity_id","deleted","delta","langcode"],"referenced_columns":null,"comment":""}],"triggers":[],"def":"CREATE TABLE `node__comment` (\n  `bundle` varchar(128) CHARACTER SET ascii COLLATE ascii_general_ci NOT NULL DEFAULT '' COMMENT 'The field instance bundle to which this row belongs, used when deleting a field instance',\n  `deleted` tinyint(4) NOT NULL DEFAULT 0 COMMENT 'A boolean indicating whether this data item has been deleted',\n  `entity_id` int(10) unsigned NOT NULL COMMENT 'The entity id this data is attached to',\n  `revision_id` int(10) unsigned NOT NULL COMMENT 'The entity revision id this data is attached to',\n  `langcode` varchar(32) CHARACTER SET ascii COLLATE ascii_general_ci NOT NULL DEFAULT '' COMMENT 'The language code for this data item.',\n  `delta` int(10) unsigned NOT NULL COMMENT 'The sequence number for this data item, used for multi-value fields',\n  `comment_status` int(11) NOT NULL DEFAULT 0 COMMENT 'Whether comments are allowed on this entity: 0 = no, 1 = closed (read only), 2 = open (read/write).',\n  PRIMARY KEY (`entity_id`,`deleted`,`delta`,`langcode`),\n  KEY `bundle` (`bundle`),\n  KEY `revision_id` (`revision_id`)\n) ENGINE=InnoDB DEFAULT CHARSET=utf8mb4 COLLATE=utf8mb4_general_ci COMMENT='Data storage for node field comment.'"},{"name":"node__field_image","type":"BASE TABLE","comment":"Data storage for node field field_image.","columns":[{"name":"bundle","type":"varchar(128)","nullable":false,"default":"''","comment":"The field instance bundle to which this row belongs, used when deleting a field instance"},{"name":"deleted","type":"tinyint(4)","nullable":false,"default":"0","comment":"A boolean indicating whether this data item has been deleted"},{"name":"entity_id","type":"int(10) unsigned","nullable":false,"default":null,"comment":"The entity id this data is attached to"},{"name":"revision_id","type":"int(10) unsigned","nullable":false,"default":null,"comment":"The entity revision id this data is attached to"},{"name":"langcode","type":"varchar(32)","nullable":false,"default":"''","comment":"The language code for this data item."},{"name":"delta","type":"int(10) unsigned","nullable":false,"default":null,"comment":"The sequence number for this data item, used for multi-value fields"},{"name":"field_image_target_id","type":"int(10) unsigned","nullable":false,"default":null,"comment":"The ID of the file entity."},{"name":"field_image_alt","type":"varchar(512)","nullable":true,"default":"NULL","comment":"Alternative image text, for the image's 'alt' attribute."},{"name":"field_image_title","type":"varchar(1024)","nullable":true,"default":"NULL","comment":"Image title text, for the image's 'title' attribute."},{"name":"field_image_width","type":"int(10) unsigned","nullable":true,"default":"NULL","comment":"The width of the image in pixels."},{"name":"field_image_height","type":"int(10) unsigned","nullable":true,"default":"NULL","comment":"The height of the image in pixels."}],"indexes":[{"name":"bundle","def":"KEY bundle (bundle) USING BTREE","table":"node__field_image","columns":["bundle"],"comment":""},{"name":"field_image_target_id","def":"KEY field_image_target_id (field_image_target_id) USING BTREE","table":"node__field_image","columns":["field_image_target_id"],"comment":""},{"name":"revision_id","def":"KEY revision_id (revision_id) USING BTREE","table":"node__field_image","columns":["revision_id"],"comment":""},{"name":"PRIMARY","def":"PRIMARY KEY (entity_id, deleted, delta, langcode) USING BTREE","table":"node__field_image","columns":["entity_id","deleted","delta","langcode"],"comment":""}],"constraints":[{"name":"PRIMARY","type":"PRIMARY KEY","def":"PRIMARY KEY (entity_id, deleted, delta, langcode)","table":"node__field_image","referenced_table":null,"columns":["entity_id","deleted","delta","langcode"],"referenced_columns":null,"comment":""}],"triggers":[],"def":"CREATE TABLE `node__field_image` (\n  `bundle` varchar(128) CHARACTER SET ascii COLLATE ascii_general_ci NOT NULL DEFAULT '' COMMENT 'The field instance bundle to which this row belongs, used when deleting a field instance',\n  `deleted` tinyint(4) NOT NULL DEFAULT 0 COMMENT 'A boolean indicating whether this data item has been deleted',\n  `entity_id` int(10) unsigned NOT NULL COMMENT 'The entity id this data is attached to',\n  `revision_id` int(10) unsigned NOT NULL COMMENT 'The entity revision id this data is attached to',\n  `langcode` varchar(32) CHARACTER SET ascii COLLATE ascii_general_ci NOT NULL DEFAULT '' COMMENT 'The language code for this data item.',\n  `delta` int(10) unsigned NOT NULL COMMENT 'The sequence number for this data item, used for multi-value fields',\n  `field_image_target_id` int(10) unsigned NOT NULL COMMENT 'The ID of the file entity.',\n  `field_image_alt` varchar(512) DEFAULT NULL COMMENT 'Alternative image text, for the image''s ''alt'' attribute.',\n  `field_image_title` varchar(1024) DEFAULT NULL COMMENT 'Image title text, for the image''s ''title'' attribute.',\n  `field_image_width` int(10) unsigned DEFAULT NULL COMMENT 'The width of the image in pixels.',\n  `field_image_height` int(10) unsigned DEFAULT NULL COMMENT 'The height of the image in pixels.',\n  PRIMARY KEY (`entity_id`,`deleted`,`delta`,`langcode`),\n  KEY `bundle` (`bundle`),\n  KEY `revision_id` (`revision_id`),\n  KEY `field_image_target_id` (`field_image_target_id`)\n) ENGINE=InnoDB DEFAULT CHARSET=utf8mb4 COLLATE=utf8mb4_general_ci COMMENT='Data storage for node field field_image.'"},{"name":"node__field_tags","type":"BASE TABLE","comment":"Data storage for node field field_tags.","columns":[{"name":"bundle","type":"varchar(128)","nullable":false,"default":"''","comment":"The field instance bundle to which this row belongs, used when deleting a field instance"},{"name":"deleted","type":"tinyint(4)","nullable":false,"default":"0","comment":"A boolean indicating whether this data item has been deleted"},{"name":"entity_id","type":"int(10) unsigned","nullable":false,"default":null,"comment":"The entity id this data is attached to"},{"name":"revision_id","type":"int(10) unsigned","nullable":false,"default":null,"comment":"The entity revision id this data is attached to"},{"name":"langcode","type":"varchar(32)","nullable":false,"default":"''","comment":"The language code for this data item."},{"name":"delta","type":"int(10) unsigned","nullable":false,"default":null,"comment":"The sequence number for this data item, used for multi-value fields"},{"name":"field_tags_target_id","type":"int(10) unsigned","nullable":false,"default":null,"comment":"The ID of the target entity."}],"indexes":[{"name":"bundle","def":"KEY bundle (bundle) USING BTREE","table":"node__field_tags","columns":["bundle"],"comment":""},{"name":"field_tags_target_id","def":"KEY field_tags_target_id (field_tags_target_id) USING BTREE","table":"node__field_tags","columns":["field_tags_target_id"],"comment":""},{"name":"revision_id","def":"KEY revision_id (revision_id) USING BTREE","table":"node__field_tags","columns":["revision_id"],"comment":""},{"name":"PRIMARY","def":"PRIMARY KEY (entity_id, deleted, delta, langcode) USING BTREE","table":"node__field_tags","columns":["entity_id","deleted","delta","langcode"],"comment":""}],"constraints":[{"name":"PRIMARY","type":"PRIMARY KEY","def":"PRIMARY KEY (entity_id, deleted, delta, langcode)","table":"node__field_tags","referenced_table":null,"columns":["entity_id","deleted","delta","langcode"],"referenced_columns":null,"comment":""}],"triggers":[],"def":"CREATE TABLE `node__field_tags` (\n  `bundle` varchar(128) CHARACTER SET ascii COLLATE ascii_general_ci NOT NULL DEFAULT '' COMMENT 'The field instance bundle to which this row belongs, used when deleting a field instance',\n  `deleted` tinyint(4) NOT NULL DEFAULT 0 COMMENT 'A boolean indicating whether this data item has been deleted',\n  `entity_id` int(10) unsigned NOT NULL COMMENT 'The entity id this data is attached to',\n  `revision_id` int(10) unsigned NOT NULL COMMENT 'The entity revision id this data is attached to',\n  `langcode` varchar(32) CHARACTER SET ascii COLLATE ascii_general_ci NOT NULL DEFAULT '' COMMENT 'The language code for this data item.',\n  `delta` int(10) unsigned NOT NULL COMMENT 'The sequence number for this data item, used for multi-value fields',\n  `field_tags_target_id` int(10) unsigned NOT NULL COMMENT 'The ID of the target entity.',\n  PRIMARY KEY (`entity_id`,`deleted`,`delta`,`langcode`),\n  KEY `bundle` (`bundle`),\n  KEY `revision_id` (`revision_id`),\n  KEY `field_tags_target_id` (`field_tags_target_id`)\n) ENGINE=InnoDB DEFAULT CHARSET=utf8mb4 COLLATE=utf8mb4_general_ci COMMENT='Data storage for node field field_tags.'"},{"name":"path_alias","type":"BASE TABLE","comment":"The base table for path_alias entities.","columns":[{"name":"id","type":"int(10) unsigned","nullable":false,"default":null,"comment":"","extra_def":"auto_increment"},{"name":"revision_id","type":"int(10) unsigned","nullable":true,"default":"NULL","comment":""},{"name":"uuid","type":"varchar(128)","nullable":false,"default":null,"comment":""},{"name":"langcode","type":"varchar(12)","nullable":false,"default":null,"comment":""},{"name":"path","type":"varchar(255)","nullable":true,"default":"NULL","comment":""},{"name":"alias","type":"varchar(255)","nullable":true,"default":"NULL","comment":""},{"name":"status","type":"tinyint(4)","nullable":false,"default":null,"comment":""}],"indexes":[{"name":"path_alias__alias_langcode_id_status","def":"KEY path_alias__alias_langcode_id_status (alias, langcode, id, status) USING BTREE","table":"path_alias","columns":["alias","langcode","id","status"],"comment":""},{"name":"path_alias__path_langcode_id_status","def":"KEY path_alias__path_langcode_id_status (path, langcode, id, status) USING BTREE","table":"path_alias","columns":["path","langcode","id","status"],"comment":""},{"name":"path_alias__status","def":"KEY path_alias__status (status, id) USING BTREE","table":"path_alias","columns":["status","id"],"comment":""},{"name":"PRIMARY","def":"PRIMARY KEY (id) USING BTREE","table":"path_alias","columns":["id"],"comment":""},{"name":"path_alias_field__uuid__value","def":"UNIQUE KEY path_alias_field__uuid__value (uuid) USING BTREE","table":"path_alias","columns":["uuid"],"comment":""},{"name":"path_alias__revision_id","def":"UNIQUE KEY path_alias__revision_id (revision_id) USING BTREE","table":"path_alias","columns":["revision_id"],"comment":""}],"constraints":[{"name":"path_alias_field__uuid__value","type":"UNIQUE","def":"UNIQUE KEY path_alias_field__uuid__value (uuid)","table":"path_alias","referenced_table":null,"columns":["uuid"],"referenced_columns":null,"comment":""},{"name":"path_alias__revision_id","type":"UNIQUE","def":"UNIQUE KEY path_alias__revision_id (revision_id)","table":"path_alias","referenced_table":null,"columns":["revision_id"],"referenced_columns":null,"comment":""},{"name":"PRIMARY","type":"PRIMARY KEY","def":"PRIMARY KEY (id)","table":"path_alias","referenced_table":null,"columns":["id"],"referenced_columns":null,"comment":""}],"triggers":[],"def":"CREATE TABLE `path_alias` (\n  `id` int(10) unsigned NOT NULL AUTO_INCREMENT,\n  `revision_id` int(10) unsigned DEFAULT NULL,\n  `uuid` varchar(128) CHARACTER SET ascii COLLATE ascii_general_ci NOT NULL,\n  `langcode` varchar(12) CHARACTER SET ascii COLLATE ascii_general_ci NOT NULL,\n  `path` varchar(255) DEFAULT NULL,\n  `alias` varchar(255) DEFAULT NULL,\n  `status` tinyint(4) NOT NULL,\n  PRIMARY KEY (`id`),\n  UNIQUE KEY `path_alias_field__uuid__value` (`uuid`),\n  UNIQUE KEY `path_alias__revision_id` (`revision_id`),\n  KEY `path_alias__status` (`status`,`id`),\n  KEY `path_alias__alias_langcode_id_status` (`alias`(191),`langcode`,`id`,`status`),\n  KEY `path_alias__path_langcode_id_status` (`path`(191),`langcode`,`id`,`status`)\n) ENGINE=InnoDB AUTO_INCREMENT=[Redacted by tbls] DEFAULT CHARSET=utf8mb4 COLLATE=utf8mb4_general_ci COMMENT='The base table for path_alias entities.'"},{"name":"path_alias_revision","type":"BASE TABLE","comment":"The revision table for path_alias entities.","columns":[{"name":"id","type":"int(10) unsigned","nullable":false,"default":null,"comment":""},{"name":"revision_id","type":"int(10) unsigned","nullable":false,"default":null,"comment":"","extra_def":"auto_increment"},{"name":"langcode","type":"varchar(12)","nullable":false,"default":null,"comment":""},{"name":"path","type":"varchar(255)","nullable":true,"default":"NULL","comment":""},{"name":"alias","type":"varchar(255)","nullable":true,"default":"NULL","comment":""},{"name":"status","type":"tinyint(4)","nullable":false,"default":null,"comment":""},{"name":"revision_default","type":"tinyint(4)","nullable":true,"default":"NULL","comment":""}],"indexes":[{"name":"path_alias__id","def":"KEY path_alias__id (id) USING BTREE","table":"path_alias_revision","columns":["id"],"comment":""},{"name":"PRIMARY","def":"PRIMARY KEY (revision_id) USING BTREE","table":"path_alias_revision","columns":["revision_id"],"comment":""}],"constraints":[{"name":"PRIMARY","type":"PRIMARY KEY","def":"PRIMARY KEY (revision_id)","table":"path_alias_revision","referenced_table":null,"columns":["revision_id"],"referenced_columns":null,"comment":""}],"triggers":[],"def":"CREATE TABLE `path_alias_revision` (\n  `id` int(10) unsigned NOT NULL,\n  `revision_id` int(10) unsigned NOT NULL AUTO_INCREMENT,\n  `langcode` varchar(12) CHARACTER SET ascii COLLATE ascii_general_ci NOT NULL,\n  `path` varchar(255) DEFAULT NULL,\n  `alias` varchar(255) DEFAULT NULL,\n  `status` tinyint(4) NOT NULL,\n  `revision_default` tinyint(4) DEFAULT NULL,\n  PRIMARY KEY (`revision_id`),\n  KEY `path_alias__id` (`id`)\n) ENGINE=InnoDB AUTO_INCREMENT=[Redacted by tbls] DEFAULT CHARSET=utf8mb4 COLLATE=utf8mb4_general_ci COMMENT='The revision table for path_alias entities.'"},{"name":"queue","type":"BASE TABLE","comment":"Stores items in queues.","columns":[{"name":"item_id","type":"int(10) unsigned","nullable":false,"default":null,"comment":"Primary Key: Unique item ID.","extra_def":"auto_increment"},{"name":"name","type":"varchar(255)","nullable":false,"default":"''","comment":"The queue name."},{"name":"data","type":"longblob","nullable":true,"default":"NULL","comment":"The arbitrary data for the item."},{"name":"expire","type":"int(11)","nullable":false,"default":"0","comment":"Timestamp when the claim lease expires on the item."},{"name":"created","type":"int(11)","nullable":false,"default":"0","comment":"Timestamp when the item was created."}],"indexes":[{"name":"expire","def":"KEY expire (expire) USING BTREE","table":"queue","columns":["expire"],"comment":""},{"name":"name_created","def":"KEY name_created (name, created) USING BTREE","table":"queue","columns":["name","created"],"comment":""},{"name":"PRIMARY","def":"PRIMARY KEY (item_id) USING BTREE","table":"queue","columns":["item_id"],"comment":""}],"constraints":[{"name":"PRIMARY","type":"PRIMARY KEY","def":"PRIMARY KEY (item_id)","table":"queue","referenced_table":null,"columns":["item_id"],"referenced_columns":null,"comment":""}],"triggers":[],"def":"CREATE TABLE `queue` (\n  `item_id` int(10) unsigned NOT NULL AUTO_INCREMENT COMMENT 'Primary Key: Unique item ID.',\n  `name` varchar(255) CHARACTER SET ascii COLLATE ascii_general_ci NOT NULL DEFAULT '' COMMENT 'The queue name.',\n  `data` longblob DEFAULT NULL COMMENT 'The arbitrary data for the item.',\n  `expire` int(11) NOT NULL DEFAULT 0 COMMENT 'Timestamp when the claim lease expires on the item.',\n  `created` int(11) NOT NULL DEFAULT 0 COMMENT 'Timestamp when the item was created.',\n  PRIMARY KEY (`item_id`),\n  KEY `name_created` (`name`,`created`),\n  KEY `expire` (`expire`)\n) ENGINE=InnoDB AUTO_INCREMENT=[Redacted by tbls] DEFAULT CHARSET=utf8mb4 COLLATE=utf8mb4_general_ci COMMENT='Stores items in queues.'"},{"name":"router","type":"BASE TABLE","comment":"Maps paths to various callbacks (access, page and title)","columns":[{"name":"name","type":"varchar(255)","nullable":false,"default":"''","comment":"Primary Key: Machine name of this route"},{"name":"path","type":"varchar(255)","nullable":false,"default":"''","comment":"The path for this URI"},{"name":"pattern_outline","type":"varchar(255)","nullable":false,"default":"''","comment":"The pattern"},{"name":"fit","type":"int(11)","nullable":false,"default":"0","comment":"A numeric representation of how specific the path is."},{"name":"route","type":"longblob","nullable":true,"default":"NULL","comment":"A serialized Route object"},{"name":"number_parts","type":"smallint(6)","nullable":false,"default":"0","comment":"Number of parts in this router path."}],"indexes":[{"name":"pattern_outline_parts","def":"KEY pattern_outline_parts (pattern_outline, number_parts) USING BTREE","table":"router","columns":["pattern_outline","number_parts"],"comment":""},{"name":"PRIMARY","def":"PRIMARY KEY (name) USING BTREE","table":"router","columns":["name"],"comment":""}],"constraints":[{"name":"PRIMARY","type":"PRIMARY KEY","def":"PRIMARY KEY (name)","table":"router","referenced_table":null,"columns":["name"],"referenced_columns":null,"comment":""}],"triggers":[],"def":"CREATE TABLE `router` (\n  `name` varchar(255) CHARACTER SET ascii COLLATE ascii_general_ci NOT NULL DEFAULT '' COMMENT 'Primary Key: Machine name of this route',\n  `path` varchar(255) NOT NULL DEFAULT '' COMMENT 'The path for this URI',\n  `pattern_outline` varchar(255) NOT NULL DEFAULT '' COMMENT 'The pattern',\n  `fit` int(11) NOT NULL DEFAULT 0 COMMENT 'A numeric representation of how specific the path is.',\n  `route` longblob DEFAULT NULL COMMENT 'A serialized Route object',\n  `number_parts` smallint(6) NOT NULL DEFAULT 0 COMMENT 'Number of parts in this router path.',\n  PRIMARY KEY (`name`),\n  KEY `pattern_outline_parts` (`pattern_outline`(191),`number_parts`)\n) ENGINE=InnoDB DEFAULT CHARSET=utf8mb4 COLLATE=utf8mb4_general_ci COMMENT='Maps paths to various callbacks (access, page and title)'"},{"name":"search_dataset","type":"BASE TABLE","comment":"Stores items that will be searched.","columns":[{"name":"sid","type":"int(10) unsigned","nullable":false,"default":"0","comment":"Search item ID, e.g. node ID for nodes."},{"name":"langcode","type":"varchar(12)","nullable":false,"default":"''","comment":"The \"languages\".langcode of the item variant."},{"name":"type","type":"varchar(64)","nullable":false,"default":null,"comment":"Type of item, e.g. node."},{"name":"data","type":"longtext","nullable":false,"default":null,"comment":"List of space-separated words from the item."},{"name":"reindex","type":"int(10) unsigned","nullable":false,"default":"0","comment":"Set to force node reindexing."}],"indexes":[{"name":"PRIMARY","def":"PRIMARY KEY (sid, langcode, type) USING BTREE","table":"search_dataset","columns":["sid","langcode","type"],"comment":""}],"constraints":[{"name":"PRIMARY","type":"PRIMARY KEY","def":"PRIMARY KEY (sid, langcode, type)","table":"search_dataset","referenced_table":null,"columns":["sid","langcode","type"],"referenced_columns":null,"comment":""}],"triggers":[],"def":"CREATE TABLE `search_dataset` (\n  `sid` int(10) unsigned NOT NULL DEFAULT 0 COMMENT 'Search item ID, e.g. node ID for nodes.',\n  `langcode` varchar(12) CHARACTER SET ascii COLLATE ascii_general_ci NOT NULL DEFAULT '' COMMENT 'The \"languages\".langcode of the item variant.',\n  `type` varchar(64) CHARACTER SET ascii COLLATE ascii_general_ci NOT NULL COMMENT 'Type of item, e.g. node.',\n  `data` longtext NOT NULL COMMENT 'List of space-separated words from the item.',\n  `reindex` int(10) unsigned NOT NULL DEFAULT 0 COMMENT 'Set to force node reindexing.',\n  PRIMARY KEY (`sid`,`langcode`,`type`)\n) ENGINE=InnoDB DEFAULT CHARSET=utf8mb4 COLLATE=utf8mb4_general_ci COMMENT='Stores items that will be searched.'"},{"name":"search_index","type":"BASE TABLE","comment":"Stores the search index, associating words, items and…","columns":[{"name":"word","type":"varchar(50)","nullable":false,"default":"''","comment":"The \"search_total\".word that is associated with the search item."},{"name":"sid","type":"int(10) unsigned","nullable":false,"default":"0","comment":"The \"search_dataset\".sid of the searchable item to which the word belongs."},{"name":"langcode","type":"varchar(12)","nullable":false,"default":"''","comment":"The \"languages\".langcode of the item variant."},{"name":"type","type":"varchar(64)","nullable":false,"default":null,"comment":"The \"search_dataset\".type of the searchable item to which the word belongs."},{"name":"score","type":"float","nullable":true,"default":"NULL","comment":"The numeric score of the word, higher being more important."}],"indexes":[{"name":"sid_type","def":"KEY sid_type (sid, langcode, type) USING BTREE","table":"search_index","columns":["sid","langcode","type"],"comment":""},{"name":"PRIMARY","def":"PRIMARY KEY (word, sid, langcode, type) USING BTREE","table":"search_index","columns":["word","sid","langcode","type"],"comment":""}],"constraints":[{"name":"PRIMARY","type":"PRIMARY KEY","def":"PRIMARY KEY (word, sid, langcode, type)","table":"search_index","referenced_table":null,"columns":["word","sid","langcode","type"],"referenced_columns":null,"comment":""}],"triggers":[],"def":"CREATE TABLE `search_index` (\n  `word` varchar(50) NOT NULL DEFAULT '' COMMENT 'The \"search_total\".word that is associated with the search item.',\n  `sid` int(10) unsigned NOT NULL DEFAULT 0 COMMENT 'The \"search_dataset\".sid of the searchable item to which the word belongs.',\n  `langcode` varchar(12) CHARACTER SET ascii COLLATE ascii_general_ci NOT NULL DEFAULT '' COMMENT 'The \"languages\".langcode of the item variant.',\n  `type` varchar(64) CHARACTER SET ascii COLLATE ascii_general_ci NOT NULL COMMENT 'The \"search_dataset\".type of the searchable item to which the word belongs.',\n  `score` float DEFAULT NULL COMMENT 'The numeric score of the word, higher being more important.',\n  PRIMARY KEY (`word`,`sid`,`langcode`,`type`),\n  KEY `sid_type` (`sid`,`langcode`,`type`)\n) ENGINE=InnoDB DEFAULT CHARSET=utf8mb4 COLLATE=utf8mb4_general_ci COMMENT='Stores the search index, associating words, items and…'"},{"name":"search_total","type":"BASE TABLE","comment":"Stores search totals for words.","columns":[{"name":"word","type":"varchar(50)","nullable":false,"default":"''","comment":"Primary Key: Unique word in the search index."},{"name":"count","type":"float","nullable":true,"default":"NULL","comment":"The count of the word in the index using Zipf's law to equalize the probability distribution."}],"indexes":[{"name":"PRIMARY","def":"PRIMARY KEY (word) USING BTREE","table":"search_total","columns":["word"],"comment":""}],"constraints":[{"name":"PRIMARY","type":"PRIMARY KEY","def":"PRIMARY KEY (word)","table":"search_total","referenced_table":null,"columns":["word"],"referenced_columns":null,"comment":""}],"triggers":[],"def":"CREATE TABLE `search_total` (\n  `word` varchar(50) NOT NULL DEFAULT '' COMMENT 'Primary Key: Unique word in the search index.',\n  `count` float DEFAULT NULL COMMENT 'The count of the word in the index using Zipf''s law to equalize the probability distribution.',\n  PRIMARY KEY (`word`)\n) ENGINE=InnoDB DEFAULT CHARSET=utf8mb4 COLLATE=utf8mb4_general_ci COMMENT='Stores search totals for words.'"},{"name":"semaphore","type":"BASE TABLE","comment":"Table for holding semaphores, locks, flags, etc. that…","columns":[{"name":"name","type":"varchar(255)","nullable":false,"default":"''","comment":"Primary Key: Unique name."},{"name":"value","type":"varchar(255)","nullable":false,"default":"''","comment":"A value for the semaphore."},{"name":"expire","type":"double","nullable":false,"default":null,"comment":"A Unix timestamp with microseconds indicating when the semaphore should expire."}],"indexes":[{"name":"expire","def":"KEY expire (expire) USING BTREE","table":"semaphore","columns":["expire"],"comment":""},{"name":"value","def":"KEY value (value) USING BTREE","table":"semaphore","columns":["value"],"comment":""},{"name":"PRIMARY","def":"PRIMARY KEY (name) USING BTREE","table":"semaphore","columns":["name"],"comment":""}],"constraints":[{"name":"PRIMARY","type":"PRIMARY KEY","def":"PRIMARY KEY (name)","table":"semaphore","referenced_table":null,"columns":["name"],"referenced_columns":null,"comment":""}],"triggers":[],"def":"CREATE TABLE `semaphore` (\n  `name` varchar(255) CHARACTER SET ascii COLLATE ascii_general_ci NOT NULL DEFAULT '' COMMENT 'Primary Key: Unique name.',\n  `value` varchar(255) CHARACTER SET ascii COLLATE ascii_general_ci NOT NULL DEFAULT '' COMMENT 'A value for the semaphore.',\n  `expire` double NOT NULL COMMENT 'A Unix timestamp with microseconds indicating when the semaphore should expire.',\n  PRIMARY KEY (`name`),\n  KEY `value` (`value`),\n  KEY `expire` (`expire`)\n) ENGINE=InnoDB DEFAULT CHARSET=utf8mb4 COLLATE=utf8mb4_general_ci COMMENT='Table for holding semaphores, locks, flags, etc. that…'"},{"name":"sequences","type":"BASE TABLE","comment":"Stores IDs.","columns":[{"name":"value","type":"int(10) unsigned","nullable":false,"default":null,"comment":"The value of the sequence.","extra_def":"auto_increment"}],"indexes":[{"name":"PRIMARY","def":"PRIMARY KEY (value) USING BTREE","table":"sequences","columns":["value"],"comment":""}],"constraints":[{"name":"PRIMARY","type":"PRIMARY KEY","def":"PRIMARY KEY (value)","table":"sequences","referenced_table":null,"columns":["value"],"referenced_columns":null,"comment":""}],"triggers":[],"def":"CREATE TABLE `sequences` (\n  `value` int(10) unsigned NOT NULL AUTO_INCREMENT COMMENT 'The value of the sequence.',\n  PRIMARY KEY (`value`)\n) ENGINE=InnoDB AUTO_INCREMENT=[Redacted by tbls] DEFAULT CHARSET=utf8mb4 COLLATE=utf8mb4_general_ci COMMENT='Stores IDs.'"},{"name":"sessions","type":"BASE TABLE","comment":"Drupal's session handlers read and write into the sessions…","columns":[{"name":"uid","type":"int(10) unsigned","nullable":false,"default":null,"comment":"The \"users\".uid corresponding to a session, or 0 for anonymous user."},{"name":"sid","type":"varchar(128)","nullable":false,"default":null,"comment":"A session ID (hashed). The value is generated by Drupal's session handlers."},{"name":"hostname","type":"varchar(128)","nullable":false,"default":"''","comment":"The IP address that last used this session ID (sid)."},{"name":"timestamp","type":"int(11)","nullable":false,"default":"0","comment":"The Unix timestamp when this session last requested a page. Old records are purged by PHP automatically."},{"name":"session","type":"longblob","nullable":true,"default":"NULL","comment":"The serialized contents of the user's session, an array of name/value pairs that persists across page requests by this session ID. Drupal loads the user's session from here at the start of each request and saves it at the end."}],"indexes":[{"name":"timestamp","def":"KEY timestamp (timestamp) USING BTREE","table":"sessions","columns":["timestamp"],"comment":""},{"name":"uid","def":"KEY uid (uid) USING BTREE","table":"sessions","columns":["uid"],"comment":""},{"name":"PRIMARY","def":"PRIMARY KEY (sid) USING BTREE","table":"sessions","columns":["sid"],"comment":""}],"constraints":[{"name":"PRIMARY","type":"PRIMARY KEY","def":"PRIMARY KEY (sid)","table":"sessions","referenced_table":null,"columns":["sid"],"referenced_columns":null,"comment":""}],"triggers":[],"def":"CREATE TABLE `sessions` (\n  `uid` int(10) unsigned NOT NULL COMMENT 'The \"users\".uid corresponding to a session, or 0 for anonymous user.',\n  `sid` varchar(128) CHARACTER SET ascii COLLATE ascii_general_ci NOT NULL COMMENT 'A session ID (hashed). The value is generated by Drupal''s session handlers.',\n  `hostname` varchar(128) CHARACTER SET ascii COLLATE ascii_general_ci NOT NULL DEFAULT '' COMMENT 'The IP address that last used this session ID (sid).',\n  `timestamp` int(11) NOT NULL DEFAULT 0 COMMENT 'The Unix timestamp when this session last requested a page. Old records are purged by PHP automatically.',\n  `session` longblob DEFAULT NULL COMMENT 'The serialized contents of the user''s session, an array of name/value pairs that persists across page requests by this session ID. Drupal loads the user''s session from here at the start of each request and saves it at the end.',\n  PRIMARY KEY (`sid`),\n  KEY `timestamp` (`timestamp`),\n  KEY `uid` (`uid`)\n) ENGINE=InnoDB DEFAULT CHARSET=utf8mb4 COLLATE=utf8mb4_general_ci COMMENT='Drupal''s session handlers read and write into the sessions…'"},{"name":"shortcut","type":"BASE TABLE","comment":"The base table for shortcut entities.","columns":[{"name":"id","type":"int(10) unsigned","nullable":false,"default":null,"comment":"","extra_def":"auto_increment"},{"name":"shortcut_set","type":"varchar(32)","nullable":false,"default":null,"comment":"The ID of the target entity."},{"name":"uuid","type":"varchar(128)","nullable":false,"default":null,"comment":""},{"name":"langcode","type":"varchar(12)","nullable":false,"default":null,"comment":""}],"indexes":[{"name":"shortcut_field__shortcut_set__target_id","def":"KEY shortcut_field__shortcut_set__target_id (shortcut_set) USING BTREE","table":"shortcut","columns":["shortcut_set"],"comment":""},{"name":"PRIMARY","def":"PRIMARY KEY (id) USING BTREE","table":"shortcut","columns":["id"],"comment":""},{"name":"shortcut_field__uuid__value","def":"UNIQUE KEY shortcut_field__uuid__value (uuid) USING BTREE","table":"shortcut","columns":["uuid"],"comment":""}],"constraints":[{"name":"PRIMARY","type":"PRIMARY KEY","def":"PRIMARY KEY (id)","table":"shortcut","referenced_table":null,"columns":["id"],"referenced_columns":null,"comment":""},{"name":"shortcut_field__uuid__value","type":"UNIQUE","def":"UNIQUE KEY shortcut_field__uuid__value (uuid)","table":"shortcut","referenced_table":null,"columns":["uuid"],"referenced_columns":null,"comment":""}],"triggers":[],"def":"CREATE TABLE `shortcut` (\n  `id` int(10) unsigned NOT NULL AUTO_INCREMENT,\n  `shortcut_set` varchar(32) CHARACTER SET ascii COLLATE ascii_general_ci NOT NULL COMMENT 'The ID of the target entity.',\n  `uuid` varchar(128) CHARACTER SET ascii COLLATE ascii_general_ci NOT NULL,\n  `langcode` varchar(12) CHARACTER SET ascii COLLATE ascii_general_ci NOT NULL,\n  PRIMARY KEY (`id`),\n  UNIQUE KEY `shortcut_field__uuid__value` (`uuid`),\n  KEY `shortcut_field__shortcut_set__target_id` (`shortcut_set`)\n) ENGINE=InnoDB AUTO_INCREMENT=[Redacted by tbls] DEFAULT CHARSET=utf8mb4 COLLATE=utf8mb4_general_ci COMMENT='The base table for shortcut entities.'"},{"name":"shortcut_field_data","type":"BASE TABLE","comment":"The data table for shortcut entities.","columns":[{"name":"id","type":"int(10) unsigned","nullable":false,"default":null,"comment":""},{"name":"shortcut_set","type":"varchar(32)","nullable":false,"default":null,"comment":"The ID of the target entity."},{"name":"langcode","type":"varchar(12)","nullable":false,"default":null,"comment":""},{"name":"title","type":"varchar(255)","nullable":true,"default":"NULL","comment":""},{"name":"weight","type":"int(11)","nullable":true,"default":"NULL","comment":""},{"name":"link__uri","type":"varchar(2048)","nullable":true,"default":"NULL","comment":"The URI of the link."},{"name":"link__title","type":"varchar(255)","nullable":true,"default":"NULL","comment":"The link text."},{"name":"link__options","type":"longblob","nullable":true,"default":"NULL","comment":"Serialized array of options for the link."},{"name":"default_langcode","type":"tinyint(4)","nullable":false,"default":null,"comment":""}],"indexes":[{"name":"shortcut_field__link__uri","def":"KEY shortcut_field__link__uri (link__uri) USING BTREE","table":"shortcut_field_data","columns":["link__uri"],"comment":""},{"name":"shortcut_field__shortcut_set__target_id","def":"KEY shortcut_field__shortcut_set__target_id (shortcut_set) USING BTREE","table":"shortcut_field_data","columns":["shortcut_set"],"comment":""},{"name":"shortcut__id__default_langcode__langcode","def":"KEY shortcut__id__default_langcode__langcode (id, default_langcode, langcode) USING BTREE","table":"shortcut_field_data","columns":["id","default_langcode","langcode"],"comment":""},{"name":"PRIMARY","def":"PRIMARY KEY (id, langcode) USING BTREE","table":"shortcut_field_data","columns":["id","langcode"],"comment":""}],"constraints":[{"name":"PRIMARY","type":"PRIMARY KEY","def":"PRIMARY KEY (id, langcode)","table":"shortcut_field_data","referenced_table":null,"columns":["id","langcode"],"referenced_columns":null,"comment":""}],"triggers":[],"def":"CREATE TABLE `shortcut_field_data` (\n  `id` int(10) unsigned NOT NULL,\n  `shortcut_set` varchar(32) CHARACTER SET ascii COLLATE ascii_general_ci NOT NULL COMMENT 'The ID of the target entity.',\n  `langcode` varchar(12) CHARACTER SET ascii COLLATE ascii_general_ci NOT NULL,\n  `title` varchar(255) DEFAULT NULL,\n  `weight` int(11) DEFAULT NULL,\n  `link__uri` varchar(2048) DEFAULT NULL COMMENT 'The URI of the link.',\n  `link__title` varchar(255) DEFAULT NULL COMMENT 'The link text.',\n  `link__options` longblob DEFAULT NULL COMMENT 'Serialized array of options for the link.',\n  `default_langcode` tinyint(4) NOT NULL,\n  PRIMARY KEY (`id`,`langcode`),\n  KEY `shortcut__id__default_langcode__langcode` (`id`,`default_langcode`,`langcode`),\n  KEY `shortcut_field__shortcut_set__target_id` (`shortcut_set`),\n  KEY `shortcut_field__link__uri` (`link__uri`(30))\n) ENGINE=InnoDB DEFAULT CHARSET=utf8mb4 COLLATE=utf8mb4_general_ci COMMENT='The data table for shortcut entities.'"},{"name":"shortcut_set_users","type":"BASE TABLE","comment":"Maps users to shortcut sets.","columns":[{"name":"uid","type":"int(10) unsigned","nullable":false,"default":"0","comment":"The \"users\".uid for this set."},{"name":"set_name","type":"varchar(32)","nullable":false,"default":"''","comment":"The \"shortcut_set\".set_name that will be displayed for this user."}],"indexes":[{"name":"set_name","def":"KEY set_name (set_name) USING BTREE","table":"shortcut_set_users","columns":["set_name"],"comment":""},{"name":"PRIMARY","def":"PRIMARY KEY (uid) USING BTREE","table":"shortcut_set_users","columns":["uid"],"comment":""}],"constraints":[{"name":"PRIMARY","type":"PRIMARY KEY","def":"PRIMARY KEY (uid)","table":"shortcut_set_users","referenced_table":null,"columns":["uid"],"referenced_columns":null,"comment":""}],"triggers":[],"def":"CREATE TABLE `shortcut_set_users` (\n  `uid` int(10) unsigned NOT NULL DEFAULT 0 COMMENT 'The \"users\".uid for this set.',\n  `set_name` varchar(32) CHARACTER SET ascii COLLATE ascii_general_ci NOT NULL DEFAULT '' COMMENT 'The \"shortcut_set\".set_name that will be displayed for this user.',\n  PRIMARY KEY (`uid`),\n  KEY `set_name` (`set_name`)\n) ENGINE=InnoDB DEFAULT CHARSET=utf8mb4 COLLATE=utf8mb4_general_ci COMMENT='Maps users to shortcut sets.'"},{"name":"taxonomy_index","type":"BASE TABLE","comment":"Maintains denormalized information about node/term…","columns":[{"name":"nid","type":"int(10) unsigned","nullable":false,"default":"0","comment":"The \"node\".nid this record tracks."},{"name":"tid","type":"int(10) unsigned","nullable":false,"default":"0","comment":"The term ID."},{"name":"status","type":"int(11)","nullable":false,"default":"1","comment":"Boolean indicating whether the node is published (visible to non-administrators)."},{"name":"sticky","type":"tinyint(4)","nullable":true,"default":"0","comment":"Boolean indicating whether the node is sticky."},{"name":"created","type":"int(11)","nullable":false,"default":"0","comment":"The Unix timestamp when the node was created."}],"indexes":[{"name":"term_node","def":"KEY term_node (tid, status, sticky, created) USING BTREE","table":"taxonomy_index","columns":["tid","status","sticky","created"],"comment":""},{"name":"PRIMARY","def":"PRIMARY KEY (nid, tid) USING BTREE","table":"taxonomy_index","columns":["nid","tid"],"comment":""}],"constraints":[{"name":"PRIMARY","type":"PRIMARY KEY","def":"PRIMARY KEY (nid, tid)","table":"taxonomy_index","referenced_table":null,"columns":["nid","tid"],"referenced_columns":null,"comment":""}],"triggers":[],"def":"CREATE TABLE `taxonomy_index` (\n  `nid` int(10) unsigned NOT NULL DEFAULT 0 COMMENT 'The \"node\".nid this record tracks.',\n  `tid` int(10) unsigned NOT NULL DEFAULT 0 COMMENT 'The term ID.',\n  `status` int(11) NOT NULL DEFAULT 1 COMMENT 'Boolean indicating whether the node is published (visible to non-administrators).',\n  `sticky` tinyint(4) DEFAULT 0 COMMENT 'Boolean indicating whether the node is sticky.',\n  `created` int(11) NOT NULL DEFAULT 0 COMMENT 'The Unix timestamp when the node was created.',\n  PRIMARY KEY (`nid`,`tid`),\n  KEY `term_node` (`tid`,`status`,`sticky`,`created`)\n) ENGINE=InnoDB DEFAULT CHARSET=utf8mb4 COLLATE=utf8mb4_general_ci COMMENT='Maintains denormalized information about node/term…'"},{"name":"taxonomy_term_data","type":"BASE TABLE","comment":"The base table for taxonomy_term entities.","columns":[{"name":"tid","type":"int(10) unsigned","nullable":false,"default":null,"comment":"","extra_def":"auto_increment"},{"name":"revision_id","type":"int(10) unsigned","nullable":true,"default":"NULL","comment":""},{"name":"vid","type":"varchar(32)","nullable":false,"default":null,"comment":"The ID of the target entity."},{"name":"uuid","type":"varchar(128)","nullable":false,"default":null,"comment":""},{"name":"langcode","type":"varchar(12)","nullable":false,"default":null,"comment":""}],"indexes":[{"name":"taxonomy_term_field__vid__target_id","def":"KEY taxonomy_term_field__vid__target_id (vid) USING BTREE","table":"taxonomy_term_data","columns":["vid"],"comment":""},{"name":"PRIMARY","def":"PRIMARY KEY (tid) USING BTREE","table":"taxonomy_term_data","columns":["tid"],"comment":""},{"name":"taxonomy_term_field__uuid__value","def":"UNIQUE KEY taxonomy_term_field__uuid__value (uuid) USING BTREE","table":"taxonomy_term_data","columns":["uuid"],"comment":""},{"name":"taxonomy_term__revision_id","def":"UNIQUE KEY taxonomy_term__revision_id (revision_id) USING BTREE","table":"taxonomy_term_data","columns":["revision_id"],"comment":""}],"constraints":[{"name":"PRIMARY","type":"PRIMARY KEY","def":"PRIMARY KEY (tid)","table":"taxonomy_term_data","referenced_table":null,"columns":["tid"],"referenced_columns":null,"comment":""},{"name":"taxonomy_term_field__uuid__value","type":"UNIQUE","def":"UNIQUE KEY taxonomy_term_field__uuid__value (uuid)","table":"taxonomy_term_data","referenced_table":null,"columns":["uuid"],"referenced_columns":null,"comment":""},{"name":"taxonomy_term__revision_id","type":"UNIQUE","def":"UNIQUE KEY taxonomy_term__revision_id (revision_id)","table":"taxonomy_term_data","referenced_table":null,"columns":["revision_id"],"referenced_columns":null,"comment":""}],"triggers":[],"def":"CREATE TABLE `taxonomy_term_data` (\n  `tid` int(10) unsigned NOT NULL AUTO_INCREMENT,\n  `revision_id` int(10) unsigned DEFAULT NULL,\n  `vid` varchar(32) CHARACTER SET ascii COLLATE ascii_general_ci NOT NULL COMMENT 'The ID of the target entity.',\n  `uuid` varchar(128) CHARACTER SET ascii COLLATE ascii_general_ci NOT NULL,\n  `langcode` varchar(12) CHARACTER SET ascii COLLATE ascii_general_ci NOT NULL,\n  PRIMARY KEY (`tid`),\n  UNIQUE KEY `taxonomy_term_field__uuid__value` (`uuid`),\n  UNIQUE KEY `taxonomy_term__revision_id` (`revision_id`),\n  KEY `taxonomy_term_field__vid__target_id` (`vid`)\n) ENGINE=InnoDB DEFAULT CHARSET=utf8mb4 COLLATE=utf8mb4_general_ci COMMENT='The base table for taxonomy_term entities.'"},{"name":"taxonomy_term_field_data","type":"BASE TABLE","comment":"The data table for taxonomy_term entities.","columns":[{"name":"tid","type":"int(10) unsigned","nullable":false,"default":null,"comment":""},{"name":"revision_id","type":"int(10) unsigned","nullable":false,"default":null,"comment":""},{"name":"vid","type":"varchar(32)","nullable":false,"default":null,"comment":"The ID of the target entity."},{"name":"langcode","type":"varchar(12)","nullable":false,"default":null,"comment":""},{"name":"status","type":"tinyint(4)","nullable":false,"default":null,"comment":""},{"name":"name","type":"varchar(255)","nullable":false,"default":null,"comment":""},{"name":"description__value","type":"longtext","nullable":true,"default":"NULL","comment":""},{"name":"description__format","type":"varchar(255)","nullable":true,"default":"NULL","comment":""},{"name":"weight","type":"int(11)","nullable":false,"default":null,"comment":""},{"name":"changed","type":"int(11)","nullable":true,"default":"NULL","comment":""},{"name":"default_langcode","type":"tinyint(4)","nullable":false,"default":null,"comment":""},{"name":"revision_translation_affected","type":"tinyint(4)","nullable":true,"default":"NULL","comment":""}],"indexes":[{"name":"taxonomy_term_field__name","def":"KEY taxonomy_term_field__name (name) USING BTREE","table":"taxonomy_term_field_data","columns":["name"],"comment":""},{"name":"taxonomy_term__id__default_langcode__langcode","def":"KEY taxonomy_term__id__default_langcode__langcode (tid, default_langcode, langcode) USING BTREE","table":"taxonomy_term_field_data","columns":["tid","default_langcode","langcode"],"comment":""},{"name":"taxonomy_term__revision_id","def":"KEY taxonomy_term__revision_id (revision_id) USING BTREE","table":"taxonomy_term_field_data","columns":["revision_id"],"comment":""},{"name":"taxonomy_term__status_vid","def":"KEY taxonomy_term__status_vid (status, vid, tid) USING BTREE","table":"taxonomy_term_field_data","columns":["status","vid","tid"],"comment":""},{"name":"taxonomy_term__tree","def":"KEY taxonomy_term__tree (vid, weight, name) USING BTREE","table":"taxonomy_term_field_data","columns":["vid","weight","name"],"comment":""},{"name":"taxonomy_term__vid_name","def":"KEY taxonomy_term__vid_name (vid, name) USING BTREE","table":"taxonomy_term_field_data","columns":["vid","name"],"comment":""},{"name":"PRIMARY","def":"PRIMARY KEY (tid, langcode) USING BTREE","table":"taxonomy_term_field_data","columns":["tid","langcode"],"comment":""}],"constraints":[{"name":"PRIMARY","type":"PRIMARY KEY","def":"PRIMARY KEY (tid, langcode)","table":"taxonomy_term_field_data","referenced_table":null,"columns":["tid","langcode"],"referenced_columns":null,"comment":""}],"triggers":[],"def":"CREATE TABLE `taxonomy_term_field_data` (\n  `tid` int(10) unsigned NOT NULL,\n  `revision_id` int(10) unsigned NOT NULL,\n  `vid` varchar(32) CHARACTER SET ascii COLLATE ascii_general_ci NOT NULL COMMENT 'The ID of the target entity.',\n  `langcode` varchar(12) CHARACTER SET ascii COLLATE ascii_general_ci NOT NULL,\n  `status` tinyint(4) NOT NULL,\n  `name` varchar(255) NOT NULL,\n  `description__value` longtext DEFAULT NULL,\n  `description__format` varchar(255) CHARACTER SET ascii COLLATE ascii_general_ci DEFAULT NULL,\n  `weight` int(11) NOT NULL,\n  `changed` int(11) DEFAULT NULL,\n  `default_langcode` tinyint(4) NOT NULL,\n  `revision_translation_affected` tinyint(4) DEFAULT NULL,\n  PRIMARY KEY (`tid`,`langcode`),\n  KEY `taxonomy_term__id__default_langcode__langcode` (`tid`,`default_langcode`,`langcode`),\n  KEY `taxonomy_term__revision_id` (`revision_id`),\n  KEY `taxonomy_term_field__name` (`name`(191)),\n  KEY `taxonomy_term__status_vid` (`status`,`vid`,`tid`),\n  KEY `taxonomy_term__tree` (`vid`,`weight`,`name`(191)),\n  KEY `taxonomy_term__vid_name` (`vid`,`name`(191))\n) ENGINE=InnoDB DEFAULT CHARSET=utf8mb4 COLLATE=utf8mb4_general_ci COMMENT='The data table for taxonomy_term entities.'"},{"name":"taxonomy_term_field_revision","type":"BASE TABLE","comment":"The revision data table for taxonomy_term entities.","columns":[{"name":"tid","type":"int(10) unsigned","nullable":false,"default":null,"comment":""},{"name":"revision_id","type":"int(10) unsigned","nullable":false,"default":null,"comment":""},{"name":"langcode","type":"varchar(12)","nullable":false,"default":null,"comment":""},{"name":"status","type":"tinyint(4)","nullable":false,"default":null,"comment":""},{"name":"name","type":"varchar(255)","nullable":true,"default":"NULL","comment":""},{"name":"description__value","type":"longtext","nullable":true,"default":"NULL","comment":""},{"name":"description__format","type":"varchar(255)","nullable":true,"default":"NULL","comment":""},{"name":"changed","type":"int(11)","nullable":true,"default":"NULL","comment":""},{"name":"default_langcode","type":"tinyint(4)","nullable":false,"default":null,"comment":""},{"name":"revision_translation_affected","type":"tinyint(4)","nullable":true,"default":"NULL","comment":""}],"indexes":[{"name":"taxonomy_term_field__description__format","def":"KEY taxonomy_term_field__description__format (description__format) USING BTREE","table":"taxonomy_term_field_revision","columns":["description__format"],"comment":""},{"name":"taxonomy_term__id__default_langcode__langcode","def":"KEY taxonomy_term__id__default_langcode__langcode (tid, default_langcode, langcode) USING BTREE","table":"taxonomy_term_field_revision","columns":["tid","default_langcode","langcode"],"comment":""},{"name":"PRIMARY","def":"PRIMARY KEY (revision_id, langcode) USING BTREE","table":"taxonomy_term_field_revision","columns":["revision_id","langcode"],"comment":""}],"constraints":[{"name":"PRIMARY","type":"PRIMARY KEY","def":"PRIMARY KEY (revision_id, langcode)","table":"taxonomy_term_field_revision","referenced_table":null,"columns":["revision_id","langcode"],"referenced_columns":null,"comment":""}],"triggers":[],"def":"CREATE TABLE `taxonomy_term_field_revision` (\n  `tid` int(10) unsigned NOT NULL,\n  `revision_id` int(10) unsigned NOT NULL,\n  `langcode` varchar(12) CHARACTER SET ascii COLLATE ascii_general_ci NOT NULL,\n  `status` tinyint(4) NOT NULL,\n  `name` varchar(255) DEFAULT NULL,\n  `description__value` longtext DEFAULT NULL,\n  `description__format` varchar(255) CHARACTER SET ascii COLLATE ascii_general_ci DEFAULT NULL,\n  `changed` int(11) DEFAULT NULL,\n  `default_langcode` tinyint(4) NOT NULL,\n  `revision_translation_affected` tinyint(4) DEFAULT NULL,\n  PRIMARY KEY (`revision_id`,`langcode`),\n  KEY `taxonomy_term__id__default_langcode__langcode` (`tid`,`default_langcode`,`langcode`),\n  KEY `taxonomy_term_field__description__format` (`description__format`)\n) ENGINE=InnoDB DEFAULT CHARSET=utf8mb4 COLLATE=utf8mb4_general_ci COMMENT='The revision data table for taxonomy_term entities.'"},{"name":"taxonomy_term_revision","type":"BASE TABLE","comment":"The revision table for taxonomy_term entities.","columns":[{"name":"tid","type":"int(10) unsigned","nullable":false,"default":null,"comment":""},{"name":"revision_id","type":"int(10) unsigned","nullable":false,"default":null,"comment":"","extra_def":"auto_increment"},{"name":"langcode","type":"varchar(12)","nullable":false,"default":null,"comment":""},{"name":"revision_user","type":"int(10) unsigned","nullable":true,"default":"NULL","comment":"The ID of the target entity."},{"name":"revision_created","type":"int(11)","nullable":true,"default":"NULL","comment":""},{"name":"revision_log_message","type":"longtext","nullable":true,"default":"NULL","comment":""},{"name":"revision_default","type":"tinyint(4)","nullable":true,"default":"NULL","comment":""}],"indexes":[{"name":"taxonomy_term_field__revision_user__target_id","def":"KEY taxonomy_term_field__revision_user__target_id (revision_user) USING BTREE","table":"taxonomy_term_revision","columns":["revision_user"],"comment":""},{"name":"taxonomy_term__tid","def":"KEY taxonomy_term__tid (tid) USING BTREE","table":"taxonomy_term_revision","columns":["tid"],"comment":""},{"name":"PRIMARY","def":"PRIMARY KEY (revision_id) USING BTREE","table":"taxonomy_term_revision","columns":["revision_id"],"comment":""}],"constraints":[{"name":"PRIMARY","type":"PRIMARY KEY","def":"PRIMARY KEY (revision_id)","table":"taxonomy_term_revision","referenced_table":null,"columns":["revision_id"],"referenced_columns":null,"comment":""}],"triggers":[],"def":"CREATE TABLE `taxonomy_term_revision` (\n  `tid` int(10) unsigned NOT NULL,\n  `revision_id` int(10) unsigned NOT NULL AUTO_INCREMENT,\n  `langcode` varchar(12) CHARACTER SET ascii COLLATE ascii_general_ci NOT NULL,\n  `revision_user` int(10) unsigned DEFAULT NULL COMMENT 'The ID of the target entity.',\n  `revision_created` int(11) DEFAULT NULL,\n  `revision_log_message` longtext DEFAULT NULL,\n  `revision_default` tinyint(4) DEFAULT NULL,\n  PRIMARY KEY (`revision_id`),\n  KEY `taxonomy_term__tid` (`tid`),\n  KEY `taxonomy_term_field__revision_user__target_id` (`revision_user`)\n) ENGINE=InnoDB DEFAULT CHARSET=utf8mb4 COLLATE=utf8mb4_general_ci COMMENT='The revision table for taxonomy_term entities.'"},{"name":"taxonomy_term_revision__parent","type":"BASE TABLE","comment":"Revision archive storage for taxonomy_term field parent.","columns":[{"name":"bundle","type":"varchar(128)","nullable":false,"default":"''","comment":"The field instance bundle to which this row belongs, used when deleting a field instance"},{"name":"deleted","type":"tinyint(4)","nullable":false,"default":"0","comment":"A boolean indicating whether this data item has been deleted"},{"name":"entity_id","type":"int(10) unsigned","nullable":false,"default":null,"comment":"The entity id this data is attached to"},{"name":"revision_id","type":"int(10) unsigned","nullable":false,"default":null,"comment":"The entity revision id this data is attached to"},{"name":"langcode","type":"varchar(32)","nullable":false,"default":"''","comment":"The language code for this data item."},{"name":"delta","type":"int(10) unsigned","nullable":false,"default":null,"comment":"The sequence number for this data item, used for multi-value fields"},{"name":"parent_target_id","type":"int(10) unsigned","nullable":false,"default":null,"comment":"The ID of the target entity."}],"indexes":[{"name":"bundle","def":"KEY bundle (bundle) USING BTREE","table":"taxonomy_term_revision__parent","columns":["bundle"],"comment":""},{"name":"parent_target_id","def":"KEY parent_target_id (parent_target_id) USING BTREE","table":"taxonomy_term_revision__parent","columns":["parent_target_id"],"comment":""},{"name":"revision_id","def":"KEY revision_id (revision_id) USING BTREE","table":"taxonomy_term_revision__parent","columns":["revision_id"],"comment":""},{"name":"PRIMARY","def":"PRIMARY KEY (entity_id, revision_id, deleted, delta, langcode) USING BTREE","table":"taxonomy_term_revision__parent","columns":["entity_id","revision_id","deleted","delta","langcode"],"comment":""}],"constraints":[{"name":"PRIMARY","type":"PRIMARY KEY","def":"PRIMARY KEY (entity_id, revision_id, deleted, delta, langcode)","table":"taxonomy_term_revision__parent","referenced_table":null,"columns":["entity_id","revision_id","deleted","delta","langcode"],"referenced_columns":null,"comment":""}],"triggers":[],"def":"CREATE TABLE `taxonomy_term_revision__parent` (\n  `bundle` varchar(128) CHARACTER SET ascii COLLATE ascii_general_ci NOT NULL DEFAULT '' COMMENT 'The field instance bundle to which this row belongs, used when deleting a field instance',\n  `deleted` tinyint(4) NOT NULL DEFAULT 0 COMMENT 'A boolean indicating whether this data item has been deleted',\n  `entity_id` int(10) unsigned NOT NULL COMMENT 'The entity id this data is attached to',\n  `revision_id` int(10) unsigned NOT NULL COMMENT 'The entity revision id this data is attached to',\n  `langcode` varchar(32) CHARACTER SET ascii COLLATE ascii_general_ci NOT NULL DEFAULT '' COMMENT 'The language code for this data item.',\n  `delta` int(10) unsigned NOT NULL COMMENT 'The sequence number for this data item, used for multi-value fields',\n  `parent_target_id` int(10) unsigned NOT NULL COMMENT 'The ID of the target entity.',\n  PRIMARY KEY (`entity_id`,`revision_id`,`deleted`,`delta`,`langcode`),\n  KEY `bundle` (`bundle`),\n  KEY `revision_id` (`revision_id`),\n  KEY `parent_target_id` (`parent_target_id`)\n) ENGINE=InnoDB DEFAULT CHARSET=utf8mb4 COLLATE=utf8mb4_general_ci COMMENT='Revision archive storage for taxonomy_term field parent.'"},{"name":"taxonomy_term__parent","type":"BASE TABLE","comment":"Data storage for taxonomy_term field parent.","columns":[{"name":"bundle","type":"varchar(128)","nullable":false,"default":"''","comment":"The field instance bundle to which this row belongs, used when deleting a field instance"},{"name":"deleted","type":"tinyint(4)","nullable":false,"default":"0","comment":"A boolean indicating whether this data item has been deleted"},{"name":"entity_id","type":"int(10) unsigned","nullable":false,"default":null,"comment":"The entity id this data is attached to"},{"name":"revision_id","type":"int(10) unsigned","nullable":false,"default":null,"comment":"The entity revision id this data is attached to"},{"name":"langcode","type":"varchar(32)","nullable":false,"default":"''","comment":"The language code for this data item."},{"name":"delta","type":"int(10) unsigned","nullable":false,"default":null,"comment":"The sequence number for this data item, used for multi-value fields"},{"name":"parent_target_id","type":"int(10) unsigned","nullable":false,"default":null,"comment":"The ID of the target entity."}],"indexes":[{"name":"bundle_delta_target_id","def":"KEY bundle_delta_target_id (bundle, delta, parent_target_id) USING BTREE","table":"taxonomy_term__parent","columns":["bundle","delta","parent_target_id"],"comment":""},{"name":"parent_target_id","def":"KEY parent_target_id (parent_target_id) USING BTREE","table":"taxonomy_term__parent","columns":["parent_target_id"],"comment":""},{"name":"revision_id","def":"KEY revision_id (revision_id) USING BTREE","table":"taxonomy_term__parent","columns":["revision_id"],"comment":""},{"name":"PRIMARY","def":"PRIMARY KEY (entity_id, deleted, delta, langcode) USING BTREE","table":"taxonomy_term__parent","columns":["entity_id","deleted","delta","langcode"],"comment":""}],"constraints":[{"name":"PRIMARY","type":"PRIMARY KEY","def":"PRIMARY KEY (entity_id, deleted, delta, langcode)","table":"taxonomy_term__parent","referenced_table":null,"columns":["entity_id","deleted","delta","langcode"],"referenced_columns":null,"comment":""}],"triggers":[],"def":"CREATE TABLE `taxonomy_term__parent` (\n  `bundle` varchar(128) CHARACTER SET ascii COLLATE ascii_general_ci NOT NULL DEFAULT '' COMMENT 'The field instance bundle to which this row belongs, used when deleting a field instance',\n  `deleted` tinyint(4) NOT NULL DEFAULT 0 COMMENT 'A boolean indicating whether this data item has been deleted',\n  `entity_id` int(10) unsigned NOT NULL COMMENT 'The entity id this data is attached to',\n  `revision_id` int(10) unsigned NOT NULL COMMENT 'The entity revision id this data is attached to',\n  `langcode` varchar(32) CHARACTER SET ascii COLLATE ascii_general_ci NOT NULL DEFAULT '' COMMENT 'The language code for this data item.',\n  `delta` int(10) unsigned NOT NULL COMMENT 'The sequence number for this data item, used for multi-value fields',\n  `parent_target_id` int(10) unsigned NOT NULL COMMENT 'The ID of the target entity.',\n  PRIMARY KEY (`entity_id`,`deleted`,`delta`,`langcode`),\n  KEY `revision_id` (`revision_id`),\n  KEY `parent_target_id` (`parent_target_id`),\n  KEY `bundle_delta_target_id` (`bundle`,`delta`,`parent_target_id`)\n) ENGINE=InnoDB DEFAULT CHARSET=utf8mb4 COLLATE=utf8mb4_general_ci COMMENT='Data storage for taxonomy_term field parent.'"},{"name":"users","type":"BASE TABLE","comment":"The base table for user entities.","columns":[{"name":"uid","type":"int(10) unsigned","nullable":false,"default":null,"comment":"","extra_def":"auto_increment"},{"name":"uuid","type":"varchar(128)","nullable":false,"default":null,"comment":""},{"name":"langcode","type":"varchar(12)","nullable":false,"default":null,"comment":""}],"indexes":[{"name":"PRIMARY","def":"PRIMARY KEY (uid) USING BTREE","table":"users","columns":["uid"],"comment":""},{"name":"user_field__uuid__value","def":"UNIQUE KEY user_field__uuid__value (uuid) USING BTREE","table":"users","columns":["uuid"],"comment":""}],"constraints":[{"name":"PRIMARY","type":"PRIMARY KEY","def":"PRIMARY KEY (uid)","table":"users","referenced_table":null,"columns":["uid"],"referenced_columns":null,"comment":""},{"name":"user_field__uuid__value","type":"UNIQUE","def":"UNIQUE KEY user_field__uuid__value (uuid)","table":"users","referenced_table":null,"columns":["uuid"],"referenced_columns":null,"comment":""}],"triggers":[],"def":"CREATE TABLE `users` (\n  `uid` int(10) unsigned NOT NULL AUTO_INCREMENT,\n  `uuid` varchar(128) CHARACTER SET ascii COLLATE ascii_general_ci NOT NULL,\n  `langcode` varchar(12) CHARACTER SET ascii COLLATE ascii_general_ci NOT NULL,\n  PRIMARY KEY (`uid`),\n  UNIQUE KEY `user_field__uuid__value` (`uuid`)\n) ENGINE=InnoDB AUTO_INCREMENT=[Redacted by tbls] DEFAULT CHARSET=utf8mb4 COLLATE=utf8mb4_general_ci COMMENT='The base table for user entities.'"},{"name":"users_data","type":"BASE TABLE","comment":"Stores module data as key/value pairs per user.","columns":[{"name":"uid","type":"int(10) unsigned","nullable":false,"default":"0","comment":"The \"users\".uid this record affects."},{"name":"module","type":"varchar(50)","nullable":false,"default":"''","comment":"The name of the module declaring the variable."},{"name":"name","type":"varchar(128)","nullable":false,"default":"''","comment":"The identifier of the data."},{"name":"value","type":"longblob","nullable":true,"default":"NULL","comment":"The value."},{"name":"serialized","type":"tinyint(3) unsigned","nullable":true,"default":"0","comment":"Whether value is serialized."}],"indexes":[{"name":"module","def":"KEY module (module) USING BTREE","table":"users_data","columns":["module"],"comment":""},{"name":"name","def":"KEY name (name) USING BTREE","table":"users_data","columns":["name"],"comment":""},{"name":"PRIMARY","def":"PRIMARY KEY (uid, module, name) USING BTREE","table":"users_data","columns":["uid","module","name"],"comment":""}],"constraints":[{"name":"PRIMARY","type":"PRIMARY KEY","def":"PRIMARY KEY (uid, module, name)","table":"users_data","referenced_table":null,"columns":["uid","module","name"],"referenced_columns":null,"comment":""}],"triggers":[],"def":"CREATE TABLE `users_data` (\n  `uid` int(10) unsigned NOT NULL DEFAULT 0 COMMENT 'The \"users\".uid this record affects.',\n  `module` varchar(50) CHARACTER SET ascii COLLATE ascii_general_ci NOT NULL DEFAULT '' COMMENT 'The name of the module declaring the variable.',\n  `name` varchar(128) CHARACTER SET ascii COLLATE ascii_general_ci NOT NULL DEFAULT '' COMMENT 'The identifier of the data.',\n  `value` longblob DEFAULT NULL COMMENT 'The value.',\n  `serialized` tinyint(3) unsigned DEFAULT 0 COMMENT 'Whether value is serialized.',\n  PRIMARY KEY (`uid`,`module`,`name`),\n  KEY `module` (`module`),\n  KEY `name` (`name`)\n) ENGINE=InnoDB DEFAULT CHARSET=utf8mb4 COLLATE=utf8mb4_general_ci COMMENT='Stores module data as key/value pairs per user.'"},{"name":"users_field_data","type":"BASE TABLE","comment":"The data table for user entities.","columns":[{"name":"uid","type":"int(10) unsigned","nullable":false,"default":null,"comment":""},{"name":"langcode","type":"varchar(12)","nullable":false,"default":null,"comment":""},{"name":"preferred_langcode","type":"varchar(12)","nullable":true,"default":"NULL","comment":""},{"name":"preferred_admin_langcode","type":"varchar(12)","nullable":true,"default":"NULL","comment":""},{"name":"name","type":"varchar(60)","nullable":false,"default":null,"comment":""},{"name":"pass","type":"varchar(255)","nullable":true,"default":"NULL","comment":""},{"name":"mail","type":"varchar(254)","nullable":true,"default":"NULL","comment":""},{"name":"timezone","type":"varchar(32)","nullable":true,"default":"NULL","comment":""},{"name":"status","type":"tinyint(4)","nullable":true,"default":"NULL","comment":""},{"name":"created","type":"int(11)","nullable":false,"default":null,"comment":""},{"name":"changed","type":"int(11)","nullable":true,"default":"NULL","comment":""},{"name":"access","type":"int(11)","nullable":false,"default":null,"comment":""},{"name":"login","type":"int(11)","nullable":true,"default":"NULL","comment":""},{"name":"init","type":"varchar(254)","nullable":true,"default":"NULL","comment":""},{"name":"default_langcode","type":"tinyint(4)","nullable":false,"default":null,"comment":""}],"indexes":[{"name":"user_field__access","def":"KEY user_field__access (access) USING BTREE","table":"users_field_data","columns":["access"],"comment":""},{"name":"user_field__created","def":"KEY user_field__created (created) USING BTREE","table":"users_field_data","columns":["created"],"comment":""},{"name":"user_field__mail","def":"KEY user_field__mail (mail) USING BTREE","table":"users_field_data","columns":["mail"],"comment":""},{"name":"user__id__default_langcode__langcode","def":"KEY user__id__default_langcode__langcode (uid, default_langcode, langcode) USING BTREE","table":"users_field_data","columns":["uid","default_langcode","langcode"],"comment":""},{"name":"PRIMARY","def":"PRIMARY KEY (uid, langcode) USING BTREE","table":"users_field_data","columns":["uid","langcode"],"comment":""},{"name":"user__name","def":"UNIQUE KEY user__name (name, langcode) USING BTREE","table":"users_field_data","columns":["name","langcode"],"comment":""}],"constraints":[{"name":"PRIMARY","type":"PRIMARY KEY","def":"PRIMARY KEY (uid, langcode)","table":"users_field_data","referenced_table":null,"columns":["uid","langcode"],"referenced_columns":null,"comment":""},{"name":"user__name","type":"UNIQUE","def":"UNIQUE KEY user__name (name, langcode)","table":"users_field_data","referenced_table":null,"columns":["name","langcode"],"referenced_columns":null,"comment":""}],"triggers":[],"def":"CREATE TABLE `users_field_data` (\n  `uid` int(10) unsigned NOT NULL,\n  `langcode` varchar(12) CHARACTER SET ascii COLLATE ascii_general_ci NOT NULL,\n  `preferred_langcode` varchar(12) CHARACTER SET ascii COLLATE ascii_general_ci DEFAULT NULL,\n  `preferred_admin_langcode` varchar(12) CHARACTER SET ascii COLLATE ascii_general_ci DEFAULT NULL,\n  `name` varchar(60) NOT NULL,\n  `pass` varchar(255) DEFAULT NULL,\n  `mail` varchar(254) DEFAULT NULL,\n  `timezone` varchar(32) DEFAULT NULL,\n  `status` tinyint(4) DEFAULT NULL,\n  `created` int(11) NOT NULL,\n  `changed` int(11) DEFAULT NULL,\n  `access` int(11) NOT NULL,\n  `login` int(11) DEFAULT NULL,\n  `init` varchar(254) DEFAULT NULL,\n  `default_langcode` tinyint(4) NOT NULL,\n  PRIMARY KEY (`uid`,`langcode`),\n  UNIQUE KEY `user__name` (`name`,`langcode`),\n  KEY `user__id__default_langcode__langcode` (`uid`,`default_langcode`,`langcode`),\n  KEY `user_field__mail` (`mail`(191)),\n  KEY `user_field__created` (`created`),\n  KEY `user_field__access` (`access`)\n) ENGINE=InnoDB DEFAULT CHARSET=utf8mb4 COLLATE=utf8mb4_general_ci COMMENT='The data table for user entities.'"},{"name":"user__roles","type":"BASE TABLE","comment":"Data storage for user field roles.","columns":[{"name":"bundle","type":"varchar(128)","nullable":false,"default":"''","comment":"The field instance bundle to which this row belongs, used when deleting a field instance"},{"name":"deleted","type":"tinyint(4)","nullable":false,"default":"0","comment":"A boolean indicating whether this data item has been deleted"},{"name":"entity_id","type":"int(10) unsigned","nullable":false,"default":null,"comment":"The entity id this data is attached to"},{"name":"revision_id","type":"int(10) unsigned","nullable":false,"default":null,"comment":"The entity revision id this data is attached to, which for an unversioned entity type is the same as the entity id"},{"name":"langcode","type":"varchar(32)","nullable":false,"default":"''","comment":"The language code for this data item."},{"name":"delta","type":"int(10) unsigned","nullable":false,"default":null,"comment":"The sequence number for this data item, used for multi-value fields"},{"name":"roles_target_id","type":"varchar(255)","nullable":false,"default":null,"comment":"The ID of the target entity."}],"indexes":[{"name":"bundle","def":"KEY bundle (bundle) USING BTREE","table":"user__roles","columns":["bundle"],"comment":""},{"name":"revision_id","def":"KEY revision_id (revision_id) USING BTREE","table":"user__roles","columns":["revision_id"],"comment":""},{"name":"roles_target_id","def":"KEY roles_target_id (roles_target_id) USING BTREE","table":"user__roles","columns":["roles_target_id"],"comment":""},{"name":"PRIMARY","def":"PRIMARY KEY (entity_id, deleted, delta, langcode) USING BTREE","table":"user__roles","columns":["entity_id","deleted","delta","langcode"],"comment":""}],"constraints":[{"name":"PRIMARY","type":"PRIMARY KEY","def":"PRIMARY KEY (entity_id, deleted, delta, langcode)","table":"user__roles","referenced_table":null,"columns":["entity_id","deleted","delta","langcode"],"referenced_columns":null,"comment":""}],"triggers":[],"def":"CREATE TABLE `user__roles` (\n  `bundle` varchar(128) CHARACTER SET ascii COLLATE ascii_general_ci NOT NULL DEFAULT '' COMMENT 'The field instance bundle to which this row belongs, used when deleting a field instance',\n  `deleted` tinyint(4) NOT NULL DEFAULT 0 COMMENT 'A boolean indicating whether this data item has been deleted',\n  `entity_id` int(10) unsigned NOT NULL COMMENT 'The entity id this data is attached to',\n  `revision_id` int(10) unsigned NOT NULL COMMENT 'The entity revision id this data is attached to, which for an unversioned entity type is the same as the entity id',\n  `langcode` varchar(32) CHARACTER SET ascii COLLATE ascii_general_ci NOT NULL DEFAULT '' COMMENT 'The language code for this data item.',\n  `delta` int(10) unsigned NOT NULL COMMENT 'The sequence number for this data item, used for multi-value fields',\n  `roles_target_id` varchar(255) CHARACTER SET ascii COLLATE ascii_general_ci NOT NULL COMMENT 'The ID of the target entity.',\n  PRIMARY KEY (`entity_id`,`deleted`,`delta`,`langcode`),\n  KEY `bundle` (`bundle`),\n  KEY `revision_id` (`revision_id`),\n  KEY `roles_target_id` (`roles_target_id`)\n) ENGINE=InnoDB DEFAULT CHARSET=utf8mb4 COLLATE=utf8mb4_general_ci COMMENT='Data storage for user field roles.'"},{"name":"user__user_picture","type":"BASE TABLE","comment":"Data storage for user field user_picture.","columns":[{"name":"bundle","type":"varchar(128)","nullable":false,"default":"''","comment":"The field instance bundle to which this row belongs, used when deleting a field instance"},{"name":"deleted","type":"tinyint(4)","nullable":false,"default":"0","comment":"A boolean indicating whether this data item has been deleted"},{"name":"entity_id","type":"int(10) unsigned","nullable":false,"default":null,"comment":"The entity id this data is attached to"},{"name":"revision_id","type":"int(10) unsigned","nullable":false,"default":null,"comment":"The entity revision id this data is attached to, which for an unversioned entity type is the same as the entity id"},{"name":"langcode","type":"varchar(32)","nullable":false,"default":"''","comment":"The language code for this data item."},{"name":"delta","type":"int(10) unsigned","nullable":false,"default":null,"comment":"The sequence number for this data item, used for multi-value fields"},{"name":"user_picture_target_id","type":"int(10) unsigned","nullable":false,"default":null,"comment":"The ID of the file entity."},{"name":"user_picture_alt","type":"varchar(512)","nullable":true,"default":"NULL","comment":"Alternative image text, for the image's 'alt' attribute."},{"name":"user_picture_title","type":"varchar(1024)","nullable":true,"default":"NULL","comment":"Image title text, for the image's 'title' attribute."},{"name":"user_picture_width","type":"int(10) unsigned","nullable":true,"default":"NULL","comment":"The width of the image in pixels."},{"name":"user_picture_height","type":"int(10) unsigned","nullable":true,"default":"NULL","comment":"The height of the image in pixels."}],"indexes":[{"name":"bundle","def":"KEY bundle (bundle) USING BTREE","table":"user__user_picture","columns":["bundle"],"comment":""},{"name":"revision_id","def":"KEY revision_id (revision_id) USING BTREE","table":"user__user_picture","columns":["revision_id"],"comment":""},{"name":"user_picture_target_id","def":"KEY user_picture_target_id (user_picture_target_id) USING BTREE","table":"user__user_picture","columns":["user_picture_target_id"],"comment":""},{"name":"PRIMARY","def":"PRIMARY KEY (entity_id, deleted, delta, langcode) USING BTREE","table":"user__user_picture","columns":["entity_id","deleted","delta","langcode"],"comment":""}],"constraints":[{"name":"PRIMARY","type":"PRIMARY KEY","def":"PRIMARY KEY (entity_id, deleted, delta, langcode)","table":"user__user_picture","referenced_table":null,"columns":["entity_id","deleted","delta","langcode"],"referenced_columns":null,"comment":""}],"triggers":[],"def":"CREATE TABLE `user__user_picture` (\n  `bundle` varchar(128) CHARACTER SET ascii COLLATE ascii_general_ci NOT NULL DEFAULT '' COMMENT 'The field instance bundle to which this row belongs, used when deleting a field instance',\n  `deleted` tinyint(4) NOT NULL DEFAULT 0 COMMENT 'A boolean indicating whether this data item has been deleted',\n  `entity_id` int(10) unsigned NOT NULL COMMENT 'The entity id this data is attached to',\n  `revision_id` int(10) unsigned NOT NULL COMMENT 'The entity revision id this data is attached to, which for an unversioned entity type is the same as the entity id',\n  `langcode` varchar(32) CHARACTER SET ascii COLLATE ascii_general_ci NOT NULL DEFAULT '' COMMENT 'The language code for this data item.',\n  `delta` int(10) unsigned NOT NULL COMMENT 'The sequence number for this data item, used for multi-value fields',\n  `user_picture_target_id` int(10) unsigned NOT NULL COMMENT 'The ID of the file entity.',\n  `user_picture_alt` varchar(512) DEFAULT NULL COMMENT 'Alternative image text, for the image''s ''alt'' attribute.',\n  `user_picture_title` varchar(1024) DEFAULT NULL COMMENT 'Image title text, for the image''s ''title'' attribute.',\n  `user_picture_width` int(10) unsigned DEFAULT NULL COMMENT 'The width of the image in pixels.',\n  `user_picture_height` int(10) unsigned DEFAULT NULL COMMENT 'The height of the image in pixels.',\n  PRIMARY KEY (`entity_id`,`deleted`,`delta`,`langcode`),\n  KEY `bundle` (`bundle`),\n  KEY `revision_id` (`revision_id`),\n  KEY `user_picture_target_id` (`user_picture_target_id`)\n) ENGINE=InnoDB DEFAULT CHARSET=utf8mb4 COLLATE=utf8mb4_general_ci COMMENT='Data storage for user field user_picture.'"},{"name":"watchdog","type":"BASE TABLE","comment":"Table that contains logs of all system events.","columns":[{"name":"wid","type":"int(11)","nullable":false,"default":null,"comment":"Primary Key: Unique watchdog event ID.","extra_def":"auto_increment"},{"name":"uid","type":"int(10) unsigned","nullable":false,"default":"0","comment":"The \"users\".uid of the user who triggered the event."},{"name":"type","type":"varchar(64)","nullable":false,"default":"''","comment":"Type of log message, for example \"user\" or \"page not found.\""},{"name":"message","type":"longtext","nullable":false,"default":null,"comment":"Text of log message to be passed into the t() function."},{"name":"variables","type":"longblob","nullable":false,"default":null,"comment":"Serialized array of variables that match the message string and that is passed into the t() function."},{"name":"severity","type":"tinyint(3) unsigned","nullable":false,"default":"0","comment":"The severity level of the event. ranges from 0 (Emergency) to 7 (Debug)"},{"name":"link","type":"text","nullable":true,"default":"NULL","comment":"Link to view the result of the event."},{"name":"location","type":"text","nullable":false,"default":null,"comment":"URL of the origin of the event."},{"name":"referer","type":"text","nullable":true,"default":"NULL","comment":"URL of referring page."},{"name":"hostname","type":"varchar(128)","nullable":false,"default":"''","comment":"Hostname of the user who triggered the event."},{"name":"timestamp","type":"int(11)","nullable":false,"default":"0","comment":"Unix timestamp of when event occurred."}],"indexes":[{"name":"severity","def":"KEY severity (severity) USING BTREE","table":"watchdog","columns":["severity"],"comment":""},{"name":"type","def":"KEY type (type) USING BTREE","table":"watchdog","columns":["type"],"comment":""},{"name":"uid","def":"KEY uid (uid) USING BTREE","table":"watchdog","columns":["uid"],"comment":""},{"name":"PRIMARY","def":"PRIMARY KEY (wid) USING BTREE","table":"watchdog","columns":["wid"],"comment":""}],"constraints":[{"name":"PRIMARY","type":"PRIMARY KEY","def":"PRIMARY KEY (wid)","table":"watchdog","referenced_table":null,"columns":["wid"],"referenced_columns":null,"comment":""}],"triggers":[],"def":"CREATE TABLE `watchdog` (\n  `wid` int(11) NOT NULL AUTO_INCREMENT COMMENT 'Primary Key: Unique watchdog event ID.',\n  `uid` int(10) unsigned NOT NULL DEFAULT 0 COMMENT 'The \"users\".uid of the user who triggered the event.',\n  `type` varchar(64) CHARACTER SET ascii COLLATE ascii_general_ci NOT NULL DEFAULT '' COMMENT 'Type of log message, for example \"user\" or \"page not found.\"',\n  `message` longtext NOT NULL COMMENT 'Text of log message to be passed into the t() function.',\n  `variables` longblob NOT NULL COMMENT 'Serialized array of variables that match the message string and that is passed into the t() function.',\n  `severity` tinyint(3) unsigned NOT NULL DEFAULT 0 COMMENT 'The severity level of the event. ranges from 0 (Emergency) to 7 (Debug)',\n  `link` text DEFAULT NULL COMMENT 'Link to view the result of the event.',\n  `location` text NOT NULL COMMENT 'URL of the origin of the event.',\n  `referer` text DEFAULT NULL COMMENT 'URL of referring page.',\n  `hostname` varchar(128) CHARACTER SET ascii COLLATE ascii_general_ci NOT NULL DEFAULT '' COMMENT 'Hostname of the user who triggered the event.',\n  `timestamp` int(11) NOT NULL DEFAULT 0 COMMENT 'Unix timestamp of when event occurred.',\n  PRIMARY KEY (`wid`),\n  KEY `type` (`type`),\n  KEY `uid` (`uid`),\n  KEY `severity` (`severity`)\n) ENGINE=InnoDB AUTO_INCREMENT=[Redacted by tbls] DEFAULT CHARSET=utf8mb4 COLLATE=utf8mb4_general_ci COMMENT='Table that contains logs of all system events.'"}],"relations":[],"functions":[],"driver":{"name":"mariadb","database_version":"10.4.28-MariaDB-1:10.4.28+maria~ubu2004-log","meta":{"dict":{"Functions":"Stored procedures and functions"}}}}
